text,start,end
แล้วก็คำว่าต้นน้ำเดินไปน้ำเนี่ย,745.192,747.258
จะมีไทยหลอดแทนยื่น,752.106,753.594
ความการวิจัยแล้วก็พัฒนา,753.642,755.034
หลังจากนั้นก็จะมีการผลิตนะครับ,755.562,757.626
ทั้งฟอร์ม่าแล้วก็มีการพิจารณา,758.154,760.506
คุณออกไปทาง,760.938,761.946
ดับรูปไฟล์,762.186,763.482
เสิร์ฟไม่ใช่น้ำมันปากก็ไม่ใช่สำอาง,764.202,766.746
ความสนใจเรื่องแล้วก็เจอผลิตนะครับ,767.37,769.242
ไปน้ำไปสิบวันเราก็มีหลังใช้ยา,769.578,771.45
แต่ก็มีโรงพยาบาลอยู่ในแต่งที่เรา,772.266,774.33
รูป นะ คือ เปอร์เซ็นต์ นะ ผม,774.378,775.674
พูดถึงกรณีโรงงานยุทธยาปัจจุบันแล้วก็,778.986,781.434
Fill capacity ได้,781.674,783.354
มากยิ่งเนื่องจากการที่เราก็จะ,783.498,785.73
ไปคุยหาฟาร์ดเลอร์ชิปเพิ่มนะครับ,785.73,787.962
ซึ่งก็ยังเป็น on-trowing process อยู่เรื่อยๆนะครับ,788.778,792.09
หรือว่านักลงทุนหลายท่านก็มีได้ไป,792.81,794.9449999999999
ถึงครับในแง่ของปลายน้ำเนี่ยปัจจุบันเนี่ย,794.9449999999999,797.2739999999999
เขามาซื้อแล้วก็มีการขยายเพิ่มอีก,798.474,800.5540000000001
 7 สาขาในปีนี้ก็เป็น 27 สาขา,800.5540000000001,802.8420000000001
แล้วก็คิดว่าถึงสิ้นปีนะครับเพราะเอาจริงจริงแล้วเราสามสิบห้า,803.85,807.642
แต่น่าจะจบที่ประมาณสามสิบถึงสามเท่าที่เป็นหลักชาติ,807.978,810.81
กับแสดงหลอดอย่างความพิเศษแต่ไม่สมพื้นที่,813.834,817.242
เพราะเรื่องของการที่จะต้องได้รับไป,818.25,820.914
หรือยาติยาก็ต้องใช้เวลาด้วย,820.914,823.578
ในการยื่นของออกยอมในการเจ็บป่วยก้าวทุกอย่าง,823.722,826.17
อันนี้ก็จะเป็นสาขาใหม่ใหม่นะครับที่เราจะ,831.018,833.9150000000001
เปิด หรือต้องบอกนะครับที่เอ่อเพิ่งเปิดไปนะครับเมื่อเมื่อ,833.9150000000001,837.018
วันที่ยี่สิบเจ็ดกันยาย,838.794,841.338
ตรงนี้ก็เป็นสามครับ สี่ นั่นสี่ยี่สิบ,842.346,845.082
เป็นสัปดาห์ที่แปด,845.994,847.194
แล้วก็ยังมีสาขาใหม่ที่เราจะเปิดร่วมกับภาวะเศรษฐกิจ,849.834,853.05
หรือสถานีน้ำมันทองตะทองเนี่ย,853.29,855.834
ในในไทยมากน่าสนใจ,858.474,860.058
เปิดเดือนหน้าเป็นตุลาคม,860.106,861.498
กด พิมพ์ ภาวนี บวก สิบ สอง,867.498,869.082
อันนี้จะเป็นสัตว์ครับ รุ่นแบบของสัตว์หลีกหลักก่อนก็พอ,869.898,873.594
เหมือนลักษณะคล้าย ๆ คอมมิวนิตี้มอล,873.738,875.61
บริษัทการนึงจะอยู่ที่ 2 แถม,876.042,878.202
ก็แผนที่จะเปิดร่วมกันก็จะอยู่ประมาณ 12 ฝั่ง,879.498,882.81
อ๋อ ขอบคุณครับ,884.682,885.594
มีใช้ได้,885.93,887.13
อยู่ในรูปแบบ,888.042,888.858
ก็คือต้องเติมเติมเติมเติมเติมเติมเติมเติมเติมเติมเติมเติมเติมเติมเติมเติมเติมเติมเติมเติมเติมเติมเติมเติมเติมเติมเติมเติมเติมเติมเติมเติมเติมเติมเติมเติมเติมเติมเติมเติมเติมเติมเติมเติมเติมเติมเติมเติมเติมเติมเติมเติมเติมเติมเติมเติมเติมเติมเติมเติมเติมเติมเติมเติมเติมเติมเติมเติมเติมเติมเติมเติมเติมเติมเติมเติมเติมเติมเติมเติมเติมเติมเติมเติมเติมเติมเติมเติมเติมเติมเติมเติมเติมเติมเติมเติมเติมเติมเติมเติมเติมเติมเติมเติมเติมเติมเติมเติมเติม,888.906,890.682
เผื่อโรงพยาบาลไม่พอครับ,892.17,893.37
นครพัดที่นครสีธรรมูลาปัจจุบันก็กำลังอยู่,893.418,896.824
อินโดเวศน์ ถ้าได้ลงไปที่นครสีธรรมูลาจะเห็นว่า,896.824,900.4739999999999
กำลัง Revolver นะครับในนี้ก็จะ,900.81,902.8979999999999
เป็นภาพว่าหลักกับดอก Revolver เสร็จเนี่ย,902.8979999999999,904.9859999999999
รถจะเป็นโรงพยาบาลระดับมาตรฐานหักศาล,905.322,907.29
เราคิดว่าเรามีเป้าหมายทั้ง,907.914,909.786
ผู้ป่วยชาวไทยแล้วก็ต่างชาตินะครับไม่ว่าจะมาจากกระบี่,911.274,914.612
จากในต่างต่างรวมทั้งนครศรีธรรมราชเองก็เป็นจังหวัดยัง,914.612,917.754
อุณหภูมิภาคก่อนค่อนข้างมาก,918.186,920.058
ก็จะมีโซบิดในไวน์ต่างๆ,921.45,923.418
วงเติบโยวจะเซ็ตเจ็ต,924.522,926.4050000000001
 ครับ ทอมมาสเตอร์ ศูนย์ล้างไป,926.4050000000001,928.6020000000001
ส่วนกันเนาะ หลักภูมิแพ้แล้วก็อย่างงี้ของเอสเซอร์ติกเรื่องความงาม,928.746,932.634
ส่วนสูตรสุขภาพแกลลี่,934.794,937.357
 Beauty Center,937.357,939.0659999999999
ปีที่แล้วเนี่ย อ่อ ยัง,943.434,945.018
หรือว่าหลบก็ได้,945.066,946.554
เซตเตอร์วอร์ดนี้ให้พอร์ตอินโดนีเซีย,946.698,948.954
เป็นบริษัทที่,949.002,950.202
บ๊วย เรียนวัตกรรม,950.538,951.642
ในใหม่โดยเฉพาะเรื่องของโควิด-19 เราก็ยังเป็นผู้นำอยู่,951.978,955.29
แล้วก็อย่างที่เรียนได้แต่ใครมากที่แล้ว,957.45,959.994
ปัจจุบันแล้วก็ทาง TCI ก็เป็นที่ไปฝากในการนำบริษัท,960.042,963.45
และ ธรรมดา หรือ และ แพร์นิเทิลตลาด,963.69,966.234
แล้วก็กดเข้าบริษัท Adversary ในการที่จะ,968.394,971.322
รวมบัตรนักชวนครับช่องตลาด,971.658,973.05
ทีนี้เป้าหมายของบริษัทก็ยังเหมือนเดิมนะครับ,975.114,977.562
เบรกอันนี้ก็,978.186,979.194
จะยังไม่อัปเดตเพราะว่า,979.242,980.634
เรากำลังเอ่อเริ่มทำแผนของห้าปีเมื่อหน้า,981.066,983.778
นะครับคือสองพันยี่สิบสองพันยี่สิบแปด,983.778,986.49
มันมีอักษรอยู่ร้อยล้านในอีกห้าปีก็น่าจะมีการเปลี่ยนแปลงในเป้า,990.954,994.362
แล้วตอนนี้เรายังไปตามแผนมีเรื่องอะไรใหม่ใหม่,999.114,1002.426
แผนอยู่นี่แผนเดิมที่บางอย่าง,1003.434,1005.594
ไม่เวิร์คเราอาจจะต้องเอาออกไปนะครับหรือว่ามีอะไรเล็ง,1006.122,1009.818
เพราะอย่างที่ท่านทราบว่าโลกมันเปลี่ยนแปลงค่อนข้างเร็ว,1009.866,1012.794
วันนี้เราก็เราก็เจอการรีวิวสิทธิ์นะครับเราก็เพิ่งพอสมควร,1013.514,1017.21
ในการที่จะเรียกว่าแผ่น 2024 หรือ 2028,1020.81,1024.218
ปีข้างหน้า,1025.898,1026.714
จริงๆ แล้ว ถ้าเรื่องจากผู้ถือผู้ลอง,1027.242,1030.074
อีกส่วนหนึ่งก็คือทาง บริษัทอังกฤษ,1031.562,1033.7089999999998
ใต้บริษัทอินโดนีเกเชียเนี่ย,1033.7089999999998,1035.6419999999998
ก็ได้มีการรีเควสกระทั่ง,1036.458,1039.29
อินเตอร์ฟาร์ม่อนส์มันถึงว่าอยากได้เป็นแผน 15 ปี,1039.434,1042.266
ซึ่งบุคคลซึ่งเราก็ได้มีการทำแผน,1042.986,1045.458
เป็นสองพันยี่สิบสี่หรือสองพันสามสิบ,1045.458,1047.93
เพราะ 15 ปีข้างหน้าเนี่ยเราจะมีพัฒนาการในเรื่องในต่างๆ,1049.322,1052.922
ซึ่งก็ถูกต้องเลยครับเพราะว่าไม่ว่าจะเป็นธุรกิจน้ำมัน,1054.026,1056.8680000000002
หรือธุรกิจยา มันเป็นธุรกิจที่ค่อนข้างระยะยาว,1056.8680000000002,1059.3540000000003
ใช้เวลาพอสมควร,1059.978,1061.562
ในการจะขึ้นทะเบียนในการจะใช้เทคโนโลยี,1062.858,1065.569
ทางเฟอร์ในการที่จะพัฒนาของวัฏกรรมซึ่งเป็นเป้าหมาย,1065.569,1068.474
ผมมีสัตว์ไประยะยาว,1069.002,1070.394
อันนี้สำหรับ,1075.914,1077.402
ปัจจุบันตอนนี้แต่หน้าสามเลยยังไม่ได้ปิดนะครับ,1077.738,1080.474
ซึ่งข้อมูลขณะการล่าสุดก็ยังเป็นไปมากสอง,1080.714,1084.026
แล้วคือหลายท่านคงทราบดีแล้ว,1085.226,1087.002
แต่ที่เรา,1087.05,1087.962
- บ๊วย- เชิญครับ ไปแล้วนะ,1088.106,1089.498
ก็จะไปเร็วๆ นะครับ,1090.41,1091.706
ก็ก่อนจะก็อยากจะพูดถึงว่า,1093.194,1095.45
คือจริง ๆ แล้วไปมากหนึ่งเนี่ย,1095.882,1098.042
จะอยู่ประมาณสี่ร้อยกว่าล้านแล้วก็กำไรโดนสี่สิบแปด,1098.09,1101.306
แผนโพลอปปีนี้,1103.37,1104.666
อย่างที่ได้เรียนไปนะครับ,1104.81,1106.298
เพราะว่าเอ่อ ตั้งแต่ไปมาตรฐ.234 เนี่ยเราจะเริ่มมีการ,1106.73,1110.426
เอากำไรอีกแล้ว,1111.818,1112.826
ที่ได้เนี่ยไปใช้ในการสร้างแบรนด์อะไรอย่างเงี้ย,1113.066,1115.802
เวลา ภาระ,1118.058,1118.97
ยักษ์สีฟ้าอยู่นะครับ,1119.978,1121.946
ก็โปรแกรมนะครับโปรแกรมซึ่งปัจจุบันภายใต้เกิด,1123.146,1126.194
สำนึงของโปรแกรมเนี้ยก็มีเฉพาะคันค่อนข้างหลากหลาย,1126.194,1129.242
ไปสร้างอยู่แก่นี้,1133.802,1135.098
ซึ่งเรามองว่าการสร้างแบบก็เหมือนการสร้าง intangible asset,1135.722,1138.842
ในเชิงของบัญชีและการเงินเนี่ย,1139.178,1141.05
มันจะตีว่าเป็นค่าใช้จ่าย,1141.482,1143.354
แต่ก็ แล้วก็คิดว่ามันก็จำเป็นนะครับเพราะว่าเรา,1145.13,1148.538
มีแผนที่เราจะเติบโตในระยะกลางจะยาวอยู่,1148.682,1151.61
คิดว่าเราไม่สามารถจะเอาเงินไว้เพื่อ,1153.866,1156.218
โชว์ อ่ากำไรดีแต่ว่าระยะ,1156.266,1158.4260000000002
สั้นดีแต่ระยะกลางไม่ยาว,1158.4260000000002,1160.3460000000002
เราก็ยังอยู่ในช่วงที่จะเป็นการลงทุน,1162.794,1165.17
นะครับในในเรื่องต่างต่างเรียกว่าจะการปรับ,1165.17,1167.546
โครงงานเป็นอียูสแตนดาวน์,1167.882,1169.658
ขยายสัมภาระของร้านแหล่งโทรมาสีการปรับปรุง พยาบาล,1171.05,1174.521
ให้เจอกันทางฝ่าตัวอื่นที่รองรับระยะยาว,1174.521,1177.53
การที่จะสร้างแบรนด์,1178.442,1179.834
ผลิตภัณฑ์ใหม่ใหม่ให้กับผู้มีข้อรับรู้สามารถทิ้ง,1179.882,1183.77
เพราะฉะนั้นอย่าง เอ่อ ตัวนี้ไตรมาสสองเนี่ย เอาจริงจริงแล้ว,1185.354,1188.858
ใช้จ่ายในโฆษณากรรม,1191.786,1193.178
ไปจริงๆ แล้ว,1193.226,1194.234
โดยเฉพาะคำหลักเนี่ยน่าจะไม่ได้แตกต่างจากไปมากเลย,1195.626,1198.65
พอเรามีการเอาเงินกำไร,1199.37,1201.29
มาส่วนไปยิงฆ่า ก็จะทำให้,1201.29,1203.45
เมื่อไรมันเขาล่วงไปมันก็ไป,1203.594,1205.37
ไฮไลท์แซกโฆษณาที่เราเอาไปใช้เลยครับ,1205.61,1207.674
ส่วนไตรมาส 2 เราจะเห็นว่า,1209.066,1211.076
 ริมนิวต่ำกว่าไตรมาส 1 ก็นึก,1211.076,1213.338
ในด้านมาสหนึ่งเนี่ยจะมียอด,1213.482,1215.354
การเจ้าผลิต,1215.402,1216.698
ของเทวา รวมทั้งยอดการจ้างผลิตของบริษัทอินโดบิค,1216.842,1220.2540000000001
ซึ่งเป็นบริษัทรุ่งของ ปตท,1220.2540000000001,1222.074
ในสัญญาณ,1222.986,1224.282
ประกันสอบผลิตด้วยพื้นฐานแล้วจะสอบผลิตเนี้ย,1224.522,1227.546
สำหรับการใช้อย่าง 1 ร้อย 3 เดือนหรือ 6 เดือนนะครับ,1227.978,1231.482
มันก็ไม่ทำให้ใจมากสอง ยังไม่มียอดการเกี่ยว,1231.914,1234.266
สร้างผลิตของตัวเนี้ยของ,1234.602,1235.898
ออฟไลน์อยู่หรืออะไรด้านเนี้ยก็เลย,1236.33,1238.298
ไปจากการที่ไม่มียอดการเจ้าหิน,1238.73,1241.274
ไปหน้าสองแล้วซึ่ง,1241.418,1242.81
มีวันหยุดค่อนข้างเยอะนะครับ,1242.858,1244.346
ปัจจุบันที่ใหม่ไทยเนี่ยก็ก็เป็นเหตุผลในการที่เขาจะต้อง,1244.778,1248.186
เปิดซักบิดให้มันจำนวนปริมาณมาก,1248.618,1250.874
เป็นมาสองก็เลยไม่มี,1251.594,1253.178
แต่ไตรมาสสาม ไตรมาสสี่เนี่ยก็จะมียอดสร้างผลิตกลับเข้ามา,1253.418,1257.114
เขาจะพิวาทกับไปสักพักนั่นเอง,1257.258,1259.706
มีที่สร้างลักษณะอย่างต่าง,1260.234,1261.914
ยังไงให้ 2 สอง,1266.57,1268.442
ฝักสวน,1268.586,1269.594
นะครับ ก็,1270.41,1271.514
ปัจจุบันเนี่ย,1272.042,1272.954
นะครับก็,1274.346,1275.45
ในแง่ของสัดส่วน,1279.626,1281.498
ปัจจุบันทุกท่านก็จะเห็นว่าสัดส่วนของทาง,1284.714,1288.25
ของคนเนี่ยก็จะผลิตของคนก็จะมากขึ้นนะครับ,1288.25,1292.058
แล้วกันที่เรามีร้านแล็บซึ่งเป็นร้านไข่เกียจ,1292.298,1294.362
เราก็ เราก็จะเห็นว่า,1296.618,1298.97
สัดส่วนของ,1299.018,1299.93
สำหรับข้อเนี่ยเป็น 67.5% นะครับ,1300.362,1302.81
หลักฝ่ายเนี่ยอยู่ประมาณ 20% แล้วก็โรง,1303.05,1305.474
พยาบาลเนี่ยประมาณ 12.7% นะครับ,1305.474,1307.898
ถ้าเกิดเอ่อในแง่ของ,1310.634,1312.602
มองดี 6 เดือนนะครับก็,1313.226,1315.77
รายได้ก็จะโต 35% นะครับ,1316.106,1318.458
ถูกต้องค่ะ,1319.082,1320.09
สิกเมนต์นะครับ หรือเมื่อกี้มัน,1320.618,1322.754
เป็นรายเต็มนะเอ่อเต็มล่ะ สอง,1322.754,1324.8899999999999
อย่างเงี้ยฟิล์มเบนต์ก็จะเห็นว่า,1325.322,1327.002
ของคนก็จะอยู่ที่ 69% นะครับ ของสัตว์,1331.274,1334.154
จะอยู่ที่ 19% แล้วก็โรงพยาบาลเหลือ 12%,1334.154,1337.274
Cost Profit นะครับ,1339.722,1341.018
เพราะจริงๆแล้วเราจะเห็นว่าความคุ้มค่าเนี่ยดี ดีขึ้นนะครับ,1341.066,1344.378
จาก เพลิง,1344.906,1345.914
ไม่ว่าจะเป็นทั้งของคนแล้วก็ของสัตว์,1346.442,1348.986
กลุ่มคนเนี่ยจะเห็นว่า cost profit,1349.226,1351.29
ในตำนานฝั่ง 37 ถึง 39 นะครับ,1351.434,1354.362
แล้วก็ของสัตว์ก็ 36.7 เป็น 39.8,1354.986,1358.586
ถ้าในแง่ของหกเดือน,1359.306,1360.698
ก็ใช้ 41.2 ไม่ 41.4 นะครับ,1361.13,1364.73
ของสัตว์นี้ 36 เป็น 38% นะครับ,1365.354,1368.282
จริงๆเราก็จะเห็นว่าการอัตรากำไรขั้นต้น,1369.194,1372.674
ก็ยังอยู่ในเก้าอี้ขึ้นกับเงินเล็กน้อยนะครับ,1372.674,1376.154
เพราะฉะนั้นปัญหาก็จะอยู่ที่ว่าการใช้อีกตัว,1377.354,1380.621
 Trading Expense ที่จะเป็นตัวที่จะกระทบ Net Profit,1380.621,1384.122
เป็นอย่างนี้เปอร์เซ็นต์ซื้อดีนะครับเราก็จะอยู่ใกล้เคียงข้างข้าง,1385.706,1389.498
เราจะเห็นว่า Feeling and Administrative Expansion เนี่ย,1392.042,1395.258
ไปหน้าฝั่งก็จะกระจกทิ้งมาเลยนะจ้ะ,1395.498,1397.85
27% ในไทยบ้านหนึ่งใช้เป็น 33%,1398.378,1401.402
แล้วก็,1402.602,1403.418
หรือสำหรับฮาม 1 ก็จะ,1403.562,1405.6499999999999
จาก 29 เป็น 30% นะครับ,1405.6499999999999,1407.7379999999998
นะฮะ ดังนั้นตอนนี้เน็ตโปรฟิกก็เลยทำให้เต็มหน้าแล้ว,1410.57,1413.402
เพราะหลายๆแบรนด์,1418.154,1419.738
ก็เลยขอเวลาที่เหลือนะครับก็จะเป็นช่วงของ,1423.914,1427.322
ผมจำได้ว่าหรือออฟฟิศที่นี่เอง ภาพที่แล้วเนี่ยก็ตอบไม่ทันนะครับ,1430.442,1434.426
ก็เลยพยายามเอ่อลุกให้เสร็จเร็วนะครับก็จะได้เป็นพาร์ท QA,1435.146,1439.13
พ่อมีคำถามนะครับว่า,1439.37,1441.05
จากการกู้เงินนะครับว่าเนื้อปัจจุบันเนี่ย,1441.674,1444.506
ธุรกิจร้านขยาที่เป็นรายใหญ่เริ่ม,1444.938,1447.2340000000002
เข้ามาแข่งมากขึ้นเช่น ดร. คอมมา,1447.2340000000002,1449.786
ผมซื้อเว้น,1449.834,1451.13
รวมถึงร้านขยะของเซเว่นมีไหมพี่บอกเหมือนกันแล้วก็น้ำซอส,1451.658,1455.642
ผมไม่แน่ใจผู้บริหาร,1458.57,1460.826
มองเรื่องนี้อย่างไร,1461.546,1463.514
จะมีวิธีการจัดการกับพวกนี้,1465.29,1467.461
อย่างไรบ้างที่จะทำให้เราเก็บมาเก็บ,1467.461,1469.85
ก็ เอ่อ ปีกปีนี้ครับ ปัจจุบันเราก็เลย,1470.762,1474.074
แผนของเราเดียวสุดท้ายก็จะเป็นเรื่องของการปรับปรุงเรื่องของ,1474.794,1478.202
