text,start,end
บริการนะครับ,1478.826,1480.026
เรื่องของ CRM นะครับแล้วก็การขยายศักดิ์ศาสตร์,1480.458,1483.866
ไปเลย,1484.298,1485.114
แต่อย่างที่เห็นนะครับว่าในแผนก็จะมีการเปิดที่,1485.45,1489.242
ตัวอย่าง ส่งสรรค์ชาว,1489.578,1491.45
มีคุกเก็บ 3-4 สาขานะครับ,1492.074,1495.194
ก็จะเป็นการขยายสต็อก,1496.298,1497.786
จริงๆ ถ้าจิตหลักก็มันฟิล์มจริงก็ยอมรับอย่างหนึ่งว่า,1498.506,1501.818
ถ้าเกิดเราเข้าถึงแข็งเนี่ยก็จะมีเรื่องของการ,1502.442,1504.314
ที่มีแปลงเขาทำใหม่ยี่สิบเจ็ด,1504.554,1506.33
นั่นเองเนี้ยของความน่าเชื่อถือเราก็คิดว่าอยู่ในระดับต้นต้น,1507.53,1511.13
แล้วยอมรับว่า,1511.754,1512.762
จะอยู่ในกลุ่มของเขาเรียกอะไรดีครับ,1513.098,1515.93
ของ e กับ a อะไรอย่างเงี้ย ซึ่งตอนนี้เรามีบวก,1516.17,1519.77
ขึ้นไปเป็นต่างต่าง,1519.914,1521.114
วันนี้เราก็เลยมีการที่เราขยันไปสู่การที่ไปตั้ง,1521.642,1525.05
ได้แรงแรงปาก,1526.826,1527.834
แล้วก็แผนจริงแล้วเราก็มีการทำแผน,1529.226,1531.8200000000002
กระยืบกันเนี่ยก็มีเจ็ดกระยุทธ์หลักนะครับ,1531.8200000000002,1534.65
คุณก็คิดว่าเรา,1535.466,1536.858
ผมเองก็เชื่อมั่นว่าแล็บฟอร์มสิริกส์จะดีขึ้นยิ่งขึ้นยิ่งขึ้นถ้าพักดู,1541.61,1544.73
สตอร์ทแล็บเนี่ยจะเห็นว่าทั้งรายได้แล้วก็กำไรก็ดีขึ้นเรื่อยเรื่อย,1546.41,1550.394
จากที่ผมจับมือกระทะโตอ่า,1556.682,1559.418
ในการที่จะ,1559.562,1560.666
ไปเผลอรักษาญาณในความน้ำมัน,1561.098,1563.258
แต่กลยุทธ์อื่นๆเนี่ยก็ต้องยอมรับ,1565.418,1567.5059999999999
ว่าขอขอเก็บในความลับก่อนนะครับ,1567.5059999999999,1569.5939999999998
แล้วก็,1572.33,1573.338
คำถามถัดมาคือธุรกิจโรงบาลจากที่อยู่เราซื้อมาแพง,1574.25,1577.778
หกโลกผมเข้าใจว่าเขามีโรงเรียนภาคใกล้ใกล้แต่ต้องแพง,1577.778,1581.306
ไม่แน่ใจ มองยังไงก็จะทำให้ทุกสิ่งนี้ชนะหน่อยระยะยาวได้,1581.93,1585.434
ซึ่งคือก็ต้องยอมรับนะครับว่าโรงพยาบาลมันเป็นธุรกิจอินเทรด,1586.346,1589.466
แล้วก็ไปดูโรงพยาบาลแบบสั้นๆมาก,1589.61,1591.386
ก็ เพราะว่าเหมือนก็ไม่มีใครขายถูก,1592.298,1594.362
คือเราก็ต้องบอกว่าแพงแล้ววันนี้เราก็ต้องหยอดซื้อเพื่อ,1595.274,1598.586
ผมเป็นจาน,1598.634,1599.546
ถูกมีระยะยาว,1599.786,1600.986
เราจะเห็นว่ามีการเฮคโอเวอร์,1601.61,1603.7939999999999
ของโรงบ้านของหลายหลายคนพึ่งเนี่ย,1603.7939999999999,1605.9779999999998
ก็เชื่อมั่นว่ามิมีใครซื้อถูกนะครับถูก,1606.986,1609.626
พร้อมอันนี้อาจจะมีแพลน แพลนมีความว่าเอออาจจะ,1610.922,1613.85
มีอียี่สิบเท่า หรือ เรียนตรงกลาง,1614.186,1616.25
ก็เขาช่วยไม่ต่างกับในอินดาร์ซีหรืออะไร,1617.354,1620.104
เหมือนกันนะครับที่ถ้าถูกก็คงไม่ไม่ขายนะครับ,1620.104,1623.066
แต่ถ้ามันก็จะมีถกไปเลยที่มันไม่ได้โอเคเท่าไหร่,1624.074,1627.29
ก็ซื้อไปก็คงจะยาก,1629.258,1630.746
เออเด็กนักฟันฟันเนี่ยเรามีมุมมองว่า,1631.466,1634.106
นี่สิทธิมีอีกสำไร,1634.442,1636.026
การที่เราจะไปทำด้วย,1636.266,1637.658
ก็จะดีกว่าธุรกิจที่มันขาดทุนอยู่แล้วนะครับ,1637.898,1640.25
เราคิดจะไปปรับมันจะยาก,1640.778,1642.17
แต่ว่ามันเป็นธุรกิจที่มีกำไรอยู่แล้ว,1642.314,1644.498
เราเข้าไปปรับปรุงเพื่อให้กำไรมันมากขึ้น,1644.498,1646.682
ให้มีมาตรฐานมากขึ้นเนี่ย,1646.922,1648.698
ว่า,1652.106,1652.922
เราก็มองว่าสาเหตุที่ด่าดึงใจคือ,1653.066,1655.514
เพื่อให้ไปดูเนี่ย,1655.658,1656.57
เราก็จะเห็นว่า เออ,1657.098,1658.778
มันเป็น,1658.922,1659.738
เอาอยู่ในระดับที่อ่านได้นะครับเนื่องจากประมาณไม่พอทัศน์เนี่ยสร้างมา,1659.786,1663.386
สิบสี่ปีแล้วก็มีฐานลูกค้า,1664.394,1666.458
ค่อนข้างมากแล้วก็อยู่กลางเมืองแล้วก็ที่ดินเจ็ดไร่,1666.794,1670.394
ความรู้เป็นโรงพยาบาลมหาราช ศิษย์ธรรมราชสายหนุ่มตัววัดและประวัติศาสตร์,1671.306,1675.098
ไม่ต่างกับโรงพยาบาลพันธุรกิจที่อยู่,1675.722,1678.242
ใกล้กับโรงพยาบาลศิริราชประมาณนั้น,1678.242,1680.762
เพราะฉะนั้นเนี่ยก็ก็มองว่าในระยะยาวเนี่ยมันมีศักยภาพ,1681.674,1685.562
โดยเฉพาะที่แยก 6 ตัวจังหวะเอง,1685.898,1687.962
ที่นครสิทธิ์ธรรมราชก็ค่อนข้างสะดวกใหญ่,1688.394,1690.759
แล้วเราก็มีแผนที่อยากจะเป็นโรงพยาบาล,1690.759,1693.338
ที่จะเสิร์ฟ ระดับภูมิภาคหลาย ๆ จังหวะ,1693.578,1697.37
ก็คิดว่าก็เลย,1700.682,1702.17
นะครับจริงจริงก็มีการได้เชิญบอกของเราซึ่งก็,1702.506,1705.818
เป็นริษัท,1706.058,1707.354
ก็ให้คำแนะนำให้ความคิดเห็นนะครับ,1709.13,1711.29
ผมซื้อมันวันอีกหรือยัง,1711.818,1713.21
ก็การไปยาวมืดทด,1714.314,1715.61
จะดีขึ้นเรื่อยๆ นะครับ,1715.754,1716.954
ข้อที่สาม ตำแหน่งสินค้าออก,1719.498,1721.508
ใหม่ของเราดูไม่ปั่นและออกซ้ำ,1721.508,1723.77
เกิดปัญหาอะไรนะครับ,1724.778,1726.938
คือ เอ่อ สินค้าออกใหม่นะครับ,1727.946,1730.01
มันก็ต้องใช้เวลาในการค่อยค่อยสร้างหมด,1730.058,1732.794
แล้วก็อย่างเช่นตัวแบบมูลหรือวิซ่า,1733.514,1736.346
บีเอสเอ ตัวเนี้ย เราก็ต้องค่อยๆ คลาสลงอีกก็,1736.682,1739.706
ไม่สามารถที่จะสร้างวันปีเดียวแล้วก็ขึ้นมานะครับ,1739.946,1743.45
ผมต้องค่อยๆ ดูกันไปเรื่อยๆ นะครับ,1744.17,1746.522
เพราะจริงๆแล้วปัจจัยของเราก็คือเรา,1747.242,1749.426
ก็ต้องการไปพิสูจน์ตัวเองในหน่วยงาน,1749.426,1751.61
บางครั้งเราออกมาเนี่ยเราก็,1753.674,1755.642
ต้องลงทุน,1756.074,1756.986
ไม่ได้ทำ เอ้อ จบปัง สำคัญแอบจะต้อง,1757.034,1759.77
ก็คือการยิงฆ่าศาสนาเยอะๆ,1761.162,1762.938
คือปันแต่ว่ามันก็มีความเสี่ยง,1763.274,1765.53
ก็มีอย่างเต็มบาลันระหว่าง,1765.962,1767.258
ความเสี่ยงกับการที่เราจะต้องไปเล่นมันให้คนรู้เร็วเร็ว,1768.074,1771.386
จะต้องบังเอา,1771.722,1772.73
คิดว่าสินค้าออกใหม่ของเราก็อยู่ในระดับที่,1775.946,1778.97
พอคุณพอใจ,1780.65,1782.042
ไม่ว่าจะเป็นกลุ่มทศนาธิษฐศาสตร์ตัวเมริก,1782.762,1785.882
หรือไม่ว่าจะเป็น,1786.794,1788.954
โอเค,1789.194,1790.106
อย่างเช่น กุมยา อย่างเช่น เบลลาภลาภ,1790.25,1792.602
แต่ก็ต้องใช้เวลา,1793.322,1795.386
เพราะว่าคุณจะตลาด,1796.202,1797.306
สองแบรนด์เนี่ยเพราะ,1797.45,1798.938
ทำตลาดนานๆผสมผสมกันด้วย,1798.986,1801.146
แต่เราก็คิดว่าในแง่ของคุณภาพ,1801.866,1804.037
เราเนี่ย เอ่อ ดีแน่นอนครับไม่ว่าจะเป็น,1804.037,1806.426
ในแง่ของเอ่อตัวยาในแง่ของ,1806.762,1808.85
เครเจกต์ซิ่งรูม่วงของในต่างต่าง,1808.85,1810.9379999999999
คำถามถัดไปแล้วมองเอ็มแอมป์อย่างไรบ้างสู้หนี,1815.978,1819.29
ก็คิดว่าถ้าเอ่อ ก็จริงจริงก็มีบริษัทเยอะมากเหมือน,1820.202,1823.49
กันนะครับที่มาเสนอให้เราเข้าไปถึงหุ้นบ้านนี้แอบ,1823.49,1826.778
ไปซื้อจิตจัดการบ้าน,1826.826,1828.698
ตัวเองก็คิดว่าถ้ามันอยู่ในวิสัยพัก,1829.322,1831.29
ของบริษัทเราก็ต้องสนใจ,1831.338,1833.594
คือภายใต้วิสัยทัศน์ของการที่ไปเปลี่ยนมาเป็นผู้นำ,1834.314,1837.3100000000002
เป็นทัศน์สุขภาพแบบพระองค์จอร์จทั้งของทุกคนแล้วก็ทองคำ,1837.3100000000002,1840.506
สัตว์นะครับทั้งต้นน้ำเดินไปนะ,1840.938,1843.098
คำถามถัดไปครับ,1844.49,1845.882
เอ่อ เลือกขึ้นไปหน่อยครับ,1849.386,1851.45
เตรียมเครื่องนี้เครื่องนี้ครับ,1853.61,1855.002
เออแนะนำว่าบริษัทกวนแต่งตั้ง ไออาร์,1855.914,1858.842
ติดต่อสอบถามข้อมูลอะไรไม่ได้เลยครับ,1860.81,1863.45
ก็ยอมรับว่าตอนนี้ เออ เราบริษัท,1864.266,1866.33
เพราะ ไม่ ได้ มี ไอ้ อะไร,1866.474,1867.578
อีกอย่างเอาซอส,1868.394,1869.402
ที่ฝากดูเห็นการทำเองนะครับ,1870.602,1872.186
แต่คำแนะนำนี้เข้าใจว่าได้รับคำ เอ่อ คอมเมนต์อยู่เรื่อยเรื่อยนะครับก็,1872.81,1876.794
คิดว่าเราก็มีการพิจารณญูว่าเราน่าจะมีอะไรอ่าน,1878.282,1881.498
สองบริษัทในปีหน้านะครับ,1882.506,1885.05
อันนี้เราก็ประมาณประจำกันเลยเนอะ,1887.786,1890.042
ผมรีบจะมาทำ IR ของบริษัทอยู่นะครับ,1893.258,1895.706
ผลการดำเนินงานช่วงคิวสามแล้วแนวโน้มคือสี่เป็นอย่าง,1898.442,1902.258
ไรบ้าง อันนี้ผมพูดเท่าที่พอจะพูดได้นะครับเพื่อน,1902.258,1906.074
ไม่ให้ผิดระเบียบนะครับ,1906.314,1908.57
คือแนวโน้มครับคือจริงจริงเรารายได้กับมันเราคิดว่า,1909.29,1913.082
ที่เราจะเกิดขึ้นในคิว 3 คิว 4 จำนวนคิว 1,1913.706,1916.538
จริง ๆ แล้วมันก็คือ ยัง,1916.586,1918.65
ก็กำไรจริงๆแล้วมันก็ใกล้เคียงกับ,1920.522,1923.066
น่าสะดวกไปมากหนึ่งแบบประเด็นน่าจะอยู่ที่ว่า,1923.786,1926.906
เราจะดึงเงินกำไรได้ไปยิงโฆษณามาร้อยแค่ไหน,1927.338,1930.362
เราก็อยากจะโชว์เห็นว่าเออถ้าเราเอาท่าโฆษณาเนี่ย,1934.922,1938.714
เนี่ย จริง ๆ แล้วก็ไม่ ไม่ควรเป็นแบบนี้ แต่เราจำเป็นที่จะเอาเงิน,1939.242,1943.034
ไปสร้างแบรนด์นะครับ,1943.178,1944.474
เพราะว่าแบรนด์พาราเซตเตอร์มอลต่างต่างที่ด่ง,1945.098,1948.145
ดังมาเนี้ยก็จะจัดการผลิตโฆษณาในการรับ,1948.145,1951.446
รู้ค่อนข้างมากนะครับ ไม่ว่าจะสู่ทีวีสู่,1951.446,1954.7469999999998
อันนี้ที่อยู่,1955.466,1956.378
ส่วนใหญ่ก็จะเป็นโรงหนังอะไร,1956.618,1959.183
วะเอเวอร์เนี่ยค่อนข้างจะ,1959.183,1961.1779999999999
เป็นพอสมควรครับ,1961.898,1963.194
มันก็อยากจะ,1963.914,1964.826
บอกแล้วลูกถึงบ้านเราเชื่อมั่นในคำว่าเป็นลาฮะลาวเนอะ,1964.874,1967.802
คุณภาพดีมีการทำวิจัยก่อนที่เราจะลอง,1967.85,1971.258
เพราะฉะนั้นเนี้ย ถ้า เอ่อ ปวดนุ่มอะไรต่างต่างเนี้ยลองทาน,1971.69,1974.9180000000001
ดูนะครับ ไม่จำเป็นจะต้องมียากินยาเอ็นเซตแรงแรง,1974.9180000000001,1978.362
ได้จากตัวพร้อมนะครับ,1978.602,1979.802
ก็แพงกว่าด้วย,1980.714,1982.01
จริงๆ แล้วมันมันสิ่งที่เราได้ผลนะครับ,1983.114,1985.274
ก็ให้ติดจริงหรอก,1985.514,1986.33
เป็นเฟซซิ่งที่มีผลของภาพแล้วกัน,1987.818,1989.69
มันเป็นแบบ Visual Pack ที่จะทำให้,1990.314,1993.914
คุณภาพยังคงอยู่แล้วก็จะทำให้การโหมดซูม,1994.25,1997.235
อะไรต่างๆไม่ได้ค่อยลงจากการที่,1997.235,1999.761
ไม่สามารถรักษาความซูมอะไรต่างๆได้,1999.761,2002.7459999999999
ทำไมรายได้ส่วนนี้เป็นแม้สะพันธุ์และ,2005.866,2008.276
ยาลักษณะโรงยอดฉายถูกได้ลงหรือละครับ,2008.276,2010.9060000000002
อันนี้ส่วนหนึ่งเนี่ยก็เกิดจากการที่เราอ่ะ,2011.434,2013.978
ในครึ่งปีแรกก็ยอมรับว่า,2014.122,2016.378
แล้วเราก็เลยกลายเป็นว่า,2018.058,2019.354
เราอะ,2019.498,2020.698
ร้อยล้านล้านล้านล้านล้านล้านล้านล้านล้านล้านล้านล้านล้านล้านล้านล้านล้านล้านล้านล้านล้านล้านล้านล้านล้านล้านล้านล้านล้านล้านล้านล้านล้านล้านล้านล้านล้านล้านล้านล้านล้านล้านล้านล้านล้านล้านล้านล้านล้านล้านล้านล้านล้านล้านล้านล้านล้านล้านล้านล้านล้านล้านล้านล้านล้านล้านล้านล้านล้านล้านล้านล้านล้านล้านล้านล้านล้านล้านล้านล้านล้านล้านล้านล้านล้านล้านล้านล้านล้านล้านล้านล้านล้านล้านล้านล้านล้านล้านล้านล้านล้านล้านล้านล้านล้านล้านล้านล้านล้านล้านล้านล้านล้านล้านล้านล้านล้านล้านล้านล้านล้านล้านล้านล้านล้านล้านล้านล้านล้านล้านล้านล้านล้านล้านล้านล้านล้านล้านล้านล้านล้านล้านล้านล้านล้านล้านล้าน,2020.938,2023.386
แต่ว่าตอนเนี้ยเราก็ยอมรับว่าเราพยายามจะไปเพิ่มประสิทธิภาพ,2024.106,2028.068
ในการผลิตเพื่อจะเป็นเริ่มต้นที่การผลิตมากขึ้น,2028.068,2030.779
ที่จะทำให้เราได้ทั้งเวอร์รุ่งทั้งกำไรนะครับ,2030.922,2033.658
เราก็สามารถปรับปรุงประสิทธิภาพ,2034.09,2036.5169999999998
ในการผลิตอยู่ในช่วงหกเดือน,2036.5169999999998,2038.4579999999999
แรกถึงปัจจุบันแล้วก็พักกันอยู่ตลอดเวลานะครับเพื่อให้,2038.698,2042.106
ในแต่ละแบบไซส์เนี่ยสามารถ,2043.69,2045.754
สมมุติเรามีวัตถุดิบร้อยเราก็จะทำได้ร้อยกล่อง,2050.506,2053.626
จะทำได้เก้าสิบเจ็ดกรอบไม่ได้ทำได้แค่เก้าสิบสี่กรอบ,2053.962,2057.274
ประมาณนี้เลยครับ,2057.322,2058.33
คิดว่านี่เป็นมาตรศาสตร์ เป็นมาตรศิลป์จะดีขึ้นนะครับ,2059.242,2062.458
ทำไมรายได้,2066.346,2067.93
ส่วนที่เป็นอาหารเสริม,2068.074,2070.042
พวกสนับเพจศักดิ์ถึงได้มีรอดฝ่ายลด,2070.858,2073.395
ลงก็ก็ยอมรับว่าเหมือนเหตุผลเรื่องยา,2073.395,2076.186
นั่นเองหรือตั้งแต่ต้นปีต้นมาเนี่ยมันมีการปรับรับสรรไป,2076.426,2080.314
เราก็มีการกระทบอยู่,2081.034,2083.578
เราก็เลยมีการ อยู่ว่าเราจำเป็นที่จะ,2083.914,2086.962
ต้องให้โปรโมชั่นอะไรต่างๆเองกลับไป,2086.962,2090.0099999999998
ในราคาเดิมแต่ว่าเราพยายามที่,2090.346,2092.38
จะลดต้นอยู่ในการปลีกเนี่ยทุกชั่วโมง,2092.38,2094.618
อันนี้เราก็คิดว่าในเต็มมาสามสี่เหรียญห้าสิบเจ็ด,2095.434,2098.65
ร้านขายยาและปัจจุบันเปิดได้กี่ศาสนาแล้วนะครับ,2101.962,2105.754
ปัจจุบันซ่อที่พึ่งโชว์ในสไลด์นี่นิเตอร์วอร์ดนั่นเอง,2106.666,2109.978
แล้วก็ครึ่งปีหลัง,2112.33,2113.722
เพราะผู้บินอาจจะเป็น 3 เดือนหลังแล้ว,2114.73,2116.698
อันนี้เหลือแค่สามเดือนเนี่ยก็คิดว่า,2117.226,2119.6980000000003
น่าจะเกิดได้ ประมาณสามสี่สาขา,2119.6980000000003,2122.1700000000005
ทีนี้เราก็จะจบที่สามสิบสามสิบเอ็ด,2122.314,2124.954
จริงจริงต้องยอมระวังในหลักการของเราเนี่ยตั้งแต่,2125.386,2128.314
ตั้งในสัตว์มาหรือห้องสลัดมาหรือ,2128.842,2131.194
เรามักจะตั้ง โอ้,2131.626,2133.114
คือเราทำแผนไปค่อนข้างสูงนะครับ,2136.522,2138.778
มันคล้ายๆกับว่าเราตั้งเป้าว่าจะปิดน้องๆ,2139.498,2143.002
ฝ่ายซื้อตั้งเท่าจะปิดร้อยยี่สิบ,2143.05,2145.306
ถ้าไม่ได้อย่างน้อยก็จะผิดเกินร้อยนะครับ,2145.45,2147.706
จะไปสอบฟอกที่ไหนมันก็ต้องตั้งฟอกเกินไว้ก่อน,2149.386,2152.026
