text,start,end
สวัสดีครับ,12.618,13.53
แล้วรู้สึกลึกขั้นนะครับ แล้วก็,15.594,17.37
ส่วนผู้สูงทุกท่านนะครับ,17.706,18.906
รอบสุดนะครับ,23.754,24.57
เพื่อนเพื่อนก็ล่าสุดคือไตรมาส 2,25.29,27.522
 นะครับแล้วก็อัปเดตเรื่องสมกัด,27.522,29.753999999999998
บริษัทอินเตอร์ซอฟมาก,29.802,31.29
อย่านะครับ ท้อที,44.298,45.498
วิจัยทัศน์คมบริษัท,54.378,56.058
ก็ต้องการเป็นผู้นำผลิตภัณฑ์สุขภาพแบบครบวงจร,56.586,59.706
ทั้งของคนและของสัตว์จากต้นน้ำเดินตามไปน้ำเดินตาม,59.754,63.258
ก็คำว่าผิดฐานสุขภาพกับพวกองค์กรก็,63.882,66.618
จะพูดให้ฟังนะครับว่าว่าเป็นอย่างไรนะครับ,66.954,69.47399999999999
แล้วก็จากต้นน้ำตึงไปน้ำเป็นอย่างไรนะครับ,69.47399999999999,71.99399999999999
สำหรับโครงการเทรดทางสุขภาพ,74.25,77.092
ในวิสัยทางของบริษัท,77.092,79.578
ประมาณความรอบตั้งแต่,79.722,81.786
สีบวกกับดึงนิเจนะครับก็คือเรื่องเกี่ยวกับนวัตกรรมนะครับตอนนี้,82.506,86.106
งานของผมที่ทำแบบบัตรก็คือเป็นการ,86.346,88.794
ไปหารู้ทัศนความหมายใหม่นะครับ,89.322,91.29
ในการรักษาเพื่อทดการป้องกันโรคนะครับ,91.434,94.074
แล้วก็ถัดมาอันเนี้ยก็จะเป็นเรื่องของยาซึ่งปัจจุบัน,94.794,97.883
เรามีโรงงานยาต่อโรคนะครับ ที่ผลิตยาที่เรียก,97.883,100.586
ว่าเจนลิกนะครับ หรือ Phenocytinic พี่เด็กเจนลิก,100.586,103.482
แล้วก็จะมีเรื่องของมูลค่าสติ๊กเกอร์แล้วก็ cost based,105.066,108.36800000000001
 สติ๊กเกอร์นะครับซึ่งมันเป็นองค์การนะครับระหว่าง,108.36800000000001,111.25800000000001
เสริมจากยาที่เรียกว่าภูเก็ตอันเหตุศัพท์,111.882,115.194
เครื่องส่งงานกับยาเนี่ยก็จะเรียกว่า,116.394,119.226
คอร์สเมสิกินพร้อมหรือเลขสัมภาระ,119.85,122.202
แล้วก็หมายรวมถึงถึงเรื่องของเศษของ,123.21,125.42699999999999
 healthy food healthy drink ด้วยครับ healthy snack,125.42699999999999,127.86599999999999
แล้วก็ Personal Care นี้ก็ยังอยู่ใน,128.874,131.394
สโคปที่ทำให้สาธารณะดำเนินธุรกิจ,131.394,133.91400000000002
เพราะว่าผมเองก็มีความเชื่อว่า,135.498,137.658
ความสุขภาพอย่างเช่นอาหารเนี่ยอนาคตมัน,138.282,140.994
อาจจะ ตั้งแต่การที่เรามาทานอาหาร,140.994,143.706
อาหารที่เราชามันเลยตรงกลางเนี้ย,144.426,146.394
ก็คนก็จะเริ่มใส่ใจเรื่องว่าอาหารที่,146.922,149.634
ทำจะต้องปลอดภัยแล้วก็ เอ่อ ดีต่อสุขภาพ,149.634,152.34599999999998
เปิดทั้งเครื่องดื่ม,152.394,153.498
สมทุกข์สองพันเล่มนะครับ,153.834,155.514
พูดถึง tomacidicle นะครับอันนี้ก็จะเป็นตัวอย่างของยาที่,157.866,161.562
งานลงทริปจากทั้งสองโรงงานนะครับที่เอ่อสำหรับประกาศ,162.378,165.42399999999998
ที่ภายใต้ชื่อใบฝัดย่อยที่ชื่อว่า modern former,165.42399999999998,168.08999999999997
แล้วก็โรงงานที่ซึมจะสามารถที่จะอยู่,168.618,172.218
ยุทธยานะครับ,172.362,173.37
มีอยู่ในฝั่งบริษัทกำรุดชนะ 2 อย่างเช่นซิงเหล็ก,173.802,176.60999999999999
ก็เป็นยารถไขมันเม็ดฟอลลิปก็เป็นยาเบาหวาน,176.60999999999999,179.41799999999998
เซ็นทริ่งก็คือยาแพ้แพ้แบบไม่ง่วง อโลทัฟ,179.946,182.224
ก็เป็นยาแพ้แพ้แบบไม่ง่วงอีกสูตร,182.224,184.12199999999999
ทั้งสองกลุ่มเนี้ยก็เป็น เอ่อ,184.938,186.714
ปัจจุบันแพทย์ก็จะใช้กันอยู่,186.762,188.346
ไปกดต้นเพื่อไปยัดรักษาลูกสะเกิดนะครับ,189.258,191.418
ดังนั้นขวาก็จะเป็นตัวอย่างของยาที่ผลิตที่,191.754,195.354
สมุดประกาศนะครับปัจจุบันเนี่ยสาวตัวเนี้ย,195.882,198.618
เขามีแผนนะครับในการที่จะทำให้มันเป็น OTC แปลนะครับ,199.05,202.458
ที่จะเป็นยาที่ใช้กันอย่างห้าหลายในร้านใช้ยา,203.082,206.586
อย่างเช่นเบลล่าคลาดเนี่ยเป็นยาสามัญประชาธิบดีนะครับ,207.114,211.002
ที่เราพึ่งกดตอน มีโฆษณาที่มีคุณอ้างเป็นพรีเซนเตอร์,212.49,215.898
ก็ส่วนโรงงานอายุทยานเราก็จะผลิตที่,217.962,221.178
น่าจะเป็นยอดกลุ่มคนละ 1 มิตรนะครับที่เป็นกลุ่มที่เรียกว่า,221.226,224.73
สิ่งที่อยากตามนะครับก็,225.738,227.226
ที่เคยเรียนได้มาก่อนหลายหลายครั้งเพราะว่า,227.37,229.722
ยาตาในกรุงไทยมีโรงงานที่,229.962,232.67399999999998
สามารถผลิตยาตาได้ไม่กี่โลม,232.67399999999998,235.38599999999997
อ่า คิดว่าถ้าเป็นผู้ผลิตในประเทศเนี่ยโรงงาน,236.202,239.226
ยุทยานั้นจะเป็นอันดับหนึ่ง,239.562,241.242
นอกนั้นก็จะเป็นสินค้านำ,241.866,243.354
อ้าว นะครับ,243.498,244.314
แล้วก็ผลิตในมาตรฐาน,244.554,246.138
ที่ เอ่อ กลุ่มนี้ก็เลยยังเป็นที่ทางเพศวรรษัตริยาดับแรก,247.818,251.514
เพราะเขาเป็นยาเจริญฤทธิ์ในศักดิ์ยาเจริญฤทธิ์อันดับหนึ่งของโลกเนี่ยเขามาช่างเราผลิต,253.098,257.082
แต่อย่างที่เคยเห็นนะครับเราก็จะมีแผน,259.338,261.52700000000004
ผลิตยาตาของเราเองซึ่งตอนนี้ก็พัฒนาอยู่,261.52700000000004,263.898
แล้วก็จะมีขั้นตอนทางเชื่อมในเรียนในศุกร์ศาสตร์ก็,264.81,267.354
คิดว่าจะล้อสักอย่างต่างต่อเองได้ในฟรี,267.402,270.042
สอง บาทห้าร้อยหกสิบแปดนะครับ,270.09,272.154
ปี 2565,272.586,273.498
อีกสองปีข้างหน้านะครับ,274.89,276.282
นี่ก็จะเป็นตัวอย่างกับโฆษณาอัตโนมัติ,278.442,280.89
ที่จริงๆเราไม่คลิปนะครับแต่ก็เชิญว่า,281.13,283.77
ผู้ประดิษฐ์ส่งไป,289.194,290.202
เป็นจริง PDF ไฟล์นะครับ,290.538,292.986
นี้เราก็จะมาด้วยเรื่องของการเอ่อ,293.13,295.602
รถไฟแล้วก็บันทออการปวดทั้งเจ็ด,295.602,298.07399999999996
เราจะเห็นว่า ยาแก้ปวดในท้องผลักเกรด แก้ปวดหัว,299.37,303.066
ของเราเนี่ยได้รับการรู้มาจากเอายอเนี่ย,303.786,305.946
สามารถกระจอกการปวดได้ถึง 7 ปวดนะครับ,306.09,308.634
อันนี้เราก็ก็ยินท่องศาลาอยู่คิดว่าหลายๆท่านผมได้เห็นนะครับ,316.362,319.578
อ๋อ นี่ครับ โอเค,321.162,322.266
ออกพิสดาร์ขึ้นเลยครับ,322.506,323.706
แต่เสียอาจจะไม่ออกนะครับ หัวปวดปวดประจำเดือนนะครับ,324.522,327.738
ตรวจหลังอยู่นะครับ,330.09,331.098
ปัจจุบันก็ขายอยู่ในทุกซ่องทาง,339.882,342.21
นะครับไม่ว่า 7-11 มีนี้มา,342.21,344.53799999999995
เชิดแล้วก็ล้างสยามรูปไฟนะครับ,345.258,347.802
เราขยันจะขยันไปพบลุงกับล้านค้าเลยครับ,351.882,354.522
วันนี้เราก็ปัจจุบันเราก็เลยมี,356.394,359.226
ผลิตภัณฑ์ที่เรามีพรีเซนเตอร์อยู่ 3 ฝั่งตัว,359.466,362.778
เวลาผลลัพธ์ก็คือคนตั้งนะครับยาสี,364.266,366.91
ฟันโปรเฟนติกของเราก็คือผลิตภัณฑ์,366.91,369.11400000000003
อินเบอร์รี่นะครับ,369.546,370.554
งานชักวิญญาณ อินทรอส ตก,374.442,376.506
นะครับ ในกลุ่มดูชาวซูลิโคลด์แล้วก็เหมือนเดิมนะครับ,379.818,382.746
แล้วก็,389.514,390.522
อย่าคิดให้ท่านทราบนะครับว่าโฟล,390.57,392.73
โอ้ แฟนของเราก็เป็นยอดแฟนดับหนึ่งในร้านเชียงยา,392.874,396.186
แล้วในโรงพยาบาลก็เป็นอันดับหนึ่งนะครับในแง่ของกลุ่ม,396.906,400.314
เนื่องจากว่าเขาจะมีผู้ใช้กันอยู่อย่างแท้หลัง,405.354,408.666
สิ่งที่เราเห็นไหมครับว่าผมมี,409.578,412.506
สิ่งที่จะพบกับเราค่อนข้างมากก็คือสินค้าออมแล้วก็โลกเลียนแปลง,416.298,419.898
Apple แบคเนี่ย แล้วก็ Apple มัสเตอร์เน็ต,420.906,423.354
เวลาคุณโอเคติดกิจกรรมในท้องถามมีค่อนข้างเยอะนะครับ,424.362,427.29
เป็นรายแรกก็จริงตอนแบบนี้ก็น่าจะมีเป็นร้อย,427.338,430.458
ผลิตภัณฑ์เนี่ย ก็เพราะว่า หลวงปู่เองก็จะแนะนำว่า,430.506,434.49
ควรจะใช้ตัวที่,434.538,436.218
เราใช้นะครับเชื่อถึง,439.434,440.826
แล้วก็น่าจะเป็นแบรนด์เดียวที่ขายอยู่ในโรงพยาบาล,441.834,445.146
ว่าคลีนิกสั้นนำนะครับคลีนิกสโลวัตติหรือเปล่านะครับ,446.154,449.178
อันนี้ก็จะเป็นกลุ่ม,452.202,453.402
นะครับก็จะส่วนใหญ่เราจะพัฒนาอยู่บนทางของโปรเกติก,456.042,459.498
นะครับไม่ว่าจะยักษ์เป็นโปรเกติกหรือหลังน่าโปรเกติก,459.498,462.522
แล้วก็มูสสำหรับล้างถึงซอสเมนต์,462.858,465.978
ก็เป็นภายใต้แบบที่ชื่อว่า t s หก โมส คือ โมส,466.314,470.01
แล้วก็อยู่ทุกเทสต์นะครับ,470.25,471.642
วันนี้ก็อยากเสียกว่าหนึ่งวัน,473.034,474.99899999999997
เราก็คิดว่าเป็นแปลกเดี๋ยวที่เรา,474.99899999999997,477.21
อันนี้ก็ต้องได้รับมัดจากเอายอนะครับว่าครบจบได้หลอด,478.89,482.466
เดียวนะครับ เป็นแน่น บริษัทของรถแข่งสู่บริหารการแปะประโยค,482.466,486.04200000000003
ก็ได้ เอ่อ ทุก ๆ ด้านนะครับ ไม่ว่าจะฟันขาว,486.858,490.17
กลิ่นปากนะครับ,490.314,491.61
รถ ชาร์จ พับ,491.658,492.666
ถ้าผิดก็บูรณ์นะครับ ไปต่างๆ,493.29,495.162
โอกาสเลือก,499.434,500.826
ในออร์โน้ตนะครับถ้าเราถามทันตแพทย์เนี่ยก็จะ,501.258,504.162
มีบทบาทการใช้โปรเกติกเนี่ยเป็นระยะสุดท้าย,504.162,507.066
มากขึ้นเรื่อยๆ นะครับ,507.21,508.506
เราก็อยากจะเรียนว่าจริงๆแล้วสูตรของเราเนี่ยเป็นสูตรที่ดีๆเอ่อ,510.57,514.074
เพราะนะครับเราใส่สารจักรไม่มากรสชาติอ่อนโยน,514.698,517.506
เพื่อสร้างสมดุลของแบคทีเรียนะครับในช่องปลั๊ก,517.506,520.314
"จริงๆแล้วแบคทีเรียในช่วงปลายมีถึง 50,000 ล้านตัว",521.034,524.73
บางครั้งก็จะชอบคนเล่นว่า เออ จุดพันธุ์มุมเนียนแล้วเปลี่ยนทั้งเจ็ดสิบตันตัว,525.546,529.53
ฉะนั้นก็ควรจะใช้หยาบสิทธิ์ก่อนที่จะสร้างผลดึงของแบคทีเรียในช่องปาก,530.346,534.138
เพราะว่าช่องปากที่ดีเนี่ยเป็นพื้นฐานนะครับ,534.858,537.21
ในการที่จะมีชีวิตที่ยืนยาวแล้วก็ชะลอไว้นะครับ,538.314,541.146
ทำไฟ,542.634,543.546
รับประทานได้แถว,545.61,546.618
พอเราตลอดทั้งเดือนอาหารที่ดีเนี่ยก็จะทำให้สุขภาพดีนะครับ,547.722,551.706
แล้วก็ตัวนี้ที่เราคิดว่าเป็นนักวัฏจำนะครับซึ่งอยู่ภายใต้ประชาชนเศรษฐกิจเศรษฐกิจเศรษฐกิจเศรษฐกิจเศรษฐกิจเศรษฐกิจเศรษฐกิจเศรษฐกิจเศรษฐกิจเศรษฐกิจเศรษฐกิจเศรษฐกิจเศรษฐกิจเศรษฐกิจเศรษฐกิจเศรษฐกิจเศรษฐกิจเศรษฐกิจเศรษฐกิจเศรษฐกิจเศรษฐกิจเศรษฐกิจเศรษฐกิจเศรษฐกิจเศรษฐกิจเศรษฐกิจเศรษฐกิจเศรษฐกิจเศรษฐกิจเศรษฐกิจเศรษฐกิจเศรษฐกิจเศรษฐกิจเศรษฐกิจเศรษฐกิจเศรษฐกิจเศรษฐกิจเศรษฐกิจเศรษฐกิจเศร,553.386,559.482
,559.482,559.482
ไทยอินเตอร์ฟอร์มาสถูกหุ้น 51% ภายในเนี่ย,559.818,562.468
ถูกหุ้น 49% ออกซิลอินเตอร์ฟอร์มาส 4 ติดตาม,562.468,565.338
อันนี้เราก็หลังจากเรา,565.866,567.738
ลองเข้ามาตลาดกันจ้ะก็,567.882,569.946
ผมคิดว่าน่าจะถึงเวลาที่เราจะเริ่ม,570.378,572.922
ที่จะให้คนรู้จักแอ้มหลัง,572.97,575.034
ผมก็คิดว่าตัวเนี้ย,578.73,579.93
จริงๆแล้วเป็นวัตกรรมมากเลยครับผมเองก็,580.074,582.6419999999999
ทานทุกวัน ให้คุณแม่ทาน ให้ลูกๆทานเนี่ย,582.6419999999999,585.2099999999999
พอพบว่ามีสิ่งเหล้า,585.546,586.842
หยุดพันลงไปท้องตลาด,589.002,590.394
ใน EDSA ได้ถึงไม่เกินแค่ร้อยกว่าบริกรรม,590.442,593.562
600 มิลลิกรัมเนี่ยจะเชื่อเท่ากับแกนปลา,594.186,596.346
แต่เราจะเก็บ bsa 600 ไม่กลับต้องผ่าตามถึง 20 กิโลกรัม,596.394,599.994
อันนี้ก็มาด้วย Position 20 กิโลกรัม,600.522,602.874
แล้วก็อย่างที่จะเห็นคำว่าโรงงานยุทธยาเนี่ยอันนี้เราก็ทำได้กับปีที่แล้วครับ,603.69,607.29
แผนที่เราจะควักให้เป็น EU standard ถ้าเป็น standard,608.682,611.706
 ระดับโลกสามารถจะควักออกไปทั่วโลกได้,611.706,614.298
สำหรับคุณความอยาก,614.922,615.834
นะครับซึ่งเป็นเป็นของโลกนะครับ,615.882,617.754
เพราะปัจจุบันเดียวกันจะเป็นโรคตากันค่อนข้างมากนะ,618.282,621.239
ครับไม่ว่าเด็กที่จะเป็นสายการ์ดสั้น คนแก่มากขึ้นก็จะ,621.239,624.393
มีสายการ์ดยาวมากขึ้นมีท่อประจกมากขึ้นท่อดินมากขึ้น,624.393,627.547
อักเสบมากขึ้นนะครับ,627.882,629.178
แล้วก็นี่ครับ,630.09,631.098
เพราะว่ามันจะมีกระบวนการผลิตเทคโนโลยี คลานเฟอร์ ขึ้นทะเบียนในระบบ,635.946,639.354
แล้วก็เราก็มีแผนนะครับที่เราก็จะทำตรงไปสู่,641.418,645.306
ความสุขเพราะมีแผลเยื่อความยาวมองยาวน้ำ,649.002,652.026
นุกมณ์สมุนไพรนะครับเนื่องจากว่า,652.458,654.618
โครงงานสนับสนุนประการเราได้รับอนุญาตในการผลิต,654.666,657.402
เป็นผสมไปแล้วนะครับ,658.698,660.378
สมมติไทยก็เป็นเทรนิคของโลก,660.81,662.682
ผมคิดว่าลูกอมก็เป็นลูกอมที่มี,663.69,667.098
พอแก่งไปได้นะครับ,667.914,669.498
มีชายชายข่าวที่ป้องกันการติดเชื้อหรือการอักเสบได้,669.93,673.242
แล้วก็ในแง่ของสัตว์นะครับเป็นการสุขภาพแล้วก็ควบคุมจอเลยครับ,675.498,678.81
สามเหรียญหัว,679.338,680.346
ไม่ว่าเราจะเป็นยานะครับ,680.778,682.962
ถึงยาสำหรับน้องหมาน้องแมว,682.962,685.146
เสิร์ฟหรือว่าแสดงว่าปัดสำหรับ,686.634,688.506
สำเนียงรถแมวนะครับ,689.13,690.618
ไม่ว่าจะเป็นชำพูนะครับก็,691.242,693.21
เปรียบเสมือนเลขสำคัญของล้อหมาล้อแมวเนี่ย,693.546,696.09
ก็เซ็นทีหลักแร่อันดับหนึ่ง,696.33,697.626
แล้วก็ไม่ว่าจะเป็นอาหารสุขภาพ,698.73,700.928
นะครับของเราเป็นเว็บโปรดักส์ที่,700.928,702.906
ทั้ง Pre-Severative Pre-Key ทั้ง Gluten-Free,703.146,706.434
 Grain-Free และยังไป Pre-Beretic Cyclo-Omega 3,706.434,709.722
ปัจจุบันเราก็ส่งออกไปห้าประเทศนะครับ,710.442,713.178
แล้วก็ยังขึ้นเรียนอยู่อีกสองประเทศนะครับก็น่าจะ,713.898,716.922
ฝงออกเลย พอดี ซึ่งปีนี้อาจจะฝงออกไปทั้งหมด 7 ประเภท,717.354,720.762
เดือนหน้าเราก็จะมีการไปออกบูที่,721.29,723.425
ตัวของเราเพื่อจะเปิดตลาดที่ยุ่งหลงที่ไว้,723.425,725.7539999999999
นะครับอันนี้ก็อยู่ภายใต้บริษัทร่วมทุนระหว่าง,727.434,729.786
อินเตอร์ฟอร์มาแล้วก็,730.698,732.09
ก็เป็นเอเชียนนะครับเอเชียนอะไรอ่ะอันสุดนะครับ,733.77,736.218
เราถือหุ้น 60% นะครับ,736.554,738.234
ห้องเย็น Ascent อะไรอันนั้นถือว่ามี 40% นะครับ,738.378,741.594
มีก็มีคำว่าเป็นทางสุขภาพแบบพกวงจร,742.506,745.192
