true_text,pred_text
สวัสดีครับ,สวัสดีครับ
สวัสดีครับ,อ่ะ ขอบคุณครับ
ขอต้อนรับลงทุนนะครับ เข้าสู่งาน,เข้าสู่งานประโยชน์
opportunity day นะครับ,ขอคุณอีกนิดนึงเองนะครับ
ผมนัท ณัฐสิทธิ์,ผมนัดสิทธิ์นะครับ
นะครับ เป็นนักลงทุนนะครับ,เป็นนักผู้ทุนนะครับ
ส่วนท่านนี้เป็นคุณวิรัช,คุณวิรัฐ มาร์มอลล์
รอบรับทําเป็น gfo ครับ,ก็รอบทานเป็น GFO ครับ
สวัสดีครับ,สวัสดีครับ
ครับ ขอบคุณทางตลาดนะครับ,ขอบคุณทั้งตลาดนะครับ
ที่ให้โอกาสทางบริษัท,ให้โอกาสทางบริษัท
กลุ่มบริษัท ทริพเพิลไอ,ก็ได้
โลจิสติกส์ จํากัด มหาชน,โปรดติดตามตอนต่อไป
นะครับ ได้มา,ได้มา...
แจ้งเรื่องผลประกอบการของกลุ่มธุรกิจนะครับในรอบเก้าเดือนแล้วก็ไตรมาสที่สามประจําปี2566 นะครับนะครับก่อนอื่นก็เริ่มอาร์เจนด้านะครับจะให้ทางคุณณัฐสิทธิ์ซึ่งเป็นฝ่ายนักลงทุนสัมพันธ์ของเรานะครับได้มาแจ้งเรื่องข้อมูลว่ากลุ่มธุรกิจของทริพเพิลไอ,ความอื่นก็เริ่มอาจเจนด้านนะครับ จะให้ทางคุณนัทศริษฐ์ซึ่งเป็นฝ่ายดังรู้สุดสำหรับเรานะครับ ได้มาแจ้งเรื่องข้อมูลว่า คุณทุรกิจของที่ไปลดที่ชิด ที่ต้องการ และที่จะการ และที่จะการ และที่จะการ และที่จะการ และที่จะการ และที่จะการ และที่จะการ และที่จะการ และที่จะการ และที่จะการ และที่จะการ และที่จะการ และที่จะการ และที่จะการ และที่จะการ และที่จะการ และที่จะการ และที่จะการ และที่จะการ และที่จะการ และที่จะการ และที่จะการ และที่จะการ และที่จะการ และที่จะการ และที่จะการ และที่จะการ และที่จะการ และที่จะการ และที่จะการ และที่จะการ และที่จะการ และที่จะการ และที่จะการ และที่จะการ และที่จะการ และที่จะการ และที่จะการ และที่จะการ และที่จะ
โลจิสติกส์จํากัดมหาชนได้ทําเกี่ยวกับอะไรบ้าง,ความสุขที่สิทธิจำกัดมหาชนได้ทำเกี่ยวอะไรบ้างรวมกัน
รวมทั้งมีไทม์ไลน์เกี่ยวกับเรื่อง,ก็ต้องมีทำลายเกี่ยวกับเรื่อง
ตั้งแต่เข้าตลาดนะครับ,ก็คือแต่เข้าเทราหลาดนะครับ
เพื่อเป็นข้อมูลสําหรับนักลงทุนที่สนใจนะครับ,เป็นข้อมูลสำหรับนักลงทุนที่สนใจนะครับ
ก็ให้ทางคุณทักษิณ,ขอให้ท่านคุณดักษัตริย์เป็นส่วนของผม
ส่วนของผมเองจะไป,ก็เป็นการต่อสู้กับคนอื่น ที่จะเป็นภาพที่จะสู้กับคนอื่น
เริ่มในส่วน,ก็ได้
part ที่ 2,โปรดติดตามตอนต่อไป
เป็นเรื่องของผลประกอบการ,โปรดติดตามตอนต่อไป
รวมทั้งต่อเนื่องไปถึง,ต่อเนื่องไปถึง
industry outlook,อาวุธกรรม
แล้วก็รวมทั้งเป็นอัพเดทการลงทุนของกลุ่มบริษัทที่มีในปัจจุบัน,ก็รวมทั้งเป็นอัพเดตการลงทุนของกรุงประจักษ์ที่มีในอัจฉุกหวัง
ก็จะให้ทางคุณณัฐสิทธิ์เริ่มได้เลยครับ,เราจะให้ทางคุณนัทศัสดิ์เริ่มได้เลยครับ
ขอบคุณครับ,ขอบคุณครับ
อันนี้เราอยากพามาดู,นี่เราอยากทำดูตัว...
business timeline,โปรดติดตามตอนต่อไป
นะครับ ว่าที่ผ่านมาเนี่ย,ว่าที่ผ่านมาเนี่ย
บริษัทของเราได้ลงทุนอะไรไปบ้าง,ก็คิดว่า ว่า ว่า ว่า ว่า ว่า ว่า ว่า ว่า ว่า ว่า ว่า ว่า ว่า ว่า ว่า ว่า ว่า ว่า ว่า ว่า ว่า ว่า ว่า ว่า ว่า ว่า ว่า ว่า ว่า ว่า ว่า ว่า ว่า ว่า ว่า ว่า ว่า ว่า ว่า ว่า ว่า ว่า ว่า ว่า ว่า ว่า ว่า ว่า ว่า ว่า ว่า ว่า ว่า ว่า ว่า ว่า ว่า ว่า ว่า ว่า ว่า ว่า ว่า ว่า ว่า ว่า ว่า ว่า ว่า ว่า ว่า ว่า ว่า ว่า ว่า ว่า ว่า ว่า ว่า ว่า ว่า ว่า ว่า ว่า ว่า ว่า ว่า ว่า ว่า ว่า ว่า ว่า ว่า ว่า ว่า ว่า ว่า ว่า ว่า ว่า ว่า ว่า ว่า ว่า ว่า ว่า ว่า ว่า ว่า
แล้วก็ซื้อดีลอะไรบ้าง,ก็ซื้อดิวอะไรบ้างแล้วก็ค่อยๆ
แล้วก็ขยายธุรกิจอะไรไปบ้างหลังจากที่เราเข้าตลาดเนี่ย,มีอย่างที่กินอะไรไปบ้าง จากที่เราเข้าตลาดมา
เราได้เริ่มเข้าตลาดในปี2017นะครับ,เราได้เริ่มเข้าตลาดในปี 2017 นะครับ
แล้วก็ในปี2018เนี่ย,แล้วก็ในปี 2018 นะ
เราได้เข้าซื้อบริษัทดีจีพีสิงคโปร์นะครับที่ลงทุนเกี่ยวกับธุรกิจบรรจุภัณฑ์สําหรับสินค้าอันตรายและเคมีภัณฑ์,เราได้เข้าซื้อบริษัท DGP ซิงงาโปรที่ลงทุนเกี่ยวกับธุรกิจบัญจุพันธ์สำหรับสินค้าอันตรายและเคมีพันธ์
ซึ่งมีการขยายขอบเขตการให้บริการซึ่งแต่เดิมเนี่ยเราได้ให้บริการเพียงแค่ในภายในประเทศนะครับ,ซึ่งเป็นการขยายปรอบเขียนการให้บริการซึ่งแต่เดิมเนี่ยเราได้ให้บริการที่ยังแค่ในประเทศนะครับ
ต่อมาในปี 2019,ก็มาได้วิธีสวรรค์19
เราได้ขยายธุรกิจ,ได้ขยายถูกล้วยกิจ
ในการเข้าซื้อตัว,การเข้าสือตัวเอล
altga authka ผ่านทาง sal,LTGA หรือว่าออตก้า ผ่านทาง SAL
ซึ่งเป็นการขยายธุรกิจตัวของ,การขยายธุรกิจตัวของกาพธิษฐ์
gapandering นะครับ,โปรดติดตามตอนต่อไป
ซึ่งแต่เดิมเนี่ย,ฉุกเฉพาะในตอนนี้ ฉันก็ไม่ได้กลับมาเที่ยว
เราให้บริการเพียงแค่ตัวของ cargo,สวิตเพียงแค่ตัวของ Cargo
แต่หลังจากนั้น,ไม่แน่
หลังจากที่เราเข้าซื้อ,มีความสุขที่จะให้คุณรู้สึก และสนุกกับคุณ
เราได้ไปเข้าเพิ่มในส่วนของบริการ,เพื่อได้เข้าเพิ่มในส่วนบริการส่วนของเรา
ส่วนของ passenger ด้วย,ก็ได้เป็นภาพเซนเจอร์ด้วย
ถัดมาในปี 19 ต่อมา,ก็คือ ภาษาอังกฤษ ภาษาอังกฤษ ภาษาอังกฤษ ภาษาอังกฤษ ภาษาอังกฤษ ภาษาอังกฤษ ภาษาอังกฤษ ภาษาอังกฤษ ภาษาอังกฤษ ภาษาอังกฤษ ภาษาอังกฤษ ภาษาอังกฤษ ภาษาอังกฤษ ภาษาอังกฤษ ภาษาอังกฤษ ภาษาอังกฤษ ภาษาอังกฤษ ภาษาอังกฤษ ภาษาอังกฤษ ภาษาอังกฤษ ภาษาอังกฤษ ภาษาอังกฤษ ภาษาอังกฤษ ภาษาอังกฤษ ภาษาอังกฤษ ภาษาอังกฤษ ภาษาอังกฤษ ภาษาอังกฤษ ภาษาอังกฤษ ภา
เราได้เข้าซื้อตัว allow logistics,มันจะได้เข้าสู่ตัวอาลาอาลโลที่ 6 มีนาฬิกา
management ที่ประเทศฮ่องกง,ที่ประเทศฮ่องกง
ซึ่งเป็นการขยายธุรกิจการให้บริการส่วนของ,การให้ประการสดของ GS
gsa,โอเค
ไปในระดับภูมิภาคเพิ่มมากขึ้นนะครับ,ไปในระดับคุมิพาธ์เพิ่มมากขึ้นนะครับ
ในปี 2020 เนี่ยครับ,ในปี 2020 นี่ครับ
บริษัทเราได้เข้าซื้อธุรกิจตัว,โปรดติดตามตอนต่อไป
galaxy ranger,อาซีเวนเจอ
ซึ่งเป็นธุรกิจ startup,ซึ่งเป็นทุกอิกิตสตาร์ตแอป
ที่ลงทุนเกี่ยวกับโลจิสติกส์,ที่ต้องคุยเกี่ยวกับลอติสติ
ซึ่งในดีลนี้,คือ ไงดีอยู่เนี้ย
เราได้ทั้งความรู้เกี่ยวกับสตาร์ทอัพต่างๆ,เราได้ทั้งความรู้เกี่ยวกับสารอัพต่าง ๆ
ทั้งหลอดฟิสิกส์ต่างๆ,อาจารย์ อิสมาแอล วิทยุ ฮ.ศูนย์
รวมทั้งรู้ว่าดีลไหนที่เราควรลงทุน,รู้ว่า ดินไหนที่เราควรลงทุน
หรือว่าไม่ควรลงทุนด้วยนะครับ,หรือว่าไม่ควรลงตุนด้วยนะครับ
ปี 2021,อีกนิดเดียว
ทางบริษัทเองเราเล็งเห็นว่า,ทางบริษัทเอง เราเรียกคิดว่า...
เราควรจะต้องเติบโตในธุรกิจที่เป็นเกี่ยวกับภายในประเทศเพิ่มมากขึ้น,เราควรต้องเติบโตในทุกคิด ที่เป็นเกี่ยวกับหาญาติเทศเพิ่มมากขึ้น
ซึ่งโดยธุรกิจหลัก,ซึ่งโดยทุกเกียรติแหละนะ
เราเป็นธุรกิจที่ระหว่างประเทศซะส่วนใหญ่,เป็นธุรกิจที่ระหว่างประเทศสาสวนใหญ่
เราเลยหาแหล่งรายได้ใหม่ ๆ,เราเลยหาแรงแรก ๆ ใหม่ ๆ
ที่จะลงทุนเกี่ยวกับภายในประเทศ,คุณเกี่ยวกับภายในประเทศ
เราเดินเข้าไปลงทุนในธุรกิจตัว,เราเดินเข้าไปลงค์ทุนในธุรกิจตัวคิบชีวิต
ship smile,โปรดติดตามตอนต่อไป
แล้วก็ make sense,โปรดติดตามตอนต่อไป
ซึ่งเป็นธุรกิจเกี่ยวข้องกับ,เป็นธุรกิจเกี่ยวกับ...
ธุรกิจขนส่งสินค้าภายในประเทศที่เกี่ยวข้องกับสินค้า,การประโยชน์ศัตรู สำหรับการประโยชน์ศัตรู สำหรับการประโยชน์ศัตรู สำหรับการประโยชน์ศัตรู สำหรับการประโยชน์ศัตรู สำหรับการประโยชน์ศัตรู สำหรับการประโยชน์ศัตรู สำหรับการประโยชน์ศัตรู สำหรับการประโยชน์ศัตรู สำหรับการประโยชน์ศัตรู สำหรับการประโยชน์ศัตรู สำหรับการประโยชน์ศัตรู สำหรับการประโยชน์ศัตรู สำหรับการประโยชน์ศัตรู สำหรับการประโยชน์ศัตรู สำหรับการประโยชน์ศัตรู สำหรับการประโยชน์ศัตรู สำหรับการประโยชน์ศัตรู สำหรับการประโยชน์ศัตรู สำหรับการประโยชน์ศัตรู สำ
e commerce,ขอบคุณมาก
ในปี2022ครับธุรกิจของทริพเพิลไอเนี่ยก็ได้เข้าซื้อบริษัทเอเชียจีเอสเอเอ็มที่มาเลเซียซึ่งเป็นชิ้นส่วนสําคัญในรายการเพิ่มคุณความสมบูรณ์ของธุรกิจจีเอสเอในการมุ่งสู่การเป็นผู้นําในระดับภูมิภาค,ศูนย์ 1022 ครับ ศูนย์กิจของ GSI นี่ ก็ได้เข้าซื้อบริษัท Asia GSAM ที่มาร์ส เอเซีย ซึ่งเป็นชิ้นส่วนสำคัญในการเพิ่มคูลความสมบูรณ์ของศูนย์กิจ GSA ในการมุ่งสู่การเป็นผู้นำในอดับผู้มิพาก
และต่อมาเราได้มีการทําการปรับโครงสร้างใหม่ของธุรกิจ,และต่อมาเราได้ไปการทำการ ปรับโครงสร้างใหม่ของภูริกิจจีน
gsa,ที่...ที่สาย...
ให้อยู่ภายใต้ธุรกิจภายใต้ของ ANI,คุณพุทธจะอยู่ในการสร้างการนี้ไหม?
เพื่อเตรียมตัวเข้าสู่ listed,เพื่อเตรียมตัวเข้าสู่ลิฟต์เต็ดในตา
ในตลาดหลักทรัพย์ในปีถัดไปครับ,และสอบในปีที่ต่อไปครับ
ส่วนในปี 2023 นั้น,ในปี 2023 นั้น
ทางทริพเพิลไอเอง,อันที่พอไอ้เองนะครับ
ได้เตรียมตัวในการนํา ANI,ได้เตรียมตัวในการนำ A&I ของเรา
เข้าจดทะเบียนใน,ก็จะได้ไหนทับทน
set ภายในสิ้นปีนี้ครับ,แพร่ใดชื่นปีนี้ครับ
อันนี้คือธุรกิจทั้งหมดของทริพเพิลไอที่ผ่านมาจะเห็นได้ว่าเราลงทุนในธุรกิจที่เป็นโลจิสติกส์ที่มันเกี่ยวเนื่องกัน,อันนี้คือทุกขิดทั้งหมดของชิปไอด์ที่ผ่านมา จะเห็นได้ว่าเราลงทุนในทุกขิดที่เป็นโรซทิศติกที่มันเกี่ยวเรื่องกัน
ทั้งการเพิ่มขยายความสามารถในการแข่งขัน,ทางการเพิ่มขยายความสามารถแรงขัน
เพิ่มในของตัว,เพิ่มในของตัว...
เอ่อ,อืม...พอเค้าพูดถึงแล้วนะครับ
ขอบเขตการให้บริการและก็เซอร์วิสต่างต่างให้มันครอบคลุมเซอร์วิสโลจิสติกส์ให้ครอบคลุมทางเอเชียเพิ่มมากขึ้นครับ,ให้บริการและสวิตต่าง ๆ ให้มันคอบคุมสวิตลอร์จิติกให้คอบคุมทางอเอสเชียเพื่อมากขึ้นครับ
ในส่วนถัดไปนะครับตัวนี้จะเป็นตัวbussinessของเราทั้งกรุ๊ปของทริปเปิ้ลไอเอง,ในส่วนต่อไป ตัวนี้จะเป็นปิดเช็ดของเราทั้งคลุกของชิคกี้พายเอง
ซึ่ง,สวัสดีครับ
ซึ่งบริษัททริพเพิลไอโลจิสติกส์เนี่ยได้ให้บริการโลจิสติกส์แบบครบวงจรในระดับภูมิภาค,ซึ่งบริษัทที่ไมล์โรจิสติกได้ให้บริการโรจิสติกแบบคบวงจรในหนักผู้มีภาค
ซึ่งแบ่งเป็นสี่bussinessย่อยด้วยกันนะครับ,ซึ่งแบ่งเป็น 4 วิเศษด้วยกันนะครับ
มีหนึ่งเป็นAir Freightนะครับ,เป็นแอร์เฟรด
ชนิดที่สองเป็นChemical,เป็นเคมีเฟิล
ธุรกิจที่สามเป็นLogistics,ดูกิดดิสา เอดรอด ดิสติก แมนแนล
management,ม.ค
และธุรกิจที่สี่เป็น Sea and,นักกิจที่ เป็นเชียร์อีกแน่
inland transport,และท่าสับบาท
ซึ่งเรามาดูตัวAir Freightก่อน,แล้วมาดูกับตัวแอนเฟรดดอน
ตัวAir Freightจะแบ่งเป็นสี่ business,อาเฟรดจะแบ่งเป็น 4 บินเซตด้วย
ด้วยกันนะครับ business,วิชัดแลต
แรกคือตัว gsa,ก็คือ ความสุขที่สุดของการการกลับมาที่โรงพยาบาล
หรือว่าตัว general sales agent,ก็ตัวเจนราว เสียหู๊ะเอเจน
หรือเรียกว่าเป็นตัวแทนขายระหว่างให้แก่สายการบิน,หรือเรียกว่าเปิดตัวแทนขายระวังให้แกะสายกันบิน
ซึ่งหน้าที่ของเขาคือ,น่าที่ของเขาคือ...
สายการบินจะ appoint,อาจจะพยายาม...
มาให้เราดูแลที่เป็นในฐานะ gsa,ที่เป็นแผนศาสตร์ GSA ด้วย
ดูแลบริหารจัดการพื้นที่ใต้ท้องระวังทั้งหมดของสายการบิน,บริฐานจัดการฝืนที่ใต้ท้องระวังของสายการบิน
ในการขนส่งสินค้านะครับ,การผลส่งสินภานะครับ
ส่วนที่ 2,ตอนที่ 3 นาที ศาสดีค่ะ
ตัว Wholesale Freight Forwarder,โอ้โห เสียวเฟส ฟังว่าเดิม
เป็นธุรกิจรับจัดการขนส่งสินค้า,เป็นธุรกิจรับจัดการผลส่งสินค้า
