true_text,pred_text
ก็คงที่เป็นอัตราส่วนที่ใช้จาก,โปรดติดตามตอนต่อไป
"ทางด้านของโพลิเมอร์ที่มาจากน้ํามันมากหน่อยก็คือพวกทางด้านของอีพีพี
ซึ่งเป็นแพ็คเกจจิ้ง นะครับ",คือพวกทั้งนั้นของ EPP ซึ่งเป็น Packaging
"ส่วนแอโรเฟคเอง
เรามีมาตรฐานในด้านของกําไรขั้นต้นเราสูง",ส่วน Aeroflag เอง เรามีมัตตาศาสตร์ในด้านของกำไรขั้นต้นเราสูง
"นะครับ เป็นนวัตกรรม
กับทางด้านของตัว aero klas tjm",โปรดติดตามตอนต่อไป
"พวกเนี้ย มันก็มี gp
ที่ค่อนข้างสูงนะครับ",มันก็มี GP ที่ค่อนข้างสูงนะครับ
"เพราะฉะนั้นในอัตราส่วนของที่ผลิตภัณฑ์ที่มาจากทางด้านของน้ํามันเนี่ย
มันจะมีอัตราส่วนน้อยกว่าอีพีพี",มีอัตราส่วนของที่ปริตพันที่มาจากทั้งนั้นของน้ำมันมันจะมีอัตราส่วนน้อยกว่า EPP
"เพราะฉะนั้นน่ะ
เราสามารถที่จะบริหารจัดการได้นะครับ",เพราะฉะนั้น เราสามารถที่จะบริการจัดการได้
"ในเรื่องของ เอ่อ
และแนวโน้มวัตถุดิบเนี่ย ในช่วง",ในเรื่องของลานแดวโน้มวัตถุดิบ ในช่วง...
"ปีนี้ ไตรมาส 4 เราขึ้นไปเนี่ย
ตั้งแต่ปลายไตรมาสสามและ",ตอนนี้ ตายมาสตีเราขึ้นไป ตั้งแต่ปลายตายมาสามแล้ว
"ถึงไตรมาส 4 ขึ้นไปเนี่ย
วัตถุดิบต่างๆ",โปรดติดตามตอนต่อไป
"ก็เริ่มลดลงมานะครับ
ซึ่งมันลดลงมา year on year",ต่อไปก็ต่อไปก็ต่อไป
"ลดลงมาทางด้านของ qq ด้วย นะครับ
มีบางตัวเท่านั้นที่ยังขึ้นมา",โปรดติดตามตอนต่อไป
"แต่โดยส่วนใหญ่นะครับ
มันก็จะมีแนวโน้มที่ลดลงมา",มันก็จะมีแหนวนมที่ลดลงมา ทำให้มันไม่มีแหวน
"ทําให้เราน่าจะเป็นประโยชน์ต่อต้นทุน
วัตถุดิบต่าง ๆ ที่",โปรดติดตามตอนต่อไป
"ที่ต้องไปแลกกับทางด้านของ
เรื่องค่าใช้จ่ายต่าง ๆ",ความสุขที่สุดของความสุขที่สุดของความสุขที่สุดของความสุขที่สุดของความสุขที่สุดของความสุขที่สุดของความสุขที่สุดของความสุขที่สุดของความสุขที่สุดของความสุขที่สุดของความสุขที่สุดของความสุขที่สุดของความสุขที่สุดของความสุขที่สุดของความสุขที่สุดของความสุขที่สุดของความสุขที่สุดของความสุขที่สุดของความสุขที่สุดของความสุขที่สุดของความสุขที่สุดของความสุขที่สุดของความสุขที่สุดของความสุขที่สุดของความสุขที่สุดของความสุขที่สุดของความสุขที่สุดของความสุขที่สุดของความสุขที่สุดของความสุขที่สุดของความสุขที่สุดของความสุขที่สุดของความสุขที่สุดของความสุขที่สุดของคว
"ที่เกิดขึ้นอย่างที่คุณปภาวดีได้ให้ข่าวสารไปแล้วนะครับว่า
ในช่วงของ การขาดแคลน",ความสุขที่สุดของความรู้สึก และความรู้สึกที่สุดของความรู้สึก
"แรงงานด้วยนะครับ
ในขณะที่มีการค่าใช้จ่ายเรื่องของค่าเช่า",โปรดติดตามตอนต่อไป
"ค่าโลจิสติกส์ต่าง ๆ
ที่มันสูงในปีที่ผ่าน ๆ มานะครับ",โลจิสติกต่าง ๆ ที่มันสูงในปีที่ผ่าน ๆ มานะครับ
"ค่าแรง ยังไงก็ยังขึ้นสูงอยู่
เพราะเรายังไงก็ต้องดูแลทีมงานทุกคน",ค่าแรงยังไงก็ยังขึ้นสูงอยู่ พอเรายังไงก็ต้องดูแลทีมงานทุกคน
"ให้เขาเนี่ยมีความมั่นคงในการทํางานกับเรานะครับ
แล้วก็มีความ",โปรดติดตามตอนต่อไป
"เจริญเติบโตก้าวหน้าไปพร้อมกับเราได้ด้วยนะครับ
เพราะ เมื่อเรามีความมั่นคง",โปรดติดตามตอนต่อไป
"มั่งคั่ง ยั่งยืนเกิดขึ้น
เพราะเราจะช่วยกันทําให้",อันตรายที่สุดในโลก
"productivity ของเราสูงขึ้น
เพราะต่อหน่วยต่อคนต่อ",โปรดติวิตีของเราสูงขึ้น พอต่อหนุ่มต่อคนต่อปี
"ก็จะลดลงมาได้ด้วย นะครับ
ไอ้ตรงนี้เราก็ทํามาโดยตลอด",ตรงนี้เราก็ทำมาโดยตลอด
"ค่าไฟฟ้า นะครับ
ที่ทั้งหลายเนี่ย",ค่าไฟฟ้านะครับ จุดอิติที่ทั้งหลายเนี่ย
"เราก็เพิ่งทําสําเร็จเรียบร้อยละ
ติดตั้งโซลาร์ลูฟ",และติดตั้งโตล่ารูฟ
"ซึ่งเราก็ติดตั้งไป 18 ถึง 20 เมกะวัตต์
นะฮะ เราก็สามารถที่จะไปลด",ติดตั้งไป 18-20 MW นะฮะ เราก็ถามาที่จะไปลดในวิธี
"ในเรื่องเกี่ยวกับทางด้านของต้นทุนทําค่าไฟฟ้าเนี่ย
ปี ๆ นึงก็จะประหยัดได้",เรื่องเกี่ยวกับทางด้านของต้นทุน ทางความไฟฟ้านี่ปี ๆ นึงก็จะประหยัดได้
"หลาย 10 ล้านบาท
60 ถึง 80 ล้านบาททีเดียวนะครับ",หลายสิบล้านบาท หกสิบถึงแปดสิบล้านบาททีเดียว
"ในขณะที่ถ้า คู่แข่งขันของเราหลาย
ๆ แห่ง",อาจารย์ อินดรี อินดรี อินดรี อินดรี อินดรี อินดรี อินดรี อินดรี อินดรี อินดรี อินดรี อินดรี อินดรี อินดรี อินดรี อินดรี อินดรี อินดรี อินดรี อินดรี อินดรี อินดรี อินดรี อินดรี อินดรี อินดรี อินดรี อินดรี อินดรี อินดรี อินดรี อินดรี อินดรี อินดรี อินดรี อินดรี อินดรี อินดรี อินดรี อินดรี อินดรี อินดรี อินดรี อินดรี อินดรี อินดรี อินดรี อินดรี อินดรี อินดรี อินดรี อินดรี อินดรี อินดรี อินดรี อินดรี อินดรี อินดรี อินดรี อินดรี อินดรี อินดรี อิน
"ไม่ได้ติดตั้งโซลาร์ลูฟแล้ว
ค่าไฟมันขึ้นมัน เนี่ย",โซลารูปแล้ว ถ้าไฟมันขึ้นมาด้วยเนี่ย
"เขาก็โดนสองต่อนะครับ
เขาก็จะมีการแข่งขัน",ก็โดน 2 ต่อนะครับเขาก็จะมีการแข่งกัน
"ความสามารถในการแข่งขันกับเราก็จะน้อยลง
นะครับ นี่ก็จะหนึ่ง",การแข่งขันกับเราก็จะน้อยลง
"เป็นหนึ่งประโยชน์ของเราด้วยนะครับ
ทําให้เราสามารถจะมีการเติบโตได้นะครับ",ประโยชน์ของเราด้วยนะครับทำให้เราสามารถจะมีการเติบโตได้นะครับ
"ในเรื่องของ เอ่อ
ตัวที่เป็นออโตเมชั่นนะฮะ",ตัวที่เป็น Automation
"ซิสเต็มของเราเนี่ย
เราก็ใช้มาโดยตลอด",โปรดติดตามตอนต่อไป
"เครื่องจักรเครื่องกลที่เราทํามาทําให้มันมีการทํา
productivity สูงขึ้น",โปรดติดตามตอนต่อไป
"ใช้คนที่น้อยลงนะครับ
เราก็สามารถที่จะดําเนินในธุรกิจการเติบโตได้",คนที่น้อยลงนะครับ เราก็สามารถที่จะดำเนินในธุรกิจการเติบโตได้
"เรามี 3 ป นะครับ ก็ยังใช้อยู่
นะครับ ในด้านของการตลาดต่างๆ",โนมี 3 ป. ก็ยังใช้อยู่นะครับ ในด้านของการตลาดต่าง ๆ
"ของเรา
เราก็มีมาตรการหลายมาตรการโดยเฉพาะในส่วนของ",ราวก็มีมาตากาน ไหลมาตากาน ด้วยเจ้าฝ่า
"aeroflex เอง นะครับ
เราก็มีหลายรุ่น",โปรดติดตามตอนต่อไป
"ไม่ว่าจะเป็นรุ่นที่เกี่ยวกับทางด้านของการดําเนินงานในเรื่องของ
ultra low temperature",โปรดติดตามตอนต่อไป
"หรือว่าใช้ในส่วนของท่อส่งลม
นะครับ แล้วก็ใช้ใน look",แล้วก็ใช้ในลูป
"insuration นะครับ หลาย ๆ
ส่วนเนี่ย",อินสุเรชัน นี่ครับ หลาย ๆ ส่วนนี่
"มันทําให้เรามีทางด้านของเครื่องมือในการเล่น
ในสู่ตลาดต่าง ๆ เหล่านี้มากอย่าง",ที่ทำให้เรามีทางด้านของเครื่องมือในการเล่นในสูงตลาดต่างๆ เหล่านี้มากยังควบคุม
"แล้วก็
สามารถกําหนดในเรื่องของราคาได้ในหลายๆ",และก็ ตามารถคำนถในเรื่องของราคาได้ในหลาย ๆ รุ่นของ
"รุ่นของเราที่มีอยู่นะครับ
ในส่วนของตลาดเราก็กว้างขยายไปทั่วโลก 100 กว่าประเทศที่เรามีเอเย่นต์",โปรดติดตามตอนต่อไป
"มีโรงงานก็หลายประเทศนะครับ
ทั้งจีน อเมริกา อินเดียนะครับ",ก็หลายประเทศนะครับทั้งจีน อเมริกา อินเดียนะครับ
"ตรงนี้ แล้วก็อีกหน่อย
ก็มีทางยุโรปนะครับ",โปรดติดตามตอนต่อไป
"ที่ยังมีอยู่นะครับ
ส่วนทางด้านของ aero klas tjm",ส่วนทางด้านของ Arrowcast TJM-X และ Arrowcast TJM-X และ Arrowcast TJM-X
"เองจริง ๆ เขาก็มีตลาด
พร้อมเติบโตแน่",โปรดติดตามตอนต่อไป
"ถ้าตอนนี้เราก็เติบโตอยู่แล้ว
เราก็มีการออเดอร์ต่าง ๆ",ตอนนี้เราก็เติบโตอยู่แล้ว เราก็มีคารออเดอร์ต่าง ๆ แล้ว
"เราก็เข้ามาเต็ม
เราก็ทําเสาร์อาทิตย์อยู่ นะครับ",เราก็เข้ามาเต็ม เราก็ทำเสาอาทิตย์อยู่นะครับ
"แต่ส่วนของออสเตรเลีย
เท่านั้นเนี่ยนะครับ",แต่ส่วนของออตเตรียเท่านั้นเนี่ยนะครับ
"ก็คิดว่าเขาคงจะดีขึ้นในช่วงของควอเตอร์นะฮะ
ที่ 4 ขึ้นไป นะครับ",ความสุขของคุณ ตอนที่ 4 ขึ้นไป
"ก็น่าจะดีขึ้น นะครับ
แล้วก็ในส่วนของ south app",เพราะน่าจะดีขึ้นนะครับแล้วก็ในส่วนของซอลแอป
"ในการดีเลย์
เรื่องของทางด้านเกี่ยวกับการผลิต",โปรดติดตามตอนต่อไป
"นะครับ รถยนต์ในแอฟริกาใต้เนี่ย
ถ้าเค้าเริ่มผลิตได้เร็วขึ้น",อาฟริกาไทย ถ้าเขาเริ่มผลิตได้เร็วขึ้นแล้ว
"เราก็สามารถ
ดําเนินธุรกิจที่มีกําไรได้เร็วขึ้นนะครับ",แล้วก็สามารถดำเนินธุรกิจที่มีกำไรได้เร็วขึ้น นะครับ
"ตรงนี้ก็เป็นลักษณะ backlog ต่าง
ๆ ที่มีมาเยอะนะครับ ส่วน epp",โปรดติดตามตอนต่อไป
"ก็เป็นอีกช่วงนึงที่เราได้ต้นทุนที่เริ่มกลับเข้ามา
การให้ความสามารถ ความได้เปรียบ",โปรดติดตามตอนต่อไป
"ในการแข่งขันที่สูงขึ้น
กับแคปของเราที่มีมากขึ้น",การแข่งขันที่สูงขึ้น กับแคร็ปของเราที่มีมากขึ้น
"เรามียุทธศาสตร์
ในเรื่องของการดําเนินงาน นะครับ",โปรดติดตามตอนต่อไป
"เร็วๆ นี้เราก็ได้งาน นะครับ
ในส่วนของทางด้าน เอ่อ",เรื่องนี้เราก็ได้งานนะครับ ในส่วนของทางด้าน
"เครื่องเดิม
ที่มีชื่อเสียงแห่งหนึ่งของประเทศไทย",โปรดติดตามตอนต่อไป
"นะครับ แล้วก็เริ่มดําเนินการ
ผลิตต่างๆ เหล่านี้",โปรดติดตามตอนต่อไป
"แล้วก็ส่วนของในด้านตลาดเอ บี ซี
ดี อี นะครับ ก็เป็นตลาดที่เรา",โปรดติดตามตอนต่อไป
"นะครับ พร้อมที่จะบุกเข้าไปสู่
ในการเพิ่ม ในด้านของ utilize base เอ่อ",พร้อมที่จะบุกเข้าไปสู่ในการเพิ่มในด้านของ Utilization Rate
"ของเราเนี่ยให้สูงขึ้น
เพราะฉะนั้นต่างๆ",เพราะฉะนั้นตัดต่างหลอกนี่
"เหล่าเนี้ยดีขึ้นกับจอยเวนเจอร์ต่างๆ
ที่ ที่ดีขึ้น",โปรดติดตามตอนต่อไป
"เราดูจากการที่เราเติบโตได้
ถ้าเรามาดูนะครับ",ต้องดูจากการที่เราเติบโตได้ ถ้าเรามาดูนะครับ
"เราก็ดูที่ไอเอ็มเอฟล่าสุด
ที่ผมพูดมาทั้งหมดเนี่ย",โปรดติดตามตอนต่อไป
"มันมีการเติบโตเป็นไปได้มั้ย
มันเป็นไปได้นะครับ",มันเป็นไปได้นะครับ
"เพราะว่าอย่างน้อยเนี่ยการเติบโตของทางอัพเดทไอเอ็มเอฟ
ข้อมูลอัพเดทที่ Jan อยู่ที่ 2023 เนี่ยนะครับ",อย่างน้อยการเติบโตของทาง Update IMF ข้อมูล Updateที่แจนอยู่ที่ 2023 นี่นะครับ
"จะเห็นว่าในปี 2023
เราก็มีการเติบโตของโลกจีดีพีที่ 2.9 เปอร์เซ็นต์",เห็นว่าในปี 2023 เราก็มีการเติบโตของโลก GDP ที่ 2.9%
"นะครับ
เขาปรับให้ดีขึ้น 0.2 เปอร์เซ็นต์ด้วย",และเขาปรับให้ดีขึ้น 0.2% ด้วย
"มาจากทางด้านของยูไนเต็ด สเตท
ก็คืออเมริกา",อันตราย อันตราย อินตาล
"จาก 0.4 มาเป็นทางด้านของเพิ่ม  0.4 และเป็น 1.4
นะครับ แล้วก็นี้เราขาย aeroflex",โปรดติดตามตอนต่อไป
"เราโตได้แน่นะครับ
ยูโรก็ปรับขึ้นมาจุดสองก็เป็นศูนย์จุดเจ็ด",โตได้แน่นะครับ ยูโร ก็ปับขึ้นมา จุด 2 ก็เป็น 0.7
"อ่า เราขายทางด้าน aero klas
aeroflex นะครับ ดีก็โตได้ japan",อาโลกาลัด อาโลกรัส อาโลกรัส ฟริก นะครับ ดีก็โตได้ เจปแปน
"เขาก็ปรับขึ้นอีกศูนย์จุดสอง
นะครับ",โปรดติดตามตอนต่อไป
"มันก็ทําให้เติบโตหนึ่งจุดแปดแล้วเป็นตลาดที่ใหญ่ของ
aeroflex ของเรา united kingdom",ก็ทำให้ตรวจโต 1.8 แล้วเป็นตลาดที่ใหญ่ของ อแอลโรเฟต ของเรา ยุนิเทคิงดอม
โอเคลดลงหน่อยแต่ demand,โอเค ลดตรงหน่อย แต่ ดีมาร์นที่เขาหายไปนาน กลับ
"ที่เขาหายไปนานกลับเข้ามาซื้อพวกทางด้านของตัว
ของเรา",ซื้อพวกทางนั้น ตัวคานุปปี่ของเรา
"พวกใน เนเธอแลนด์ก็มีการซื้อกันมากขึ้นนะครับ
ขายหน้าของเราก็มีโรงงานนะครับ",โปรดติดตามตอนต่อไป
