true_text,pred_text
 เราสามารถปรับปรุงประสิทธิภาพเนี่ยในการผลิตเนี่ยในช่วง 6 เดือน,เราก็สามารถปรับปรุงประสิทธิภาพในการผลิตในโซนหุ่นเกลื่อน
ได้จนถึงปัจจุบันเราก็ปรับปรุงอยู่ตลอดเวลานะครับเพื่อให้,แม่จะดื่มปัจจุบันแล้วก็ปรับตรงนี้ตลอดเวลานะครับเพื่อให้
เพื่อให้เขาเรียกว่า เอ่อ ในแต่ละ Batch size เนี่ยสามารถ,เพื่อให้ พวก เนี่ย เอิ่ม ใน แต่ละ แบบ สไตล์ เนี่ย สามารถ
อาจจะทำได้ 97 กล่องไม่ใช่ทำได้แค่ 94 กล่องเป็นประมาณนี้นะครับ,มัน จะ ทำ ได้ เก้า สิบ เจ็ด เจ้า ไม่ ได้ ทำ ได้ แค่ เก้า สิบ สี่ เจ้า ไป ประมาณ นี้ ด้วย ครับ
คิดว่าในไตรมาส 3 ไตรมาส 4 จะดีขึ้นนะครับ,ชื่อว่านี่เป็นมาตรศาสตร์ เป็นมาตรศีรษฎี ซึ่งเนื้อหัว
โภชนเภสัชถึงได้มียอดขายลดลงก็ ก็ต้องยอมรับว่าเหมือนเหตุผลเรื่องยานะครับ,โฆษณะเทศะถึงได้มียอดขายลดลงก็ก็ยอมรับว่าเหมือนเหตุผลต้องหย่ากับ
ตั้งแต่เริ่มต้นปีมาเรามีการปรับราคาไปนะครับ,คือตั้งแต่ต้นปีต้นมาเนี่ยเรามีการปรับรักษาไปเลยครับ
ก็ ก็ ก็มีการกระทบอยู่เหมือนกัน แล้วก็เลยมีการ Revisit อยู่ว่าเราจำเป็นที่จะต้องมีการให้โปรโมชั่นอะไรต่าง ๆ กลับไป,ก็ พวกเขา มี การ สะทก อยู่ เหมือนกัน แล้วก็เลย มี การ มี ลิขสิทธิ์ อยู่ ว่า เรา จำเป็น ที่จะ ต้อง ให้ โปรโมชั่น อะไร ต่าง นี้ จับ ไป
ในราคาเดิม หรือว่าการที่เราพยายามจะลดต้นทุนการผลิตเนี่ยลงนะครับ,เป็นราคาเดิมแต่ว่าเราพยายามที่จะลดต้นอยู่ในการผลิตเวียนที่พอคุ้มนะครับ
ตอนนี้เราก็คิดว่าในไตรมาส 3 4 เนี่ยน่าจะกลับ,อันนี้ลูกก็สิว่าในไตรมาสสารสีเหลืองน่าจะจับ
ร้านขายยา ณ ปัจจุบันเปิดได้กี่สาขาแล้วนะครับ,ล้าง ขาย ยา แล้ว ปัจจุบัน เปิด ได้ สี่ สาขา แล้ว นะ ฮะ
ก็ปัจจุบันก็ที่เพิ่งโชว์ในสไลด์เนี่ย Little Walk น่าจะเป็นสาขาที่ 28,เขาปัจจุบัน ซอ ที่พึ่งชนในสไลด์ เนี่ย นิตเตอร์วอร์ด ได้ หนึ่ง ศาสตร์ สาม ที่ ยี่สิบ แปด
ที่นี้เหลืออีกแค่ 3 เดือนเนี่ยคิดว่าน่าจะเปิดได้อีกประมาณ 3-4 สาขานะครับ ปีนี้เราก็จะจบที่ 30-31,อันนี้เลยแค่สามเดือนเนี่ยก็คิดว่าน่าจะเปิดได้เนี่ย ประมาณสามถึงสี่สิบสามขานะครับ ปีนี้เราก็จะจบทีสามสิบสามสิบเอ็ด
ตาม Goal Setting Theory เรามีแผนไว้ค่อนข้างสูงนะครับ,ความ Full Saving Theory หรือเปล่า ที่โดนความมีแผนคือค่อนข้างสูงนะครับ
เพราะฉะนั้นมันคล้ายคล้ายเราตั้งเป้าว่าจะปิดน้องน้องฝ่ายเซลล์ตั้งเป้าว่าจะปิด 120,แต่มันเสียใจว่าเราตั้งเป้าว่าสติ สิงห์ ดวงว้าวใส่สืบตั้งเป้าสติร้อยยี่สิบ
แต่ถ้าเราตั้งเป้าจาก 20 เป็นแค่ 30 เวลาเราตกมาจะเหลือแค่ 25 นะครับ,แต่ถ้าเราตั้งเป้าจาก 20 เป็นแค่ 30 เวลาลบออกมาจะเหลือแค่ 25 นะครับ
งั้นก็เป็นเรื่องปกติที่เราจะตั้งเป้าไว้สูงอยู่แล้ว เป็น Best case ว่าถ้าเกิดเรา,และเจ้าก็เป็นเรื่องที่เราบอกติดในสตาร์ท เป้าไปฟุ้งอยู่แล้ว และมีบทเคส ๆ ว่าถ้าเกิดเรา
เราเปิดโดยไม่สะดุดอะไรไม่ว่าเรื่องของการ Landlord ส่งมอบพื้นที่ การยื่นขออนุญาตอย.เนี่ยเราจะเปิดได้เท่าไหร่,เราเปิด หรือไม่สะดุด อะไร ไม่ ว่า จะ เรื่อง ของ การ แว่น หลอด สมมติ พื้นที่ จะ ยิ่ง ขออนุญาต เอา ยอ เนี่ย เรา จะ เปิด ได้ เท่าไหร่
 ก็คำตอบคือเปิดได้อยู่ราว ๆ 30-31 สาขา,ก็ ผม ตอบ ว่า ฟู เนี่ย จะ เปิด ได้ อยู่ ดอก สาม สี่ ถึง สาม สี่ สาม สาม
เพราะว่าอย่างกรณีที่ภูเก็ตก็ใช้เวลาค่อนข้างมาก,เพราะที่เราพบว่าอย่างกรณีที่ภูเก็ตก็ใช้เวลาค่อนข้างมาก
เราแล้วก็ในการที่จะออกแบบ ดีไซน์ การก่อสร้างด้วย,แล้วก็ในการที่จะออกแบบอิสระแล้วก็การก่อสร้างด้วย
Gross Profit ของร้านยา LAB Pharmacy ปัจจุบันก็ดีขึ้นเรื่อย ๆ นะครับ Gross Profit เราน่า,คอร์ส หกสิบ สอง ล้าน ยาน หนัก สอง ล้าน สี่ ปัจจุบัน ก็ดีขึ้นเรื่อย ๆ นะครับ คอร์ส หกสิบ แบบนี้
ถัดไปเป็นคำถามเกี่ยวกับโรงงายผลิตยานะครับเลื่อนขึ้นไปหน่อย,ถัดไป ไม่ช้ำถังเก็บกับโรงงานผลิตยานะครับ เรื่องที่ไม่หลง
สำหรับโรงงานผลิตยาทั้งหมดนะครับบริษัทใช้กำลังการผลิตอยู่ที่กี่ %,สำหรับโรงงานผลิตยาทั้งหมดนะครับ บริษัทมีการใช้กำลังการผลิตอยู่ที่สิบเปอร์เซ็นต์
เอ่อ ก็ยอมรับว่าปัจจุบันใช้กำลังการผลิตไม่ ไม่ได้มากเท่าไหร่,เอ่อ ก็ ยอมรับ นะ ครับ ว่า ปัจจุบัน ใช้ ข้อมูล อุดมศิลป์ นี้ ไม่ ดี มาก เท่าไหร่
ก็ก็ เราก็พยายาม อย่างเช่นเราที่จะมีโปรเจ็คที่เราจะทำยาตาของเราเองเนี่ย,เพราะเมื่อเราต้องการ มันจะมีสิทธิที่สำคัญกว่าเราเอง
หรือการไปคุย partnership นะครับที่ผมเดินทางต่าง ๆ ก็คือไปคุย Partnershipเนี่ย,อาจารย์ไปคุยภาษาอังกฤษนะครับที่ผมเดินทางหรือต่างๆเนี่ยก็คือไปคุยภาษาอังกฤษเนี่ย
เช่นไปดูโรงงาน Lotus Pharmaceutical ของทาง,ฉันไปดูโรงงานหลวงพัดฟอร์โมซิลิโฟลด์ของฉัน
แล้วทางเขาเองก็มีมา Audit โรงงาน 3 รอบนะครับ,คนไหนเขาเองก็มีการมาออดิศน์โรงแรม 3 รอบนะครับ
ก็วางแผน ประชุมร่วมกันเรื่องอะไรต่าง ๆ แต่มันต้องใช้เวลาไปหมดเลย,พวกเขาแข็งใจ ประชุมร่วมกัน เรื่องใด ๆ ต่าง ๆ ต้องใช้เวลาไปหมดเลย
Bad speech remove from dataset,คุณจ้างเป็นตัวดี ความรู้มือจับ
บริษัทนึงที่จีนนะครับก็ยัง On-going,ไปสับลงที่มุมจีนนะครับก็ยังอ่อนตัวยิ่งเลยครับ
ก็คิดว่าถ้ามันคืบหน้ายังไงก็จะมาเรียนในใน Opportunity Day ครั้งหน้า,เราคิดว่าถ้ามันขึ้นได้ยังไง เราจะมาเรียนในออฟเซอร์นิตีนไปครั้งหน้า
เรา tranfer ตำหรับยาหลาย ๆ ตำหรับไปที่อยุธยานะครับ,ไป แทนเซอร์ จำหลักยา หลังจากนี้ จำหลักไปที่ ยุทธยา นะครับ
ด้วย Field capacity อย่างเช่น Bella para ก็จะปิดอยู่ภายใต้,พวกสิ่งที่เขาตัดสิทธิ เช่น เดอะลาฮาลา เนเจอร์ติก อยู่ภายใต้
 แล้วก็สำหรับสมุทรปราการนะครับฝั่งยาตอนนี้ก็ใช้อยู่ที่ 100% อยู่แล้ว,แล้วก็สำหรับสมุนประการอย่างนี้ก็สัญญาเนี่ยใช้อยู่ที่ร้อยเปอร์เซ็นต์อยู่แล้ว
ที่เป็นอาหารเสริมก็ยังเหลือ capacity นะครับ,ที่เป็นผลิตภัณฑ์เสริมแล้ว เพราะยังมีคุณภาพที่ดีนะครับ
ตอนนี้เราก็เลยเริ่มเปิดรับที่จะรับจ้างผลิตให้บริษัทมากขึ้นนะครับ ปัจจุบันเรารับจ้างผลิตให้อยู่ 2 บริษัทนะครับ,วันนี้เราก็เลยเริ่มเปิดรับที่จะรับจ้างผลิตให้บริษัทนะครับคือดวงปฏิเสธเรารับจ้างผลิตให้อยู่สองบริษัทนะครับ
ครับแต่เราก็ยอมรับว่าเราจะรับแต่รายใหญ่ ๆ นะครับ,จะยอมรับว่าเราจะรับได้หลายใหญ่ ๆ อยู่แล้ว
เป็นบริษัทที่มาตรฐานนะครับจะไม่ได้รับทั่วไป,เป็น ประชาธิมิตรฐาน มันจะปรับปรุง จน ไม่ ได้ หลอก ทั่วไป
รับล็อตสองล็อตเงี้ย เราจะรับบริษัทที่มีแผน,รัฐบักสองหลักเนี่ย เราจะรับไปจากที่ค่อนข้างจะมีแผน
ชื่อว่าทั้งสองบริษัททุกท่านก็คงเห็นอยู่ไม่ว่าจะไทยยูเนี่ยนหรือทาง,ก็ชื่อว่าทั้งสองบริษัท คุณท่านก็คงเห็นอยู่แล้ว ไม่ว่าจะถ่ายยืนยืนหรือเปล่า
ก็ตอนนี้เราก็กำลังคุยกับอีก 2 รายนะครับที่จะเข้ามาทำการจ้างผลิต,พอตอนนี้เราก็มาคุยกับ ตอนนี้สังวราชนะครับ ในการที่จะเข้ามาจ้างผลิต
คำถามถัดไป Bella para ที่ใช้แผงเป็นอลูมิเนียม,คำถามถัดไป เบลล่าคาราที่ใช้แผงเป็นอลูมิเนียม
แพงกว่าคู่แข่งที่ใช้เป็นพลาสติกไหมครับ เราแพงกว่า,แพง กว่า กุ้งแข็ง ที่ ใช้ พลาสติก ไว้ ทำ ออก แพง กว่า
จริง จริงปล้วในแง่ของเนื่องจากผมเองก็เป็นเภสัชนะครับ บริษัทเรามีแต่บุคลากรทางการแพทย์มในบริษัทนะครับ,จริง ๆ แล้วในแง่ของเนื้อจากผมเองก็เป็นเภสัชนะครับ ไม่ใช่ว่ามี มีแต่อุปกรณ์ทางการแทนในเภสัชนะครับ
เรามีเอ่อ เภสัชกร มีสัตวแพทย์ มีนักวิทยาศาสตร์เนี่ย,เรามีเทศกะเช็ดกอง มีศัตรวาแครต มีนักวิทยาศาสตร์ได้อยู่
โดยหลักการเนี่ยมันคือ Blister Pack เนี่ยมันจะเป็นการที่จะรักษาคุณภาพของ,เอ่อ โดยหลักการเนี่ย มันคือ เป็นดิจิตเตอร์แท็กเนี่ย มันจะเป็นการวิจารณ์รับฝาก คุณภาพผม
แต่ผมไม่สามารถพูดถึงแบรนด์อื่น ๆ ได้นะ เพราะฉะนั้นเนี่ยคือ จริงจริงแล้วอะ เอ่อ เราก็คิดว่า Blister Pack เนี่ย,แต่ผมไม่สามารถจะไปพูดถึงได้ แต่ผมก็อาจจะไม่ได้ คือเพราะฉะนั้นเนี่ยจริงๆ แล้ว เราคิดว่า missle pack เนี่ย
เพราะฉะนั้นการที่เป็น Blister Pack เนี่ยมันจะดีกว่าพลาสติกแก้วที่เป็นนิ่ม ๆ อย่างนั้น,เฮ้ย ตามที่เป็นพิษต้องแท็กแบนว่าเธอถูกกับภาษีแก้วที่เป็นแบบยิ่งนิดนิดเลยนะ
เพราะฉะนั้นเนี่ยเราจะพบว่าการที่มันสามารถรักษาคุณภาพได้ รักษาความชื้นไว้ได้เนี่ยเวลาเราทานเข้าไปเนี่ย,เพราะฉะนั้นเนี่ยเราจะพบว่าการที่มันสามารถรักษาคุณภาพได้ รักษาความคิดได้เนี่ยเวลาเราถ่ายทั่วไปเนี่ย
มันก็จะทำให้ตัวยาได้เต็ม ๆ นะครับดูดซึมได้ดี ออกฤทธิ์ได้เร็วนะครับ,มันก็จะทำให้ เอ่อ ขวยาได้เต็มๆ นะครับ อุตส่วนได้ดี ออกฤทธิ์ได้เร็วนะครับ
ปวดประจำเดือนปวดข้อปวดนู่นนี่ได้ไม่ต้องไปกินยาแรง แรงนะครับ,ปวดประจำเดือน ปวดท้อง ปวดหัวหน้า ไม่เจ้าไปกินยาแรงแรง
งั้นก็ต้องยอมรับว่าต้นทุนก็แพงกว่าแล้วก็ เราก็ถือว่าของเราก็เทียบเคียงกับ,ฉันจะต้องยอมรับว่าต้นหุ้นก็แพงกว่า แล้วก็ แล้วก็ถือว่าเราเทียบเคียงกัน
อยากสอบถาม Zeavita กับ YUUU ดูเงียบ ๆ จะแก้เกมยังไง,อยาก สอบถาม ซิมิต้า จับ อยู่ ดู เงียบ เงียบ เรา จะ เคลียร์ เกม ยังไง
คือ  Zeavita เนี่ยถ้าเป็น  Zeavita Calcium Zeavita Collagen เนี่ยคือเขาจ้างเราผลิตอย่างเดียวเลยครับ,ซิงกิต้าเนี่ย เอ่อถ้าเป็นซิงกิต้าคลอสเซียมซิงกิต้าฟรอเจนเนี่ยคือเขาจ้างผลิตเด็กเดียวนะครับ
เพราะงั้นถ้าจะเงียบลงหรือดีขึ้นก็จะขึ้นอยู่กับทาง,แล้วถ้าเจอเฮียโปรดอย่างดีก็จะขึ้นอยู่กับทางไทย
แต่ว่าถ้าภายใต้บริษัทร่วมทุนมันจะอยู่ภายใต้บริษัทที่ชื่อว่า อินเตอร์ ฟาร์มา ซีวิตต้า ,ผมหลับเลย แต่ว่าถ้าภายใต้เป็นสัตว์ร่วมทุนเนี่ยมันจะอยู่ภายใต้แบรนด์ที่เรียกว่าอุลเตอร์คอมเมอร์สิริก้า
ปัจจุบันจะมี 2 ตัวหลัก ๆนะครับ ก็คือ Lisa DHA ก็คิดว่า Lisa DHA จะ ตอนนี้ขึ้นเรื่อย ๆครับ,ปัจจุบันจะมีสองตัวหลักๆนะครับก็คือ ริซซ่า ดีเอสเอ พบชีวภาพนี้ริซซ่า ดีเอสเอ ถึงต่อลุยนี่ก็เรื่อยๆเลยครับ
ทางไทยยูเนี่ยนก็พึงพอใจกับผลประกอบการนะครับว่า,ใช่ ในปีนี้เขาเพิ่งพอใจกับผลประกอบการนะครับว่า
ตัว Lisa DHA 600 มิลลิกรัม อีกตัวคือทรูโบครับ,ตัว ริ ต้า ดี เอส เอ หก ร้อย เลข จันทร์ มี ตัว นั้น คือ ทรู โบ ล ครับ
ทรูโบเนี่ยมัน ในแง่กับทางตลาด OTC หรือ Consumer คงจะไม่ได้รับรู้นะครับเพราะว่า,ทรูโบเนี่ยมันเป็นแง่กับทางตลาด UTC ของซูมเมอร์อาจจะไม่ได้รับรู้นะครับ
ในวิสัยทัศน์ในแผนกลยุทธ์เนี่ยที่ตกลงกันก็คือการที่เราจะเอาไปเข้าโรงพยาบาลก่อน,ในวิสัยทัศน์ในแผนกลยุทธ์นี้ที่ตกลงกันที่การที่เราจะเอาไปเข้าโรงพยาบาลก่อน
ตัวทรูโบนะครับปัจจุบันก็เข้าไปได้อยู่ประมาณ 6 โรงพยาบาลแล้วก็คลินิกประมาณ 50 กว่าคลินิกนะครับ,เจอร์ทูโบ และปัจจุบันก็เข้าไปได้อยู่ประมาณหกกรูเชียร์บาทและก็คีรีนประมาณห้าสิบกรกฎีลีนะครับ
นะครับหลังจากนั้นเขาจะขอทดลองใช้อาจจะ 15 เคส 20 เคส,แล้วระหว่างทางเนี่ยถ้าไม่มีสุขภาพอ่ะมันก็จะตายไปเลยครับ
คนไข้ดีขึ้นได้ผลมันถึงจะมูฟไปสเต็ปถัดไป,ระหว่างหลังจากนั้น พวกเจ้าของก็มองใจอาจจะสิบห้าเคน ยี่สิบเคน
เพราะฉะนั้นอยากจะเรียนทุกท่านว่ามีแบรนด์อาหารเสริมแบรนด์,คนไข้ดี ซึ่งได้ผลเนี่ย ว่าถึงจะบูมไปสะเทือนถัดไป
เพราะว่าจริง ๆ แล้วมันต้องอยู่ในมาตรฐานในการผลิตที่ค่อนข้างสูงนะครับ,ฉันอยากจะเรียนทุกข้อเลยว่ามันมีแบรนด์อาหารเสริมแบรนด์ พวกเธอแบบ
เพราะฉะนั้นจริงจริงแล้ว ทุกท่านถ้าหากไปทานยี่ห้ออื่นแล้วดูเหมือนถูกกว่าแต่จริงจริงแล้วมันอาจจะไม่ได้อะไรเลยเหมือนท่านกินแป้งอะครับ,เพราะจริง ๆ แล้วมันต้องอยู่ในมาตรฐานการผลิตที่ค่อนข้างสูงนะครับ
