true_text,pred_text
สวัสดีครับ,สวัสดีครับ
สวัสดีครับ,เชิญ
ขอต้อนรับลงทุนนะครับ เข้าสู่งาน,ก็จะรับนักลงทุนนะครับเข้าสู่งาน
opportunity day นะครับ,ขอบคุณที่ติดตัวเองนะครับ
ผมนัท ณัฐสิทธิ์,รัฐ รัฐจิตร และ ข่าว
นะครับ เป็นนักลงทุนนะครับ,เป็นหลักวงทุนนะครับ
ส่วนท่านนี้เป็นคุณวิรัช,ถ้า นี้ เป็น คุณ บุรัส รอบ รอบ
รอบรับทําเป็น gfo ครับ,รับรองความเป็นจีโรครับ
สวัสดีครับ,สวัสดีครับ
ครับ ขอบคุณทางตลาดนะครับ,ขอบคุณทั้งตลาดเลยครับ
ที่ให้โอกาสทางบริษัท,ให้ ลง จาก ทาง บริษัท
กลุ่มบริษัท ทริพเพิลไอ,มันบังเอิญออกจากใบรถ
โลจิสติกส์ จํากัด มหาชน,ที่คิดลงกลับมา
นะครับ ได้มา,ขับได้มาก
แจ้งเรื่องผลประกอบการของกลุ่มธุรกิจนะครับในรอบเก้าเดือนแล้วก็ไตรมาสที่สามประจําปี2566 นะครับนะครับก่อนอื่นก็เริ่มอาร์เจนด้านะครับจะให้ทางคุณณัฐสิทธิ์ซึ่งเป็นฝ่ายนักลงทุนสัมพันธ์ของเรานะครับได้มาแจ้งเรื่องข้อมูลว่ากลุ่มธุรกิจของทริพเพิลไอ,เรื่องผลประกอบการของกลุ่มธุรกิจนะครับในโลก เก้า เดือน แล้วก็ ตรา ยมาธิ สาม ประจำปี สมัย พฤหัส สิบ หก นะครับ นะครับ คนอื่น ก็ เริ่ม ใน เจนด้า นะครับ จะ ให้ ทาง คุณ นัท สิทธิ์ ซึ่ง เป็น ฝ่าย ด้าน บุคคล สม พันธ์ ของเรา นะครับ ได้ มา แจ้ง เรื่อง ข้อมูล ว่า กลุ่มธุรกิจ ของ ที่ ไป โลก ที่
โลจิสติกส์จํากัดมหาชนได้ทําเกี่ยวกับอะไรบ้าง,สิทธิจำกัดมหาชนได้ทำเกี่ยวอะไรบ้างลง
รวมทั้งมีไทม์ไลน์เกี่ยวกับเรื่อง,ต้องมีทำบายเกี่ยวกับเรื่องเวลา
ตั้งแต่เข้าตลาดนะครับ,แต่เข้าตลาดนะครับเพื่อน
เพื่อเป็นข้อมูลสําหรับนักลงทุนที่สนใจนะครับ,เป็นข้อมูลสำหรับนักลงทุนที่สนใจนะครับ
ก็ให้ทางคุณทักษิณ,พอให้การคุณได้ทุกสิ่งก็ช่วย
ส่วนของผมเองจะไป,สอง ผมเองจะเป็น
เริ่มในส่วน,เป็น ส่วน พัฒนา
part ที่ 2,สอง ไป เรื่อย
เป็นเรื่องของผลประกอบการ,ของผลประกอบการ
รวมทั้งต่อเนื่องไปถึง,บางครั้งก็ดึงไปถึง
industry outlook,ด้าน อาวุธ วัด ตรงนี้
แล้วก็รวมทั้งเป็นอัพเดทการลงทุนของกลุ่มบริษัทที่มีในปัจจุบัน,รวมทั้งเป็นอัปเดตการลงทุนของหุบประสาทที่มีในปัจจุบัน
ก็จะให้ทางคุณณัฐสิทธิ์เริ่มได้เลยครับ,ก็จะให้ทางคุณนัทสิทธิ์เริ่มได้เลยครับ
ขอบคุณครับ,โอเค
อันนี้เราอยากพามาดู,ที่เราจะเอามาดูดู
business timeline,มีชื่อ คำราย นะครับ
นะครับ ว่าที่ผ่านมาเนี่ย,ว่าที่ผ่านมาเนี่ย
บริษัทของเราได้ลงทุนอะไรไปบ้าง,บริษัทของเราเป็นอายุทุกข์อะไรไปบ้าง
แล้วก็ซื้อดีลอะไรบ้าง,ก็ซื้อดีลอะไรกันบ้างแล้วก็
แล้วก็ขยายธุรกิจอะไรไปบ้างหลังจากที่เราเข้าตลาดเนี่ย,ที่ใหญ่ที่สุดอะไรไปบ้างหลังจากที่เราเข้าตลาดงาน
เราได้เริ่มเข้าตลาดในปี2017นะครับ,เราได้เริ่มทอดตลาดในปี 2017 นะครับ
แล้วก็ในปี2018เนี่ย,แล้วก็ในปี 2018 เนี่ย
เราได้เข้าซื้อบริษัทดีจีพีสิงคโปร์นะครับที่ลงทุนเกี่ยวกับธุรกิจบรรจุภัณฑ์สําหรับสินค้าอันตรายและเคมีภัณฑ์,เราได้เข้าซื้อบริษัทดีจีพีสิงคโปร์นะครับที่ลงทุนเกี่ยวกับธุรกิจบรรจุภัณฑ์สำหรับสินค้าอัตราและเคมีภัณฑ์
ซึ่งมีการขยายขอบเขตการให้บริการซึ่งแต่เดิมเนี่ยเราได้ให้บริการเพียงแค่ในภายในประเทศนะครับ,ซึ่งมีการขยาย ตอบแข็งการให้บริการซึ่งแต่เดิม เนี่ย เราให้ เราได้ให้บริการเพียงแค่ในภายในประเทศนะครับ
ต่อมาในปี 2019,ก็ มี สวน สิบ เก้า
เราได้ขยายธุรกิจ,เราได้ขยายธุรกิจ
ในการเข้าซื้อตัว,การ ข้อ ชื่อ ตัว เอ ล
altga authka ผ่านทาง sal,เอล ที จี เอ หรือว่าออสการ์ ผ่านทางเอส แอ แอล
ซึ่งเป็นการขยายธุรกิจตัวของ,ชื่อ เป็น การ ขยาย วิกฤต ตัว ของ การ สร้าง สรรค์ สรรค์ สรรค์ สรรค์ สรรค์ สรรค์ สรรค์ สรรค์ สรรค์ สรรค์ สรรค์ สรรค์ สรรค์ สรรค์ สรรค์ สรรค์ สรรค์ สรรค์ สรรค์ สรรค์ สรรค์ สรรค์ สรรค์ สรรค์ สรรค์ สรรค์ สรรค์ สรรค์ สรรค์ สรรค์ สรรค์ สรรค์ สรรค์ สรรค์ สรรค์ สรรค์ สรรค์ สรรค์ สรรค์ สรรค์ สรรค์ สรรค์ สรรค์ สรรค์ สรรค์ สรรค์ สรรค์ สรรค์ สรรค์ สรรค์ สรรค์ สรรค์ สรรค์ สรรค์ สรรค์ สรรค์ สรรค์ สรรค์ สรรค์ สรรค์ สรรค์ สรรค์ สรรค์ สรรค์ สรรค์ สรรค์ สรรค์ สรรค์ ส
gapandering นะครับ,อันดับหนึ่งนะครับ
ซึ่งแต่เดิมเนี่ย,ชื่อแต่เดิมเนี่ย เราให้
เราให้บริการเพียงแค่ตัวของ cargo,เชื่อมต่อ แค่ ตัว ของ คาร์โก้
แต่หลังจากนั้น,ถ้า ไม่ มี อ่ะ ลอง
หลังจากที่เราเข้าซื้อ,ที่เราเข้าสู่งานเรา
เราได้ไปเข้าเพิ่มในส่วนของบริการ,ก็ได้ไปเข้าเครื่องในจุดของบริการส่วนของ
ส่วนของ passenger ด้วย,พัฒนาเชิญเจอด้วย
ถัดมาในปี 19 ต่อมา,สัตว์มาได้พิษหนึ่งเจ้าต่อ
เราได้เข้าซื้อตัว allow logistics,เขาได้เข้าชื่อตัว a la logistic
management ที่ประเทศฮ่องกง,ที่ประเทศฮ่องกง
ซึ่งเป็นการขยายธุรกิจการให้บริการส่วนของ,ซึ่งเป็นการขยายธุรกิจการให้บริการส่วนของ
gsa,เออ
ไปในระดับภูมิภาคเพิ่มมากขึ้นนะครับ,ไป ไป ไป ไป ไป ไป ไป ไป ไป ไป ไป ไป ไป ไป ไป ไป ไป ไป ไป ไป ไป ไป ไป ไป ไป ไป ไป ไป ไป ไป ไป ไป ไป ไป ไป ไป ไป ไป ไป ไป ไป ไป ไป ไป ไป ไป ไป ไป ไป ไป ไป ไป ไป ไป ไป ไป ไป ไป ไป ไป ไป ไป ไป ไป ไป ไป ไป ไป ไป ไป ไป ไป ไป ไป ไป ไป ไป ไป ไป ไป ไป ไป ไป ไป ไป ไป ไป ไป ไป ไป ไป ไป ไป ไป ไป ไป ไป ไป ไป ไป ไป ไป ไป ไป ไป ไป ไป ไป ไป ไป ไป ไป ไป ไป ไป ไป ไป ไป ไป ไป ไป ไป ไป ไป ไป ไป ไป ไป ไป ไป ไป ไป ไป ไป ไป ไป ไป ไป ไป ไป ไป ไป ไป ไป ไป ไป ไป ไป ไป ไป ไป ไป ไป ไป ไป ไป ไป ไป ไป ไป ไป ไป ไป ไป ไป ไป ไป ไป ไป ไป ไป ไป ไป ไป ไป ไป ไป ไป ไป ไป ไป ไป ไป ไป ไป ไป ไป ไป ไป ไป ไป ไป ไป ไป ไป ไป ไป ไป ไป ไป ไป ไป ไป ไป ไป ไป ไป ไป ไป ไป ไป ไป ไป ไป ไป ไป ไป ไป ไป ไป ไป ไป
ในปี 2020 เนี่ยครับ,ในปี 2020 เนี่ยครับ
บริษัทเราได้เข้าซื้อธุรกิจตัว,บริษัทเราได้เข้าซื้อธุรกิจตัวการ
galaxy ranger,ที่ เวนเจอร์
ซึ่งเป็นธุรกิจ startup,ซึ่งเป็นธุรกิจสตาร์ทอัพ
ที่ลงทุนเกี่ยวกับโลจิสติกส์,ชื่อของคุณเกี่ยวกับ ลออร์จิสติกส์
ซึ่งในดีลนี้,เชื่อมายดีอยู่เนี่ย
เราได้ทั้งความรู้เกี่ยวกับสตาร์ทอัพต่างๆ,เราได้ทั้ง อ่า ความรู้เกี่ยวกับสารอัพต่างๆ
ทั้งหลอดฟิสิกส์ต่างๆ,รัฐ ที่ สิทธิ ต่าง ๆ ร่วม
รวมทั้งรู้ว่าดีลไหนที่เราควรลงทุน,ทั้งรู้ว่าดีไหนที่เราควรลงทุน
หรือว่าไม่ควรลงทุนด้วยนะครับ,หรือว่าไม่ควรหลงลงจริงด้วยล่ะครับ
ปี 2021,สองพันยี่สิบเอ็ด
ทางบริษัทเองเราเล็งเห็นว่า,ทางบริษัทเองเนี่ยเรานึงถึงว่า
เราควรจะต้องเติบโตในธุรกิจที่เป็นเกี่ยวกับภายในประเทศเพิ่มมากขึ้น,เราควรจะต้องเติบโตในธุรกิจที่เป็นเกี่ยวกับพันธุ์ประเทศเพิ่มมากขึ้น
ซึ่งโดยธุรกิจหลัก,ซึ่งโดยธุรกิจราชนั่นแหละ
เราเป็นธุรกิจที่ระหว่างประเทศซะส่วนใหญ่,เป็นธุรกิจที่ระหว่างประเทศสัดส่วนใหญ่
เราเลยหาแหล่งรายได้ใหม่ ๆ,หาหลังรายได้ใหม่ใหม่เชื่อ
ที่จะลงทุนเกี่ยวกับภายในประเทศ,ลงทุนเกี่ยวกับภายใน ภายในประเทศ
เราเดินเข้าไปลงทุนในธุรกิจตัว,เราเดินเข้าไปลงทุนในธุรกิจตัวชิพสี
ship smile,สมัย
แล้วก็ make sense,ก็มีอักเสบซื้อไป
ซึ่งเป็นธุรกิจเกี่ยวข้องกับ,ธุรกิจเกี่ยวข้องกับ
ธุรกิจขนส่งสินค้าภายในประเทศที่เกี่ยวข้องกับสินค้า,ธุรกิจ ผล ส่ง สินค้า ภายใน ภายในประเทศ ที่ เกี่ยวข้อง กับ สินค้า
e commerce,อืม
ในปี2022ครับธุรกิจของทริพเพิลไอเนี่ยก็ได้เข้าซื้อบริษัทเอเชียจีเอสเอเอ็มที่มาเลเซียซึ่งเป็นชิ้นส่วนสําคัญในรายการเพิ่มคุณความสมบูรณ์ของธุรกิจจีเอสเอในการมุ่งสู่การเป็นผู้นําในระดับภูมิภาค,ปี พันยี่สิบสองครับธุรกิจของ ธิปไลน์ เนี่ย ก็ได้เข้าซื้อ เข้าซื้อบริษัทเอเชีย จีเอสเอเอ็ม ที่มาเลเซีย ซึ่งเป็นชิ้นชวดสำคัญใน ใน ในการ เพิ่มคูณความสมบูรณ์ของธุรกิจจีเอสเอ ในการมุ่งสู่การเป็นผู้นำในระดับกลุ่มวิภาค
และต่อมาเราได้มีการทําการปรับโครงสร้างใหม่ของธุรกิจ,แล้วต่อมาเราได้เป็นการทำการปรับโครงสร้างใหม่ของธุรกิจจีน
gsa,ทีเอสเอ
ให้อยู่ภายใต้ธุรกิจภายใต้ของ ANI,อยู่ภายใต้ของธุรกิจภายใต้บริษัทของเอไน
เพื่อเตรียมตัวเข้าสู่ listed,เตรียมตัวเข้าสู่ลิสเต็ดในตา
ในตลาดหลักทรัพย์ในปีถัดไปครับ,ในปีถัดไปครับ
ส่วนในปี 2023 นั้น,ในปี พ.ศ. 2523 นั้น
ทางทริพเพิลไอเอง,tubbo.ie นะครับ
ได้เตรียมตัวในการนํา ANI,ใจเตรียมตัวในการนำ AI ขึ้น
เข้าจดทะเบียนใน,ก็คือติดลงมาก็ติดลงมา
set ภายในสิ้นปีนี้ครับ,ภายในสิ้นปีนี้ครับ
อันนี้คือธุรกิจทั้งหมดของทริพเพิลไอที่ผ่านมาจะเห็นได้ว่าเราลงทุนในธุรกิจที่เป็นโลจิสติกส์ที่มันเกี่ยวเนื่องกัน,อันนี้คือทุกสิ่งทั้งหมดของ อธิบายที่ผ่านมาจะเห็นได้ว่าเราลงทุนในทุก ในทุกสิ่งที่เป็นโนติสิกส์ที่มันเกี่ยวเนื่องกัน
ทั้งการเพิ่มขยายความสามารถในการแข่งขัน,ทั้งการเพิ่มขยายความสามารถในการเด่นขันธ์
เพิ่มในของตัว,เพิ่มในของตัว
เอ่อ,เอ่อ ครอบครัว
ขอบเขตการให้บริการและก็เซอร์วิสต่างต่างให้มันครอบคลุมเซอร์วิสโลจิสติกส์ให้ครอบคลุมทางเอเชียเพิ่มมากขึ้นครับ,การให้บริการแล้วก็สวิตช์ต่างๆให้มันครอบคลุมสวิตช์ลอร์ทิติให้ครอบคลุมทางเอเชียเพื่อมากขึ้นครับ
ในส่วนถัดไปนะครับตัวนี้จะเป็นตัวbussinessของเราทั้งกรุ๊ปของทริปเปิ้ลไอเอง,ในส่วนถัดไปนะครับ ตัวนี้จะเป็นตัวพีเช็กซ์ของเราทั้งคู่ของถิบไนท์เอง
ซึ่ง,ชื่อ
ซึ่งบริษัททริพเพิลไอโลจิสติกส์เนี่ยได้ให้บริการโลจิสติกส์แบบครบวงจรในระดับภูมิภาค,ซึ่งบริษัทที่ไมโลจิสติกส์ เนี่ย ได้ให้บริการโลจิสติกส์แบบคุกคุ้งจอดในระดับภูมิภาค
ซึ่งแบ่งเป็นสี่bussinessย่อยด้วยกันนะครับ,ซึ่งแบ่งเป็นสี่พิเศษด้อยด้วยกันนะครับ มี
มีหนึ่งเป็นAir Freightนะครับ,เป็น แอร์เฟรด นะครับ ที่นี่คือ
ชนิดที่สองเป็นChemical,ที่สองเป็นเคมีภาพ
ธุรกิจที่สามเป็นLogistics,ธุรกิจศาสตร์ เป็น โลจิสติกส์ มาเนิด
management,พระราชวัง
และธุรกิจที่สี่เป็น Sea and,การ สร้าง ความรู้ ที่ มี ความรู้ ที่ มี ความรู้ ที่ มี ความรู้ ที่ มี ความรู้ ที่ มี ความรู้ ที่ มี ความรู้ ที่ มี ความรู้ ที่ มี ความรู้ ที่ มี ความรู้ ที่ มี ความรู้ ที่ มี ความรู้ ที่ มี ความรู้ ที่ มี ความรู้ ที่ มี ความรู้ ที่ มี ความรู้ ที่ มี ความรู้ ที่ มี ความรู้ ที่ มี ความรู้ ที่ มี ความรู้ ที่ มี ความรู้ ที่ มี ความรู้ ที่ มี ความรู้ ที่ มี ความรู้ ที่ มี ความรู้ ที่ มี ความรู้ ที่ มี ความรู้ ที่ มี ความรู้ ที่ มี ความรู้ ที่ มี ความรู้ ที่ มี ความรู้ ที่ มี ความรู้ ที่ มี ความรู้ ที่ มี ความรู้ ที่ มี ความรู้ ที่ มี ความรู้ ที่ มี ความร
inland transport,มันก็จะโปรด
ซึ่งเรามาดูตัวAir Freightก่อน,มาดูตัวแอร์เสร็จก่อน
ตัวAir Freightจะแบ่งเป็นสี่ business,ว่า อาเฟ่จะแบ่งเป็นสี่พิเศษด้วย
ด้วยกันนะครับ business,พัฒนาพิเศษแรก
แรกคือตัว gsa,ก็จะมีการแบ่งแยกอยู่ตัว จีเอสเอ ลิ ส
หรือว่าตัว general sales agent,ว่า ตัว จิน น อ ล ซิ ล เอ เจ น
หรือเรียกว่าเป็นตัวแทนขายระหว่างให้แก่สายการบิน,หรือเรียกว่า เปิลต์ตูนแทนขายระหว่างให้แก่สายการบิน
ซึ่งหน้าที่ของเขาคือ,หนึ่งหน้าที่ของเขาคือ
สายการบินจะ appoint,จะแอบถอย
มาให้เราดูแลที่เป็นในฐานะ gsa,ให้เราดูแลที่เป็นอสังหาริมทรัพย์ จีเอสเอ ดูแล
ดูแลบริหารจัดการพื้นที่ใต้ท้องระวังทั้งหมดของสายการบิน,และ บริหาร จัดการ พื้นที่ ใต้ ท้อง ระวัง ทั้งหมด ของ สาย การ บิน
ในการขนส่งสินค้านะครับ,การขนส่งสินค้านะครับ
ส่วนที่ 2,สองตัว
ตัว Wholesale Freight Forwarder,ทั้งหมด เป็น
เป็นธุรกิจรับจัดการขนส่งสินค้า,เป็น ธุรกิจ รับ จัด การ เปิด ส่ง สินค้า
ซึ่งตัว hold sales flash folder,ตัวโฮเซลเฟตออกเทรดมาด้วยอีก
เอง จริงๆ,จริง ๆ แล้ว
แล้วเป็นลูกค้าของตัว,เป็นลูกค้าของตัว
gsa หรือว่า General Sale Agent,สติ๊กซ์ เอ ลัว จิ เน รัล เซิร์ฟ เอ เจียน
ส่วนที่ 3 ของแอร์นั้นก็คือธุรกิจ,อุณหภาพของแอนนั้นคือธุรกิจ
