true_text,pred_text
เรามอง คำถามถัดไป เรามอง M&A อย่างไรบ้างช่วงนี้,เรามองคอมถามต่อไป เรามอง M&A อย่างไรบ้างตรงนี้
ก็ ก็คิดว่าถ้าเอ่อ ก็จริงๆก็มีบริษัทเยอะมากเหมือนกันนะครับที่เข้ามาเสนอให้เราเข้าไปถือหุ้นบ้าง ไปซื้อกิจการบ้างนะครับ,ก็คิดว่าถ้า... เอ่อ ก็จริงๆก็มีพยาสัตว์เยอะมากเหมือนกันนะครับที่มาเสนอให้เราเข้าไปถือบุญบ้างนี่ ไปซื้อจิตจาลบ้างนะครับ
เราเองก็คิดว่าถ้ามันอยู่ในวิสัยทัศน์ของบริษัทเราก็สนใจ,คนเองก็คิดว่าถ้ามันอยู่ในวิศัยทัศของวิศัยเราก็สนใจเลย
เป็นผู้นำทางสุขภาพครบวงจรทั้งของคนและของ,เป็นทูนำเป็นผักศาสตร์ศาพาต แบบพวกมองจอมทั้ง 2 คนและก็ของ
แต่คำแนะนำนี้เข้าใจว่า ได้รับความ เอ่อ ได้รับคอมเมนท์อยู่เรื่อยๆนะครับ,แต่คำแนะนำนี้เข้าใจว่าได้รับคำคำแนะนำอยู่เรื่อยๆนะครับก็
ก็น้อมรับนะครับก็คิดว่าเราก็มีการพิจรณาอยู่ว่าเราน่าจะมี IR,ตอนน้อมับนะครับ เขาคิดว่าเราก็มีจานพิเศษอะไรอยู่ ว่าเราน่าจะมี IR
ผลการดำเนินงานช่วง Q3 และแนวโน้ม Q4 เป็นอย่างไรบ้าง อันนี้ผมพูดเท่าที่พอจะพูดได้นะครับเพื่อ,ผมจะเรียบร้อยงาช่วงคิว 3 แล้วเนวน้องคิว 4 เป็นอย่างไรบ้าง อันนี้ผมพูดเท่าที่พอจะพูดได้นะครับเพื่อน
คือคือแนวโน้มอะครับคือจริงๆแล้วรายได้กำไรเราคิดว่า,คือ ๆ แรงโน้นนะครับ คือ ๆ เราไลได้กำไรเราคิดว่า
ที่กำลังจะเกิดขึ้นใน Q3 Q4 จะเหมือน Q1 ครับ จริง จริงแล้วมันก็คือ ก็ยัง,ที่เราจะเกิดขึ้นในคิว 3 คือ 4 จะเหมือนคิว 1 ครับ จริง ๆ แล้วมันก็คือ อย่าง...
เราก็อยากจะโชว์ให้เห็นว่าถ้าเราเอาค่าโฆษณาเนี่ย,เราก็อยากจะโชว์ให้เห็นว่าถ้าเราเอาท่าข้อสนาน
กลับเข้าไปจริงจริงแล้วกำไรมันควรจะเป็นแบบนี้ แต่เราจำเป็นที่จะต้องเอาเงิน,กลับเข้าไปเนี่ย คือเขาก็ไม่ควรเป็นแบบนี้ แต่เราจำเป็นเนี่ย ถ้าเอาเงิน
เพราะว่าแบรนด์พาราเซตามอลต่าง ๆ ที่โด่งดังมาเนี่ยก็เกิดจากการยิงโฆษณาให้การรับรู้,เพราะว่าแบรนด์ทราฟเซตเตอร์มองต่างๆ ที่ด่งดังมาเนี่ย จะเป็นจากการดีข้อฟนา ให้การรับรู้
สื่อแม้กระทั่งในโรงหนัง อะไร Whatever เนี่ยค่อนข้างจะ,อ่ะ แม้แต่ถ้าไม่ลงหนัง อะไร whatever เนี่ย น้ำชาวจะ...
แต่ก็อยากจะบอกนักลงทุนว่าเราเชื่อมั่นว่า Bella para ของเราคุณภาพดีเรามีการทำวิจัยก่อนที่เราจะ Launch,ก็อยากจะบอกนักรุ่งเทศมาก เราเชื่อมั่นว่าเวลาพลาวน่ะ คุณภาพดี มีการทำวิศัยก่อนที่เราจะล้อน
 เพราะฉะนั้นแล้วเนี่ยท่านปวดเมื่อยอะไรต่าง ๆ ลองทานดูนะครับไม่จำเป็นจะต้องไปยา กินยา NSAID แรงๆ,แล้วท่านควรมุ่งอะไรต่าง ๆ นี้ลองทาดูนะครับไม่จำเป็นจะต้องไปกินยาเอ็นเซดังแรง
จริง จริงแล้วมันกินแล้วได้ผลนะครับแล้วก็แพ็คเกจจิ้งเรา,จริง ๆ แล้ว มันจะให้เราได้ผลนะครับ แล้วก็แค่จะจริง ๆ แล้ว
ไม่ มัน มันเป็นแบบ Bissell Pack ที่จะทำให้,มันเป็นแบบวิชเวอร์แผงที่จะทำให้...
คุณภาพยังคงอยู่และทำให้การดูดซึมอะไรต่าง ๆ,คุณพระพราชน์ ยังคงอยู่ แล้วก็จะทำให้การดูสูงในอย่างต่างไม่ได้
ด้อยลงจากการที่แพ็คเกจจิ้งไม่สามารถรักษาความชื้นอะไรต่าง ๆ ได้,ก็ได้ลงจากจานที่แพคเก็จจิ้งไม่สามารถรับฝากความชื้นอะไรต่าง ๆ ได้
ทำไมรายได้ส่วนที่เป็นเวชภัณฑ์และยารักษาโรคยอดขายถึงได้ลดลงนะครับ,ทำไมไรได้ส่วนนี้เป็นเวสพันธุ์และยาฮันธุ์สาหรณ์โรงยอดทหารถึงได้โลกหรือเปล่า
อันนี้ส่วนนึงเนี่ยก็เกิดจากการที่เรา เอ่อ ในครึ่งปีแรกก็ยอมรับว่าเรามีการปรับราคานะครับ,ตอนนี้ส่วนหนึ่งเนี่ยก็เกิดจากการที่เราในศึกษ์ปีแรก ยอมรับว่าเรามีการปรับราคา
แต่ว่าตอนนี้เราก็ยอมรับว่าเรากำลังจะเพิ่มประสิทธิภาพในการผลิตเพื่อจะไปลดต้นทุนการผลิตมากขึ้น,แต่ว่าตอนนี้เราก็ยอมนอกว่าเราพยายามจะเป็นเพิ่มมันสิทธิภาพในการบริษ เพื่อจะมีรสต้นถึงการบริษมากขึ้น
 เราสามารถปรับปรุงประสิทธิภาพเนี่ยในการผลิตเนี่ยในช่วง 6 เดือน,เราก็สามารถประกูลอิสลิปภาพ ในจานหุ่นเดือน ในช่วง 6 เดือน
ได้จนถึงปัจจุบันเราก็ปรับปรุงอยู่ตลอดเวลานะครับเพื่อให้,และถ้าถึงกันชุดวันเราก็ขอบคุณตลอดเวลานะครับ เพื่อให้...
เพื่อให้เขาเรียกว่า เอ่อ ในแต่ละ Batch size เนี่ยสามารถ,เพื่อให้พวกเนี่ย ในตำแหน่งแบบสิทธิ์ฝากเองเนี่ย สามารถ...
อาจจะทำได้ 97 กล่องไม่ใช่ทำได้แค่ 94 กล่องเป็นประมาณนี้นะครับ,จะทำได้ 97 กรอบ ไม่ได้ทำได้แค่ 94 กรอบ แบบประมาณนี้เลยครับ
คิดว่าในไตรมาส 3 ไตรมาส 4 จะดีขึ้นนะครับ,คิดว่าในใต้มารถขาวในมารถสีจะดีขึ้นนะครับ
โภชนเภสัชถึงได้มียอดขายลดลงก็ ก็ต้องยอมรับว่าเหมือนเหตุผลเรื่องยานะครับ,โอสนาเทศสัตว์ถึงได้มีอาศัยรถลง ก็ยอมรับว่าเหมือนเหตุผลเรื่องยานะครับ
ตั้งแต่เริ่มต้นปีมาเรามีการปรับราคาไปนะครับ,แต่ตั้งแต่ต้นปี ต้นเมื่อเนี่ย เรามีการปรับรักษาไป
ก็ ก็ ก็มีการกระทบอยู่เหมือนกัน แล้วก็เลยมีการ Revisit อยู่ว่าเราจำเป็นที่จะต้องมีการให้โปรโมชั่นอะไรต่าง ๆ กลับไป,ก็มีการกระทบอยู่เหมือนกัน แล้วก็เลยมีการมีวิศีอยู่ว่าเราจำเป็นที่จะต้องให้โปรโมชันอะเดินตาเด็กกลับไป
ในราคาเดิม หรือว่าการที่เราพยายามจะลดต้นทุนการผลิตเนี่ยลงนะครับ,เป็นราคาเดิม แต่ว่าเราพยายามที่จะลดต้นอยู่ในการผลิตนี้ลงนะครับ
ตอนนี้เราก็คิดว่าในไตรมาส 3 4 เนี่ยน่าจะกลับ,อันนี้เราก็คิดว่า ในเทมาส์ 3 สี เนี่ย น่าจะกลับ
ร้านขายยา ณ ปัจจุบันเปิดได้กี่สาขาแล้วนะครับ,ร้านขายยานักตัดสิบวันเปิดได้กี่สาขาแล้วนะครับ
ก็ปัจจุบันก็ที่เพิ่งโชว์ในสไลด์เนี่ย Little Walk น่าจะเป็นสาขาที่ 28,เพราะว่าจบันต์ซอสที่เพิ่งโชว์ในสลายนี้ เรียกจะวอกนักในสถาที 28
ที่นี้เหลืออีกแค่ 3 เดือนเนี่ยคิดว่าน่าจะเปิดได้อีกประมาณ 3-4 สาขานะครับ ปีนี้เราก็จะจบที่ 30-31,ตอนนี้เหลืออีกแค่ 3 เดือน นี่ก็คิดว่าน่าจะเบิดได้ประมาณ 3-4 สาธาระกาศปีนี้เราก็จะจบที่ 30-31
ตาม Goal Setting Theory เรามีแผนไว้ค่อนข้างสูงนะครับ,ตามโฟล์ซิตติ้งเทียวรี ความเหมือนแผนก็ค่อนข้างสูงนะครับ
เพราะฉะนั้นมันคล้ายคล้ายเราตั้งเป้าว่าจะปิดน้องน้องฝ่ายเซลล์ตั้งเป้าว่าจะปิด 120,มันแค่ไกลว่าเราตั้งเป้าว่าจะปิด น้องๆ ฝ่ายเซอร์ตั้งเป้าจะปิด 120
แต่ถ้าเราตั้งเป้าจาก 20 เป็นแค่ 30 เวลาเราตกมาจะเหลือแค่ 25 นะครับ,แต่ถ้าเราตั้งเท้าจาก 20 เป็นแค่ 30 เวลาเราตกมาจะเหลือแค่ 25 นะครับ
งั้นก็เป็นเรื่องปกติที่เราจะตั้งเป้าไว้สูงอยู่แล้ว เป็น Best case ว่าถ้าเกิดเรา,ก็เป็นเรื่องที่เราบอกติดว่าจะต้องต่อไปฝึงอยู่บนเทสเฟซว่าถ้าเกิดเรา
เราเปิดโดยไม่สะดุดอะไรไม่ว่าเรื่องของการ Landlord ส่งมอบพื้นที่ การยื่นขออนุญาตอย.เนี่ยเราจะเปิดได้เท่าไหร่,เราเปิดโดยไม่สะดุดอะไร ไม่ว่าจากเรื่องของการแรนดลอดสมอบเพื่อพี่ จากยืนขออนุญาตอร์ย่อเนี่ย เราจะเปิดได้เท่าไร
 ก็คำตอบคือเปิดได้อยู่ราว ๆ 30-31 สาขา,ก็คำตอบว่าฝืนน่าจะเปิดได้อยู่ด่าวละ 30 ถึง 31 สาทค่ะ
เพราะว่าอย่างกรณีที่ภูเก็ตก็ใช้เวลาค่อนข้างมาก,ก็ได้ลองพบว่าอย่างการณีที่ภูเก็ตก็ใช้เวลาค่อนข้างมาก
เราแล้วก็ในการที่จะออกแบบ ดีไซน์ การก่อสร้างด้วย,แล้วก็ในการที่จะออกแบบดีไซน์ และก็การสอบสร้างด้วย
Gross Profit ของร้านยา LAB Pharmacy ปัจจุบันก็ดีขึ้นเรื่อย ๆ นะครับ Gross Profit เราน่า,คอสโพฟิตของร้านยาลับฟอมมัสซี่ ปัจจุบันก็ดีขึ้นเรื่อย ๆ นะครับ คอสโพฟิตเหรอนะ
ถัดไปเป็นคำถามเกี่ยวกับโรงงายผลิตยานะครับเลื่อนขึ้นไปหน่อย,ต่อไป คำถามเกี่ยวกับโรงงานผลิตยา เริ่มขึ้นไปไหน
สำหรับโรงงานผลิตยาทั้งหมดนะครับบริษัทใช้กำลังการผลิตอยู่ที่กี่ %,สำหรับโรงงานผลิตยาทั้งหมด เป็นสัญลักษณ์ในการใช้กำลังการผลิต 20%
เอ่อ ก็ยอมรับว่าปัจจุบันใช้กำลังการผลิตไม่ ไม่ได้มากเท่าไหร่,ก็ยอมรับเลยครับว่าประจำวัติศาสตร์ใช้สมัครหลงถึงไม่ได้มากเท่าไหร่
ก็ก็ เราก็พยายาม อย่างเช่นเราที่จะมีโปรเจ็คที่เราจะทำยาตาของเราเองเนี่ย,ก็ต้อนลุกกับยังไม่เห็นเสียหลักทีมีก็จะทิ้งสิทธิ์ทั้งกันได้บรรยายธรรมอิสลามครูแออ.อิสมาแอล วิสุทธิปราณี
หรือการไปคุย partnership นะครับที่ผมเดินทางต่าง ๆ ก็คือไปคุย Partnershipเนี่ย,ก็จะไปคุยพารเนินซิปที่ผมเดินทางต่าง ๆ เนี่ยก็คือไปคุยพารเนินซิปเนี่ย
เช่นไปดูโรงงาน Lotus Pharmaceutical ของทาง,เป็นแบบนี้ ที่สุดที่จะได้รับการการตัดสิน และการการตัดสิน และการการตัดสิน และการการตัดสิน และการการตัดสิน และการการตัดสิน และการการตัดสิน และการการตัดสิน และการการตัดสิน และการการตัดสิน และการการตัดสิน และการการตัดสิน และการการตัดสิน และการการตัดสิน และการการตัดสิน และการการตัดสิน และการการตัดสิน และการการตัดสิน และการการตัดสิน และการการตัดสิน และการการตัดสิน และการการตัดสิน และการการตัดสิน และการการตัดสิน และการการตัดสิน และการการตัดสิน และการการตัดสิน และการการตัดสิน และการการตัดสิน และการการตัดสิน และการการตัดสิน และการการตัดสิน และการการต
แล้วทางเขาเองก็มีมา Audit โรงงาน 3 รอบนะครับ,แล้วทางเขาเองก็มีจานมาออดินทรงแหลม 3 รอบด้วยครับ
ก็วางแผน ประชุมร่วมกันเรื่องอะไรต่าง ๆ แต่มันต้องใช้เวลาไปหมดเลย,ก็ต้องแข่งกับประชุมร่วมกันเรื่องในเดือนต่าง แต่มันต้องใช้เวลาไปหมดเลย
Bad speech remove from dataset,การเป็นผู้มีความรวมมุกกับ
บริษัทนึงที่จีนนะครับก็ยัง On-going,อิสลัตย์หนึ่งที่มุงตีนะครับ ก็ยังอ่อนตัวเองนะครับ
ก็คิดว่าถ้ามันคืบหน้ายังไงก็จะมาเรียนในใน Opportunity Day ครั้งหน้า,ก็คิดว่าถ้ามันเคลื่อนน้อยอย่างไรก็จะมาเรียนในอ๊อคเซียนเทธีเปล่าครั้งหน้า
เรา tranfer ตำหรับยาหลาย ๆ ตำหรับไปที่อยุธยานะครับ,การปรับยาและเด็กตำหลับไปที่อายุทยานะครับ
ด้วย Field capacity อย่างเช่น Bella para ก็จะปิดอยู่ภายใต้,และก็คือ ความมี แบบเวลาพลา เนื้อศริก หรือ ภายใต้
 แล้วก็สำหรับสมุทรปราการนะครับฝั่งยาตอนนี้ก็ใช้อยู่ที่ 100% อยู่แล้ว,แล้วก็สำหรับสมุทรปาการนั้น สังหยานใช้อยู่ที่ 100% อีกแล้ว
ที่เป็นอาหารเสริมก็ยังเหลือ capacity นะครับ,ที่เป็นผลิตอาหารเสริมแล้ว ก็ยังเหลือ 5% ได้ยินนะครับ
ตอนนี้เราก็เลยเริ่มเปิดรับที่จะรับจ้างผลิตให้บริษัทมากขึ้นนะครับ ปัจจุบันเรารับจ้างผลิตให้อยู่ 2 บริษัทนะครับ,อันนี้เราก็เลยเริ่มเปิดรับที่จะรับจ้างผลิตให้บริษัทมากขึ้น คือว่าเรารับจ้างผลิตให้อยู่สองบริษัทนะครับ
ครับแต่เราก็ยอมรับว่าเราจะรับแต่รายใหญ่ ๆ นะครับ,อ่ะ เดี๋ยวเรามาลองจัดหลับได้ ฝั่งยายายกัน
เป็นบริษัทที่มาตรฐานนะครับจะไม่ได้รับทั่วไป,เป็นประชาชนที่มารถถามนะครับ เราจะไม่ได้รับทั่วไป
รับล็อตสองล็อตเงี้ย เราจะรับบริษัทที่มีแผน,หลับ หลับ หลับ หลับ หลับ หลับ หลับ หลับ หลับ หลับ หลับ หลับ หลับ หลับ หลับ หลับ หลับ หลับ หลับ หลับ หลับ หลับ หลับ หลับ หลับ หลับ หลับ หลับ หลับ หลับ หลับ หลับ หลับ หลับ หลับ หลับ หลับ หลับ หลับ หลับ หลับ หลับ หลับ หลับ หลับ หลับ หลับ หลับ หลับ หลับ หลับ หลับ หลับ หลับ หลับ หลับ หลับ หลับ หลับ หลับ หลับ หลับ หลับ หลับ หลับ หลับ หลับ หลับ หลับ หลับ หลับ หลับ หลับ หลับ หลับ หลับ หลับ หลับ หลับ หลับ หลับ หลับ หลับ หลับ หลับ หลับ หลับ หลับ หลับ
ชื่อว่าทั้งสองบริษัททุกท่านก็คงเห็นอยู่ไม่ว่าจะไทยยูเนี่ยนหรือทาง,ก็เชื่อว่าทั้งสองบิษัท พวกไทยก็เหมือนอยู่ ไม่ว่าจะไทย อินเนียน หรือทาง...
ก็ตอนนี้เราก็กำลังคุยกับอีก 2 รายนะครับที่จะเข้ามาทำการจ้างผลิต,ก็ตอนนี้เราก็มาคุยกับอีกสองลายนะครับ เป็นการที่จะเข้ามาจ้างนำลิน
