true_text,pred_text
เพิ่มจํานวนหุ้น มีการเพิ่มทุน,ตำนวนหุ่น ให้การเพิ่มถุนนะครับ
หุ้นปัจจุบันของเรามีถึง 807,มีถึง 807 ล้านคน
ล้านหุ้นนะครับ,ก็เป็นความสุขที่จะได้รับการการการการ
หุ้นเราก็ยัง,ละปะยัง
maintain อยู่นะครับ 9 เดือนก็ 60,ก็ 60 ชั่วโมง
สตางค์ หรือเฉลี่ยไตรมาสละ 20,และช่วยเหลี่ยนใต้มารณี
สตางค์นะครับ,แล้วครับ นี่ก็...
นี่ก็เป็นภาพสรุปรวมของผลประกอบการนะครับ,สรุปรวมของผลประกอบการนะครับ
ของทางกลุ่มทริพเพิลไอก็อย่างที่สรุปอีกครั้งนะครับ,กรุ่งที่ไปก็อย่างที่สุดอีกครั้งนะครับ
ก็เป็นเติบโตต่อเนื่องและเรียกว่าเป็น,เป็นตัวถอนเนื้อ และที่จะเป็นริก
record new high,ขอบคุณที่ดูให้
ของเรานะครับ,แล้ว บ๊ายบาย
ทีนี้,นี่
พอดีเห็นมีชําเลืองมีคําถามมา,คำถามมาด้วย
แล้วก็ตารางนี้ก็จะได้ให้เห็นภาพว่า,แล้วก็ตอนนี้คือจะได้เห็นภาพว่า...
มันเป็นภาพสรุปนะครับว่า,เป็นเป็นภาพสรุปนะครับว่า
ในส่วนธุรกิจของ,อืม อืม อืม อืม อืม
ที่เกี่ยวกับเรื่องภาพรวมธุรกิจที่เกี่ยวกับโลจิสติกส์เป็นยังไงครับ,ความสนใจที่เกี่ยวกับเรื่องภาพลดทุกกิจที่กับโรจิสติกเป็นยังไงครับ
ธุรกิจโลจิสติกส์ก็จะเกี่ยวพัน,ก็จะเกี่ยวกัน
2 3 เรื่องหลักๆ,ก็จะมีความสุขสำหรับเรื่องหลัก ๆ ต้องการ
แน่นอนก็คือเรื่องของอัตราค่าระวางทั้งทางเรือ,ก็คือเรื่องของอัตตาคลาวางทั้งเรือและกัน
และทางอากาศ,ขอบคุณที่ชอบครับ
นะครับก็จะเห็นว่าเอ่อเส้นกราฟที่เอ่อดูด้านบนนะครับก็จะเห็นได้ว่าเส้นสีแดงก็คือค่าระวางทางเรือจะเห็นว่าค่าวางทางเรือเนี่ยขึ้นไปพีคตอนประมาณเอ่อไตรมาสที่เอ่อเอ่อไตรมาสครึ่งปีแรกของ22นะครับว่าเริ่มหล่นลงมา,ก็เห็นว่าเส้นกราฟที่ดูด้านบนนะครับก็จะเห็นได้ว่าเส้นสีแดงก็คือข้าวระวังทางเรือเห็นว่าข้าวระวังทางเรือเนี่ยขึ้นปิดพิกตอนประมาณใต้มาที่...ใต้มาที่ครึ่งปีแรกของ 2020 นะครับว่าเริ่มโดดลงมา
เริ่มหล่นลงมาตั้งแต่,บับลงลงมาตั้งแต่
ปลายปีละ ปลายปีของ,ปลายปีของ...
22,โอ้ น่าจะได้
ไตรมาสที่สาม ก็เริ่มลงมานะครับ,อาจารย์ อ.อินดร. อ.อินดร. อ.อินดร. อ.อินดร. อ.อินดร. อ.อินดร. อ.อินดร. อ.อินดร. อ.อินดร. อ.อินดร. อ.อินดร. อ.อินดร. อ.อินดร. อ.อินดร. อ.อินดร. อ.อินดร. อ.อินดร. อ.อินดร. อ.อินดร. อ.อินดร. อ.อินดร. อ.อินดร. อ.อินดร. อ.อินดร. อ.อินดร. อ.อินดร. อ.อินดร. อ.อินดร. อ.อินดร. อ.อินดร. อ.อินดร. อ.อินดร. อ.อินดร. อ.อินดร. อ.อินดร. อ.อินดร. อ.อินดร. อ.อินดร. อ.อินดร. อ.อินดร. อ.อินดร. อ.อินดร. อ.อินดร. อ.อินดร. อ.อินดร. อ.อินดร. อ.อินดร. อ.อินดร. อ.อิน
จะเห็นว่าลงมาปักหัวดิ่งเหวเนี่ยก็คือประมาณ,นี่ก็คือประมาณ ประมาณ
ต้นปีนี้เลยครับ,ก็มีนี้เลยครับ
จากต้นปีจนไปถึงไตรมาสที่สาม เนี่ย,ตอนปีจะมาถึงใต้มาที่ 3 เนี่ย
จะเห็นว่าค่าระวางทางเรือเนี่ย,ก็คิดว่าข้าระวังทางเลือนเนี่ยแปลก
ยังไม่มีแนวโน้มที่จะโตขึ้นนะครับ,ไม่มีเนียวนมที่จะโปรดขึ้นนะครับ
แต่ถามว่าสัญญาณของไตรมาสสี่,คุณพุทธจะถามว่าสัญญาณของใต้มาสีเป็นไงบ้าง
เป็นไงไหม,และก็มีความสุขที่จะให้คุณรู้สึกดี
เราเห็นสัญญาณที่,โอ้ย เนี่ย นี่...
รายได้ โทษทีค่าระวาง,โทษที ข้าละวางนะ
จะเริ่มจะปรับเพิ่มขึ้นมา,จะเริ่มจะปลับขึ้นมา
โดยเฉพาะในส่วนค่าระวางที่ไปยังทางด้านประเทศ,โดยเฉพาะในส่วนคลาวางที่ไปอย่างต่าง ๆ ประเทศทางเทียม
ทางด้านอเมริกา,อันอื่นอันบริกา
นะครับ จากสาเหตุที่ทางด้าน,ก็จากสายเหตุที่ทางด้าน
การค้านะครับ ก็ยอมรับว่า,ก็อย่างรอบว่า...
กลุ่มประเทศอเมริกาเป็นประเทศที่เขายังมีอัตราการขายการเจริญเติบโต,อืม ประเทศอเมริกาเป็นประเทศที่เขายังมีอัตตาขายเที่ยวอันตรายต่อไป
ที่ยังดี,ก็เที่ยว...
เทียบกับทั้งโลก,ก็จะมีความสุขที่จะสามารถกลับมา
เทียบโลกยอมรับว่า,อย่าบลง อย่าบลงกล้าว
ภาพรวมโลกยังไม่ค่อยได้ดีนะครับ แต่ว่าของอเมริกาก็ประเทศที่เขายังมีโอกาสที่จะเติบโตอยู่ ก็ทําให้ค่าระวางในส่วนของ,ก็ทำให้ค่าระวังในส่วนของ...
ที่จะเรียกว่าทางเอเชียไปทางอเมริการวมทั้งประเทศไทยเนี่ยก็เป็นแนวโน้มที่จะปรับตัวในทิศทางบวกแล้วก็ประกอบกับเนี่ยเราไปดูข้อมูลมาว่าคือทั้งเอ่ออเมริกากับจีนเนี่ยเขาก็เป็นคู่ค้าสัมพันธ์ระหว่างกันแต่ว่าเขาก็มีตั้งเรื่องกําแพงภาษีนะครับมี,ทางอเมริกากับทางจีน เค้าก็เป็นคู่ค่าสำคัญระหว่างกัน แต่ว่าเค้าก็มีตั้งเรื่องแผงประสีนะครับ มีความสัมผัส มีความสัมผัส มีความสัมผัส มีความสัมผัส มีความสัมผัส มีความสัมผัส มีความสัมผัส มีความสัมผัส มีความสัมผัส มีความสัมผัส มีความสัมผัส มีความสัมผัส มีความสัมผัส มีความสัมผัส มีความสัมผัส มีความสัมผัส มีความสัมผัส มีความสัมผัส มีความสัมผัส มีความสัมผัส มีความสัมผัส มีความสัมผัส มีความสัมผัส มีความสัมผัส มีความสัมผัส มีความสัมผัส มีความสัมผัส มีความสัมผัส มีความสัมผัส มีความสัมผัส มีความสัมผั
ส่วนของทางอเมริกาก็มีประกาศว่าเขาจะชะลอเรื่องการเพิ่มอัตราภาษีกับสินค้าบางตัว,การเผิดประสิทธิ์ สินค้าปันตัวกับประสิทธิ์ สินค้าปันตัวกับประสิทธิ์
โดยเฉพาะสินค้าเวชภัณฑ์กับทางจีน ก็ทําให้ผู้ส่งออกจีนก็จะรีบนําส่งออกสินค้าไป ก็จะทําให้ภาพรวมค่าระวางทุกคนก็เริ่มกลับมา,เฉพาะสินค้าวิจักษ์ปัญหาทางจีน จะทำให้ผู้ส่งออกจีน จะรีบนำส่งออกสินค้าไป จะทำให้ท่าบรุมคลาวหลวง ทุกคนจะเริ่มกลับมา
จองระวางเพื่อจะรีบส่งในช่วงไตรมาสที่สี่มากขึ้น,ก็จะรีบส่งในช่วงใต้มันที่ 4 มากขึ้น
ก็ทําให้เหมือนสัญญาณว่าไตรมาสที่สี่นะครับก็จะเริ่มจะพีคขึ้นมา เราเริ่มเห็นสัญญาณตรงนี้ตั้งแต่เรียกว่าปลายไตรมาสที่สามนะ โดยเฉพาะเดือนเก้าเสถียรภาพที่มันไม่ชัดเจนนะครับ,ที่สุดที่จะทำให้เหมือนสัญญาณว่า ใต้มาที่ 4 นะครับก็จะเริ่มเจ็บพิกขึ้นมาแล้วเริ่มเห็นสัญญาณตรงนี้ตั้งแต่เรียกว่า ปลายใต้มาที่ 3 นะครับโดยเฉพาะเดียน 9 เสียงภาพที่มันโดยชัดเจนนะครับ
แล้วก็สอดคล้องไปดูตัวเลขเส้นสีน้ําเงินก็คือเป็นเรื่องของค่าระวางทางอากาศ,แล้วก็สอดคอมไปดูตัวเลขสันสินะเมืองก็คือเป็นเรื่องข้าวระวังทางอากาศ
ก็จะเป็นค่าระวางเช่นเดียวกัน ทางอากาศจะเห็นว่า,การเจ้นว่า
มันจะไม่ได้สวิงเยอะเหมือนทางเรือ เพราะว่าทางอากาศจะมีปัจจัยอันหนึ่ง ซึ่งมีอยู่ข้างล่างคือว่าเนื่องจาก,อาจจะไม่ได้สวิงเยอะเหมือนทางเรือเพราะว่าทางอาการจะมีปัจจัยอันเดิมซึ่งกำลังเป็นอาคุว่า
ทางอากาศมันต้องใช้เครื่องบินในการขนส่ง,มันต้องใช้เครื่องบินีอาศวนส่ง
ปัจจุบันเนี่ยจํานวนเครื่องบินที่มาบินเนี่ยเทียบกับปีก่อนหน้าที่จะเกิดวิกฤตการโควิดเนี่ยยังไม่กลับมาปกติ ขณะที่สายเรือเนี่ยจํานวนกองเรือของเขาเพิ่มขึ้นเพราะว่าวิกฤตการโควิดเขาไม่จําเป็นต้องมีลดหรือเพิ่มอะไรต่างต่างนะครับ งั้นเนี่ย,ปัจจุบันนี่จำนวนเครื่องบินที่เมืองบินเนี่ยเทียบกับปีก่อนหน้าที่จะเกิดถึงวิธีการโควิดเนี่ยยังไม่กลับมาปกติขนาดที่สายเรือเนี่ยจำนวนกองเรือของเขาเพิ่มขึ้นเพราะว่าวิธีการโควิดคงไม่ต้องเป็นต้องมีรถอยู่เพิ่มอะไรต่าง ๆ นะครับ
ในตัวของทางอากาศนะครับ,การต่อไป ต่อไป ต่อไป
เราก็เห็นสัญญาณเช่นเดียวกัน ได้เหตุผลเช่นเดียวกันนะครับ เราเห็นว่า,เราก็เห็นสัญญาณเช่นเดียวกัน ได้เหตุผลเช่นเดียวกันนะครับ และเห็นว่า...
ในตัวของค่าระวางนี้,อาจารย์นิยม
เริ่มจะมีสัญญาณที่จะ,กำจัดเห็นการพิเศษ
ขยับตัวขึ้นเช่นเดียวกันครับ ก็ในรูทโดยเฉพาะที่เป็น,เช่นเดียวคันครับ ต้องได้รู้ตัวเฉพาะที่เป็น...
ทางไกลคือไปทางอเมริกา,อาจารย์ อ.อินดร. อ.อินดร. อ.อินดร. อ.อินดร. อ.อินดร. อ.อินดร. อ.อินดร. อ.อินดร. อ.อินดร. อ.อินดร. อ.อินดร. อ.อินดร. อ.อินดร. อ.อินดร. อ.อินดร. อ.อินดร. อ.อินดร. อ.อินดร. อ.อินดร. อ.อินดร. อ.อินดร. อ.อินดร. อ.อินดร. อ.อินดร. อ.อินดร. อ.อินดร. อ.อินดร. อ.อินดร. อ.อินดร. อ.อินดร. อ.อินดร. อ.อินดร. อ.อินดร. อ.อินดร. อ.อินดร. อ.อินดร. อ.อินดร. อ.อินดร. อ.อินดร. อ.อินดร. อ.อินดร. อ.อินดร. อ.อินดร. อ.อินดร. อ.อินดร. อ.อินดร. อ.อินดร. อ.อินดร. อ.อิน
แล้วก็อย่างที่บอกว่า,ก็อย่างที่บอกว่า
ในไตรมาสปกตินี่คือเรียกว่า,แต่ใจมากจากปกติเนี่ยคือเรียกว่า
การส่งออกนําเข้าหรือสัญญาณค่าระวางเนี่ยมันจะเริ่มดีในช่วงที่ว่าพีคซีซั่นตั้งแต่เอ่อคิวไปไตรมาสที่สาม,อาหารสมหองน้ำเท่าหรือผลงานข้าวระหว่างนี่มันจะเริ่มดีในช่วงเวลาพิกซีซันตั้งแต่คิวไป ตั้งแต่มาที่ 3 ตั้งแต่ 5
แต่ปีนี้ยอมรับว่าไตรมาสที่สามยังไม่สัญญาณพีค แต่ว่าตั้งแต่เดือนเก้าเราเริ่มเห็นสัญญาณมันเริ่มปรับขึ้นละ,แต่ปีนี้อำราธิกษ์ไปมันที่สหายังไม่สัญญาณกิจแต่ว่าตั้งแต่เดือนเก้าเราเริ่มเห็นสัญญาณมันเริ่มตกขึ้นแล้ว
ก็ลือว่าการส่งออกช่วงพีคอาจจะขยับตัวไปเป็นประมาณไตรมาสสี่,การส่งออกช่วงปีอาจจะขยับตัวออกไปเป็นประมาณใต้มาสี
งั้นไตรมาสสี่ปีเนี้ยนะครับเราก็คาดว่าทั้งค่าระวาง,แต่มาสตรีปีนี้นะครับ เราคัดว่าทั้งท่าระหว่าง
มันน่าจะสัญญาณโตขึ้นทั้งทางเรือและทางอากาศ,โปรดติดตามตอนต่อไป
แต่คงไม่โตขึ้นจากปีก่อนหน้านะครับ แต่เรามองว่าสัญญาณเป็นแนว,คงไม่โตขึ้นแบบ อือ จากปีก่อนหน้านะครับ แต่เรามองวัฒนญาณเป็นแนว
จะเติบโตขึ้นแน่ ๆ แล้วก็โดยเฉพาะทางบริการ,และเฉพาะทางเวลาเจอศาลาที่จะโดดขึ้นแน่ แน่ ๆ
จะสูงขึ้นกว่าเทรดอื่นนะครับ,กว่าเทศอื่นนะครับ
แล้วไปดูถัดมานะครับ,ไปดูต่อตามมานะครับ
จากที่สัญญาณค่าระวางสูงขึ้นนะครับ ก็ดูในส่วนของตัวเราเอง ถ้าประเทศไทยนี่เราต้องให้บริการก็คือ,ที่สัญญาณครั้งล่างสุดขึ้นนะครับ ก็ดูในส่วนของตัวเราเอง ถ้าประเทศไทยเนี่ย เราต้องให้บริการก็คือ
ผู้ส่งออกนําเข้า 100 ตัวเลขของการส่งออก จะเห็นว่าตัวเลขส่งออกของเรานี่,กำลังจะส่งออก เดี๋ยวตัวเลขส่งออก
ของเราทั้ง 3 ไตรมาส,ตั้ง 3 ตัวอีกมาก
ถ้าเทียบกับปีที่แล้ว,ก็พีแล้วนะ ติดตามตอนต่อไป
ติดลบตลอดเลยครับ ไตรมาสหนึ่ง,ไฟมาร์ด 1 เอาลบไป
ลบ4.5% ไตรมาสสอง ลบ 6%,อาจารย์ อินิสัน อัลลัน อ.อินิสัน อ.อินิสัน อ.อ.อ.อ.อ.อ.อ.อ.อ.อ.อ.อ.อ.อ.อ.อ.อ.อ.อ.อ.อ.อ.อ.อ.อ.อ.อ.อ.อ.อ.อ.อ.อ.อ.อ.อ.อ.อ.อ.อ.อ.อ.อ.อ.อ.อ.อ.อ.อ.อ.อ.อ.อ.อ.อ.อ.อ.อ.อ.อ.อ.อ.อ.อ.อ.อ.อ.อ.อ.อ.อ.อ.อ.อ.อ.อ.อ.อ.อ.อ.อ.อ.อ.อ.อ.อ.อ.อ.อ.อ.อ.อ.อ.อ.อ.อ.อ.อ.อ.อ.อ.อ.อ.อ.อ.อ.อ.อ.อ.อ.อ.อ.อ.อ.อ.อ.อ.อ.อ.อ.อ.อ.อ.อ.อ.อ.อ.อ.อ.อ.อ.อ.อ.อ.อ.อ.อ.อ.อ.อ.อ.อ.อ.อ.อ.อ.อ.อ.อ.อ.อ.อ.อ.อ.อ.อ.อ.อ.อ.อ.อ.อ.อ.อ.อ.อ.อ.อ.อ.อ.อ.อ.อ.อ.อ.อ.อ.อ.อ.อ.อ.อ.อ.อ.อ.อ.อ.อ.อ.อ.อ.อ.อ.อ.อ.อ.อ.อ.อ.อ.อ.
แต่ไตรมาสสาม จะเห็นว่าตัวอัตราลบมันบางมากแล้ว,แกะใจมาก สาม เห็นว่าตัวอตารกมันป่ามมากแล้ว
พอดูไตรมาส,ม.ค
สี่ เราก็ได้ดูไตรมาสสี่ ปีที่แล้ว ไตรมาสสี่,แล้วก็ได้ดูใต้มาสิบี อ่ะ ไปมาสิละ
ปีที่แล้วคือช่วงที่,ก็คือ จรวดพี่
ค่าระวางตกต่ํา แล้วก็,ก็วางตกตามแล้วก็...
ยอดส่งออกนําเข้าเรา,ของออนุญาต
ลดเป็นประวัติการณ์ต่ํา,ก็ดอกเป็นวัติการทำเก็บ
7 หมื่นล้านบาท,บาท
อยู่ที่ 60000,"อันตรายที่ 60,000"
65000,อืม...
ล้านเหรียญสหรัฐนะ โทษทีนะ,อันเลียนสารรัฐทดทิน
ไม่ได้เป็นบาทนะครับ,อื้อ อื้อ อื้อ อื้อ อื้อ อื้อ อื้อ อื้อ อื้อ อื้อ อื้อ อื้อ อื้อ อื้อ อื้อ อื้อ อื้อ อื้อ อื้อ อื้อ อื้อ อื้อ อื้อ อื้อ อื้อ อื้อ อื้อ อื้อ อื้อ อื้อ อื้อ อื้อ อื้อ อื้อ อื้อ อื้อ อื้อ อื้อ อื้อ อื้อ อื้อ อื้อ อื้อ อื้อ อื้อ อื้อ อื้อ อื้อ อื้อ อื้อ อื้อ อื้อ อื้อ อื้อ อื้อ อื้อ อื้อ อื้อ อื้อ อื้อ อื้อ อื้อ อื้อ อื้อ อื้อ อื้อ อื้อ อื้อ อื้อ อื้อ อื้อ อื้อ อื้อ อื้อ อื้อ อื้อ อื้อ อื้อ อื้อ อื้อ อื้อ อื้อ อื้อ อื้อ อื้อ อื้อ อื้อ อื้อ อื้อ
