true_text,pred_text
"เพื่อให้เกิดความมั่นใจ
ความเสี่ยงมันจะลดลงนะครับ",เพื่อให้เกิดความมั่นใจ ความเสี่ยงมันจะลดลงนะครับในเรื่องของ
"ในเรื่องของการเปลี่ยนแปลงของค่าเงินจะเท่าไหร่
มันก็อยู่ในเรื่องการทํา swot ไปและ",เรื่องของการเปลี่ยนแปลงของค่าเงินจะเท่าไหร่มันก็อยู่ในเรื่องการทำสวอร์ปไปแล้ว
"นะครับ มันมีทั้งขาเข้าขาออก
ผสมผสานบาลานซ์กันไปนะครับ",มันมีทั้งคาเข้าคาออกผสมผสานมาล้านเกินไป
"ส่วนที่สามอ่ะ เรามีธุรกิจ
อยู่ในแต่ละประเทศ",ส่วนที่สาม อะ เรามีธุรกิจอยู่ในแต่ละประเทศ
"เราก็พยายามให้แต่ละประเทศเนี่ยนะครับ
เป็นธุรกิจที่ไปใช้สินเชื่อในแต่ละประเทศ",ก็พยายามให้แต่ละประเทศเนี่ยนะครับเป็นธุรกิจที่ไปใช้สินเชื่อในแต่ละประเทศที่เรา
"ที่เรามีการลงทุนในประเทศนั้น ๆ
เพื่อจะลดความเสี่ยงในส่วนนี้ไป",ก็มีการลงทุนในประเทศนั้นๆเพื่อจะลดความเสี่ยงในส่วนนี้ไป
"อันนี้คือมาตรการที่เราทํามาโดยตลอด
นะครับ",นี่คือมาตรการที่เราทำมาโดยตลอดนะครับ
"แล้วยังมั่นใจว่ามาตรการสามประการเนี่ย
น่าสามารถที่จะเอาอยู่ นะครับ",ต้องมั่นใจว่ามัธกัตสัมประการเนี่ย น่าสามารถที่จะเอาอยู่นะครับ
"ในส่วนที่สองคือต้นทุนการผลิต
จะเห็นว่าต้นทุนการผลิตเนี้ยน้ํามันมันก็ลงมา",ในส่วนที่สองคือต้นทุนการผลิตจะเห็นว่าต้นทุนการผลิตเนี่ยน้ำมันมันก็ลงมา
"น้ํามันมันก็ยังขึ้นถ้าเปรียบเทียบกับปีอ่อนปีก
year on year ด้วยซ้ํานะครับ",มันก็ยังขึ้นถ้าปีกเทียบกับปีอ่อนปีกเยี่ยอ่อนเยี่ยด้วยซ้ำนะครับ
"แต่เราก็ยังสามารถทํา gp
ขึ้นมาได้ถึง 34 นะครับ",เราก็ยังสามารถทำจีพีขึ้นไปได้ถึงสามสิบสี่ นะครับ
" 32.9 เปอร์เซ็นต์
นะครับ",สิบสองจุดเก้าเปอร์เซ็นต์เนี่ย นะครับ
"ในแง่เชิงของการดําเนินงาน
ถ้าเราดูจากทางด้านของการเปลี่ยนแปลงในเรื่องของน้ํามงน้ํามันจะเห็นว่าในช่วงของ",แง่เชิงของการดำเนินงานถ้าเราดูจากทางด้านของการเปลี่ยนแปลงในเรื่องของน้ำมันจะเห็นว่าในช่วงของควอเตอร์นะครับ
"นะครับ Quater ที่สามเนี้ยมันก 11 กับ 82 ลดลงมานิดหน่อยนะครับ
แต่เราสามารถเพิ่มจีพีไปได้ถึงสามสี่จุดสเปอร์เซ็นต์",ที่สามเนี่ยมันก็สิบเอ็ดก็แปดสิบสองลดลงมานิดหน่อยนะครับแต่เราสามารถเพิ่ม ไปได้ถึงสามสี่จุดสี่เปอร์เซ็นต์
"เห็นมั้ย น้ํามัน 78
เราได้ 31.4",เก็บแบบน้ำมันเจ็ดสิบแปด รองเท้าที่สามเป็นจุดสี่
"พอมันขึ้น 91.8
เราก็ยังได้ 31.4",เมื่อ คืน เก้า สิบ จุด แปด เราก็ ยัง ได้ สาย เป็น จุด สี่
"พอมันลงมาหน่อย
แหมเป็นประโยชน์กับเราก็ได้สามสี่จุดสี่",พอมันลงมาหน่อย แหม เป็นประโยค เราก็ได้สามสี่จุดสี่ อันนี้ก็
"อันนี้ก็จะเป็นส่วนหนึ่งที่เราพยายามที่จะใช้ในเรื่องเกี่ยวกับวัตถุดิบต่างๆ
นะครับ",นี่ก็จะเป็นส่วนหนึ่งที่เราพยายามที่จะใช้ในเรื่องเกี่ยวกับวัตถุดิบต่างๆ นะครับ
"ในส่วนที่เรามีซอสซิ่งวัตถุดิบทั่วโลก
เราถึงได้รู้เราได้กลิ่นเร็ว",ในส่วนที่เรามีสอร์ซซิ่งวัตถุดิบทั่วโลกเราถึงได้รู้เราได้กลิ่นเหลว
"นะครับว่ามันจะเข้าออกช้ายังไง
แต่อย่างน้อยที่สุดมันก็ขึ้นอยู่กับความเสี่ยง",ว่ามันจะเข้าออกช้ายังไงแต่อย่างน้อยที่สุดมันก็ขึ้นอยู่กับความเสี่ยง
"เสี่ยงที่มากสุดหน่อย
วัตถุดิบที่ต้องระมัดระวังมากหน่อย",ที่มากสุดหน่อยวัตถุดิบที่ต้องระวังระวังมากหน่อยก็คง
ก็คงที่เป็นอัตราส่วนที่ใช้จาก,ที่เป็นอัตราส่วนที่ใช้จากทางด้านของโปลิมเมอร์ที่มาจากน้ำมัน
"ทางด้านของโพลิเมอร์ที่มาจากน้ํามันมากหน่อยก็คือพวกทางด้านของอีพีพี
ซึ่งเป็นแพ็คเกจจิ้ง นะครับ",พวกทั้งด้านของอีพีพีซึ่งเป็นแพ็คเกจจริงนะครับ
"ส่วนแอโรเฟคเอง
เรามีมาตรฐานในด้านของกําไรขั้นต้นเราสูง",ส่วน aerofex เองเรามีมาตรฐานในด้านของกำไรขั้นต้นเราสูง
"นะครับ เป็นนวัตกรรม
กับทางด้านของตัว aero klas tjm",นะครับ เป็นนวัตกรรมกับทางด้านของตัว aero class dgm ผู้
"พวกเนี้ย มันก็มี gp
ที่ค่อนข้างสูงนะครับ",มันก็มี ที่ค่อนข้างสูงนะครับ เพราะฉะนั้น
"เพราะฉะนั้นในอัตราส่วนของที่ผลิตภัณฑ์ที่มาจากทางด้านของน้ํามันเนี่ย
มันจะมีอัตราส่วนน้อยกว่าอีพีพี",เพราะฉะนั้นมีอัตราส่วนของที่ผลิตภัณฑ์ที่มาจากทางด้านของน้ำมันเนี่ยมันจะมีอัตราส่วนน้อยกว่าอีพีพี
"เพราะฉะนั้นน่ะ
เราสามารถที่จะบริหารจัดการได้นะครับ",เพราะฉะนั้น เราสามารถที่จะบริหารจัดการได้นะครับ
"ในเรื่องของ เอ่อ
และแนวโน้มวัตถุดิบเนี่ย ในช่วง",ในเรื่องของ เอ่อ และแนวโน้มวัตถุดิบเนี่ยในช่วง
"ปีนี้ ไตรมาส 4 เราขึ้นไปเนี่ย
ตั้งแต่ปลายไตรมาสสามและ",ปีนี้นะครับ ไดม้าสี่เราขึ้นไปเนี่ย ตั้งแต่ปลายไดม้าสามแล้ว ถึงแต่
"ถึงไตรมาส 4 ขึ้นไปเนี่ย
วัตถุดิบต่างๆ",มาตรศรีขึ้นไปเนี่ย วัตถุดิบต่างต่างก็เลือก
"ก็เริ่มลดลงมานะครับ
ซึ่งมันลดลงมา year on year",ลดลงมานะครับซึ่งมันลดลงมาเยี่ยนเยี่ย
"ลดลงมาทางด้านของ qq ด้วย นะครับ
มีบางตัวเท่านั้นที่ยังขึ้นมา",ลดลงมาทางด้านของคิวคิวด้วย นะครับมีบางตัวเท่านั้นที่ยังขึ้นมา
"แต่โดยส่วนใหญ่นะครับ
มันก็จะมีแนวโน้มที่ลดลงมา",ส่วนใหญ่นะครับมันก็จะมีแนวโน้มที่ลดลงมาทำให้
"ทําให้เราน่าจะเป็นประโยชน์ต่อต้นทุน
วัตถุดิบต่าง ๆ ที่",ให้เราน่าจะเป็นประโยชน์ต่อต้นทุนวัตถุดิบต่างต่างที่ ที่
"ที่ต้องไปแลกกับทางด้านของ
เรื่องค่าใช้จ่ายต่าง ๆ",ต้องไปแลกกับทั้งนั้นของเรื่องค่าใช้จ่ายต่างต่างที่เกิดขึ้น
"ที่เกิดขึ้นอย่างที่คุณปภาวดีได้ให้ข่าวสารไปแล้วนะครับว่า
ในช่วงของ การขาดแคลน",อย่างที่คุณประภาวดีได้ให้ข่าวสารไปแล้วนะครับว่าในช่วงของการขาดแคลนแรงงาน
"แรงงานด้วยนะครับ
ในขณะที่มีการค่าใช้จ่ายเรื่องของค่าเช่า",ด้วยนะครับในขณะที่มีการคัดใช้จ่ายเรื่องของค่าเช่า
"ค่าโลจิสติกส์ต่าง ๆ
ที่มันสูงในปีที่ผ่าน ๆ มานะครับ",โลจิสติกซ์ต่างๆ ที่มันสูงในปีที่ผ่านๆ มานะครับ
"ค่าแรง ยังไงก็ยังขึ้นสูงอยู่
เพราะเรายังไงก็ต้องดูแลทีมงานทุกคน",ถ้าแรงยังไงก็ยังขึ้นสูงอยู่เพราะเรายังไงก็ต้องดูแลทีมงานทุกคนให้ขึ้น
"ให้เขาเนี่ยมีความมั่นคงในการทํางานกับเรานะครับ
แล้วก็มีความ",เขาเนี่ยมีความมั่นคงในการทำงานกับเรานะครับแล้วก็มีความเจริญ
"เจริญเติบโตก้าวหน้าไปพร้อมกับเราได้ด้วยนะครับ
เพราะ เมื่อเรามีความมั่นคง",เติบโตก้าวหน้าไปพร้อมกับเราได้ด้วยนะครับเพราะเมื่อเรามีความมั่นคง
"มั่งคั่ง ยั่งยืนเกิดขึ้น
เพราะเราจะช่วยกันทําให้",มั่งคั่ง ยั่งยืนเกิดขึ้นเพราะเราจะช่วยกันทำให้
"productivity ของเราสูงขึ้น
เพราะต่อหน่วยต่อคนต่อ",ให้โปรดักติวีตี้ของเราสูงขึ้นเพราะต่อหน่วยต่อคนต่อปี
"ก็จะลดลงมาได้ด้วย นะครับ
ไอ้ตรงนี้เราก็ทํามาโดยตลอด",จะลดลงมาได้ด้วยนะครับ แต่ตรงนี้เราก็ทำมาโดยตลอด
"ค่าไฟฟ้า นะครับ
ที่ทั้งหลายเนี่ย",ค่าไฟฟ้านะครับจุดดีที่ทั้งหลายเนี่ย
"เราก็เพิ่งทําสําเร็จเรียบร้อยละ
ติดตั้งโซลาร์ลูฟ",เราก็เพิ่งทำสำเร็จเรียบร้อยและติดตั้งโตลารูฟ
"ซึ่งเราก็ติดตั้งไป 18 ถึง 20 เมกะวัตต์
นะฮะ เราก็สามารถที่จะไปลด",เราก็ติดตั้งไปสิบแปดถึงยี่สิบเมกะวัตต์ นะฮะเราก็สามารถที่จะไปลดใน
"ในเรื่องเกี่ยวกับทางด้านของต้นทุนทําค่าไฟฟ้าเนี่ย
ปี ๆ นึงก็จะประหยัดได้",เรื่องเกี่ยวกับทางด้านของต้นทุนทำค่าไฟฟ้าเนี่ย ปี ๆ หนึ่งก็จะประหยัดได้
"หลาย 10 ล้านบาท
60 ถึง 80 ล้านบาททีเดียวนะครับ",หลายสิบล้านบาทหกสิบถึงแปดสิบล้านบาททีเดียวนะครับ
"ในขณะที่ถ้า คู่แข่งขันของเราหลาย
ๆ แห่ง",ขณะที่ถ้าคู่แข่งขันของเราหลายหลายแห่งไม่ได้ยิน
"ไม่ได้ติดตั้งโซลาร์ลูฟแล้ว
ค่าไฟมันขึ้นมัน เนี่ย",ติดตั้ง ส่วนละลูปแล้วถ้าปลายมันขึ้นมาด้วยเนี่ยเขา
"เขาก็โดนสองต่อนะครับ
เขาก็จะมีการแข่งขัน",เขาก็โดนส่งต่อนะครับเขาก็จะมีการแข่งขัน
"ความสามารถในการแข่งขันกับเราก็จะน้อยลง
นะครับ นี่ก็จะหนึ่ง",สามารถในการแข่งขันกับเราก็จะน้อยลง เนี่ยครับ นี่ก็จะหนึ่งเป็น
"เป็นหนึ่งประโยชน์ของเราด้วยนะครับ
ทําให้เราสามารถจะมีการเติบโตได้นะครับ",ประโยชน์ของเราด้วยนะครับทำให้เราสามารถจะมีการเติบโตได้นะครับ
"ในเรื่องของ เอ่อ
ตัวที่เป็นออโตเมชั่นนะฮะ",ในเรื่องของ อ่า ตัวที่เป็น automation นะ
"ซิสเต็มของเราเนี่ย
เราก็ใช้มาโดยตลอด",คิสเต็มของเราเนี่ยเราก็ใช้มาดูตลอดเครื่องจักร
"เครื่องจักรเครื่องกลที่เราทํามาทําให้มันมีการทํา
productivity สูงขึ้น",จากเครื่องกลที่เราทำมาทำให้มันมีการทำพอลิเคราะห์ที่สูงขึ้น
"ใช้คนที่น้อยลงนะครับ
เราก็สามารถที่จะดําเนินในธุรกิจการเติบโตได้",คนที่น้อยลงนะครับเราก็สามารถที่จะดำเนินในธุรกิจการเติบโตได้
"เรามี 3 ป นะครับ ก็ยังใช้อยู่
นะครับ ในด้านของการตลาดต่างๆ",โรมีสามปอนะครับก็ยังใช้อยู่นะครับในด้านของการตลาดต่างต่าง
"ของเรา
เราก็มีมาตรการหลายมาตรการโดยเฉพาะในส่วนของ",ของเรา เราก็มีมาตรการหลายมาตรการโดยเฉพาะใน
"aeroflex เอง นะครับ
เราก็มีหลายรุ่น",ของแอร์รถเฟกต์เองนะครับเราก็มีหลายรุ่นไม่ว่าจะเป็น
"ไม่ว่าจะเป็นรุ่นที่เกี่ยวกับทางด้านของการดําเนินงานในเรื่องของ
ultra low temperature",ก็จะเป็นรุ่นที่เกี่ยวกับทางด้านของการดำเนินงานในเรื่องของอัลตรอล เอ็มปูเรเจอร์
"หรือว่าใช้ในส่วนของท่อส่งลม
นะครับ แล้วก็ใช้ใน look",ใช้ในส่วนของท่อส่งลมนะครับ แล้วก็ใช้ในรูป
"insuration นะครับ หลาย ๆ
ส่วนเนี่ย",Insulation นะครับ หลายๆ ส่วนเนี่ย
"มันทําให้เรามีทางด้านของเครื่องมือในการเล่น
ในสู่ตลาดต่าง ๆ เหล่านี้มากอย่าง",ทำให้เรามีทางด้านของเครื่องมือในการเล่นในสู่ตลาดต่างต่างเหล่านี้มาก ยังควบคุม
"แล้วก็
สามารถกําหนดในเรื่องของราคาได้ในหลายๆ",แล้วก็สามารถกำหนดในเรื่องของราคาได้ในหลาย ๆ รุ่นของเรา
"รุ่นของเราที่มีอยู่นะครับ
ในส่วนของตลาดเราก็กว้างขยายไปทั่วโลก 100 กว่าประเทศที่เรามีเอเย่นต์",ของเราที่มีอยู่นะครับในส่วนของตลาดแล้วก็กว้างขยายไปทั่วโลกร้อยกว่าประเทศที่เรามีเอเย่นมี
"มีโรงงานก็หลายประเทศนะครับ
ทั้งจีน อเมริกา อินเดียนะครับ",โรงงานก็หลายประเทศนะครับ ทั้งจีน อเมริกา อินเดียนะครับ
"ตรงนี้ แล้วก็อีกหน่อย
ก็มีทางยุโรปนะครับ",ตรงนี้แล้วก็อีกหน่อยก็มีทางยุโรปนะครับ
"ที่ยังมีอยู่นะครับ
ส่วนทางด้านของ aero klas tjm",ยังมีอยู่นะครับส่วนทางด้านของแอร์โลกค้าทีเจเอ็มเอ็ม
"เองจริง ๆ เขาก็มีตลาด
พร้อมเติบโตแน่",จริงจริงเขาก็มีตลาดพร้อมเติบโตแน่
"ถ้าตอนนี้เราก็เติบโตอยู่แล้ว
เราก็มีการออเดอร์ต่าง ๆ",ตอนนี้เราก็เติบโตอยู่แล้วเราก็มีการออเดอร์ต่างๆ
"เราก็เข้ามาเต็ม
เราก็ทําเสาร์อาทิตย์อยู่ นะครับ",เราก็เข้ามาเต็ม เราก็ทำเสาร์อาทิตย์อยู่นะครับ
"แต่ส่วนของออสเตรเลีย
เท่านั้นเนี่ยนะครับ",แต่ส่วนของออสเตรเวียเท่านั้นเนี่ยแหละครับ
"ก็คิดว่าเขาคงจะดีขึ้นในช่วงของควอเตอร์นะฮะ
ที่ 4 ขึ้นไป นะครับ",ว่าเขาก็คงจะดีขึ้นในช่วงของควอเตอร์นะที่สี่ขึ้นไปนะครับ
"ก็น่าจะดีขึ้น นะครับ
แล้วก็ในส่วนของ south app",เพราะน่าจะดีขึ้นนะครับแล้วก็ในส่วนของซอฟต์แอพ
"ในการดีเลย์
เรื่องของทางด้านเกี่ยวกับการผลิต",ในการดีเลย์เรื่องของทางด้านเกี่ยวกับการผลิต
"นะครับ รถยนต์ในแอฟริกาใต้เนี่ย
ถ้าเค้าเริ่มผลิตได้เร็วขึ้น",นะครับ รถยนต์ในอัฟริกาใต้เนี่ย ถ้าเขาเริ่มผลิตได้เร็วขึ้นแล้ว
"เราก็สามารถ
ดําเนินธุรกิจที่มีกําไรได้เร็วขึ้นนะครับ",เราก็สามารถดำเนินธุรกิจที่มีกำไรได้เร็วขึ้นนะครับ ตรงนี้
