true_text,pred_text
เริ่มหล่นลงมาตั้งแต่,บ้านบ้านผมมาตั้งแต่
ปลายปีละ ปลายปีของ,ปล่อย ปล่อย ปล่อย ปล่อย ปล่อย ปล่อย ปล่อย ปล่อย ปล่อย ปล่อย ปล่อย ปล่อย ปล่อย ปล่อย ปล่อย ปล่อย ปล่อย ปล่อย ปล่อย ปล่อย ปล่อย ปล่อย ปล่อย ปล่อย ปล่อย ปล่อย ปล่อย ปล่อย ปล่อย ปล่อย ปล่อย ปล่อย ปล่อย ปล่อย ปล่อย ปล่อย ปล่อย ปล่อย ปล่อย ปล่อย ปล่อย ปล่อย ปล่อย ปล่อย ปล่อย ปล่อย ปล่อย ปล่อย ปล่อย ปล่อย ปล่อย ปล่อย ปล่อย ปล่อย ปล่อย ปล่อย ปล่อย ปล่อย ปล่อย ปล่อย ปล่อย ปล่อย ปล่อย ปล่อย ปล่อย ปล่อย ปล่อย ปล่อย ปล่อย ปล่อย ปล่อย ปล่อย ปล่อย ปล่อย ปล่อย ปล่อย ปล่อย ปล่อย ปล่อย ปล่อย ปล่อย ปล่อย ปล่อย ปล่อย ปล่อย ปล่อย ปล่อย ปล่อย ปล่อย
22,สงสง มาด้วย
ไตรมาสที่สาม ก็เริ่มลงมานะครับ,มากที่สามก็เริ่มลงมานะคะทีม
จะเห็นว่าลงมาปักหัวดิ่งเหวเนี่ยก็คือประมาณ,น้ำ น้ำ น้ำ น้ำ น้ำ น้ำ น้ำ น้ำ น้ำ น้ำ น้ำ น้ำ น้ำ น้ำ น้ำ น้ำ น้ำ น้ำ น้ำ น้ำ น้ำ น้ำ น้ำ น้ำ น้ำ น้ำ น้ำ น้ำ น้ำ น้ำ น้ำ น้ำ น้ำ น้ำ น้ำ น้ำ น้ำ น้ำ น้ำ น้ำ น้ำ น้ำ น้ำ น้ำ น้ำ น้ำ น้ำ น้ำ น้ำ น้ำ น้ำ น้ำ น้ำ น้ำ น้ำ น้ำ น้ำ น้ำ น้ำ น้ำ น้ำ น้ำ น้ำ น้ำ น้ำ น้ำ น้ำ น้ำ น้ำ น้ำ น้ำ น้ำ น้ำ น้ำ น้ำ น้ำ น้ำ น้ำ น้ำ น้ำ น้ำ น้ำ น้ำ น้ำ น้ำ น้ำ น้ำ น้ำ น้ำ น้ำ น้ำ น้ำ น้ำ น้ำ น้ำ น้ำ น้ำ น้ำ น้ำ น้ำ น้ำ น้ำ น้ำ น้ำ น้ำ น้ำ น้ำ น้ำ น้ำ น้ำ น้ำ
ต้นปีนี้เลยครับ,มีนี้เลยครับ
จากต้นปีจนไปถึงไตรมาสที่สาม เนี่ย,มัน มี จะ ยัง ไม่ ถึง ไป มา ที่ สาม เนี่ย จริง แล้ว
จะเห็นว่าค่าระวางทางเรือเนี่ย,ว่า ข้า ระวัง ทางเรือ เนี่ย แฟลช
ยังไม่มีแนวโน้มที่จะโตขึ้นนะครับ,ไม่ มี เงาน้ำ ที่ จะ โผล่ ขึ้น นะ ครับ
แต่ถามว่าสัญญาณของไตรมาสสี่,ถาม ว่า สัญญาณ ของ ไตรมาส สี่ เป็นไง มัน
เป็นไงไหม,ล
เราเห็นสัญญาณที่,โอ้ หินสัญญาณ อิอิ
รายได้ โทษทีค่าระวาง,ไว้ได้ แต่ทดทินค่าละวางเนี่ย
จะเริ่มจะปรับเพิ่มขึ้นมา,จะเริ่มจะปรับพักขึ้นมา
โดยเฉพาะในส่วนค่าระวางที่ไปยังทางด้านประเทศ,โดยเฉพาะในส่วนคาราวานที่ไปยังตั้งด้าน เอ่อ ประเทศหลังจาก
ทางด้านอเมริกา,นอนอมมือจ้า
นะครับ จากสาเหตุที่ทางด้าน,และ ขับ โปรด จาก สาเหตุ ที่ ทาง ด้าน
การค้านะครับ ก็ยอมรับว่า,ก็อยากบอกว่า กลุ่มนี้มีการทำงาน
กลุ่มประเทศอเมริกาเป็นประเทศที่เขายังมีอัตราการขายการเจริญเติบโต,อ่าว ประเทศอเมริกาเป็นประเทศที่เขายังมีอัตราความขายยันต์เติบโต
ที่ยังดี,ยิ่งดีว่ะ
เทียบกับทั้งโลก,ก็ต้องรู้
เทียบโลกยอมรับว่า,ลูกหย่อมรบว่า
ภาพรวมโลกยังไม่ค่อยได้ดีนะครับ แต่ว่าของอเมริกาก็ประเทศที่เขายังมีโอกาสที่จะเติบโตอยู่ ก็ทําให้ค่าระวางในส่วนของ,รวมรวมยังไม่ค่อยมีดีนะครับแต่ว่าของอเมริกาก็เป็นเพศที่เขายังมีโอกาสที่จะตัดตัวอยู่ก็ทำให้ค่าละวางในส่วนของ
ที่จะเรียกว่าทางเอเชียไปทางอเมริการวมทั้งประเทศไทยเนี่ยก็เป็นแนวโน้มที่จะปรับตัวในทิศทางบวกแล้วก็ประกอบกับเนี่ยเราไปดูข้อมูลมาว่าคือทั้งเอ่ออเมริกากับจีนเนี่ยเขาก็เป็นคู่ค้าสัมพันธ์ระหว่างกันแต่ว่าเขาก็มีตั้งเรื่องกําแพงภาษีนะครับมี,จะเรียกว่าทางเอเชียไปทางอเมริการวมทั้งประเทศไทยเนี่ยเขาเป็นแนวโน้มที่จะปรับตัวในทิศทางบวกแล้วก็ประกอบกับ เนี่ย เราไปดูข้อมูลมาว่า คือ อัน เอ่อ อเมริกาจากจีนเนี่ยเขาก็เป็นคู่ค้าสำคัญระหว่างกันแต่ว่าเขาก็มีตั้งเรื่องมาแปลงภาษีนะครับ
ส่วนของทางอเมริกาก็มีประกาศว่าเขาจะชะลอเรื่องการเพิ่มอัตราภาษีกับสินค้าบางตัว,ส่วน ของ ทาง อเมริกา ก็ มี ประกาศ ว่า เขา จะ โชว์ เรื่อง การ เอ่อ เพิ่ม หมายต่อ ภาษี สินค้า บาง ตัว กับ
โดยเฉพาะสินค้าเวชภัณฑ์กับทางจีน ก็ทําให้ผู้ส่งออกจีนก็จะรีบนําส่งออกสินค้าไป ก็จะทําให้ภาพรวมค่าระวางทุกคนก็เริ่มกลับมา,ส่วน ส่วน ส่วน ส่วน ส่วน ส่วน ส่วน ส่วน ส่วน ส่วน ส่วน ส่วน ส่วน ส่วน ส่วน ส่วน ส่วน ส่วน ส่วน ส่วน ส่วน ส่วน ส่วน ส่วน ส่วน ส่วน ส่วน ส่วน ส่วน ส่วน ส่วน ส่วน ส่วน ส่วน ส่วน ส่วน ส่วน ส่วน ส่วน ส่วน ส่วน ส่วน ส่วน ส่วน ส่วน ส่วน ส่วน ส่วน ส่วน ส่วน ส่วน ส่วน ส่วน ส่วน ส่วน ส่วน ส่วน ส่วน ส่วน ส่วน ส่วน ส่วน ส่วน ส่วน ส่วน ส่วน ส่วน ส่วน ส่วน ส่วน ส่วน ส่วน ส่วน ส่วน ส่วน ส่วน ส่วน ส่วน ส่วน ส่วน ส่วน ส่วน ส่วน ส่วน ส่วน ส่วน ส่วน ส่วน ส่วน
จองระวางเพื่อจะรีบส่งในช่วงไตรมาสที่สี่มากขึ้น,เมื่อวานขึ้น จะ รีบ ส่ง ใน ช่วง ไตรมาส ที่สี่ มากขึ้น
ก็ทําให้เหมือนสัญญาณว่าไตรมาสที่สี่นะครับก็จะเริ่มจะพีคขึ้นมา เราเริ่มเห็นสัญญาณตรงนี้ตั้งแต่เรียกว่าปลายไตรมาสที่สามนะ โดยเฉพาะเดือนเก้าเสถียรภาพที่มันไม่ชัดเจนนะครับ,ทำให้เหมือนสัญญาณว่าไตรมาสที่สี่นะครับก็จะเริ่มเก็บฟีกขึ้นมาแล้วเริ่มเห็นสัญญาณตรงนี้ตั้งแต่ เรียกว่าปลายไตรมาสที่สามนะครับโดยเฉพาะเดือนเก้าเก็บภาพที่มันไม่ชัดเจนนะครับ
แล้วก็สอดคล้องไปดูตัวเลขเส้นสีน้ําเงินก็คือเป็นเรื่องของค่าระวางทางอากาศ,ก็สอดคล้องไปดูตัวเลขสั้นสินน้ำเงินก็คือเป็นเรื่องข้าระวังทางอากาศ
ก็จะเป็นค่าระวางเช่นเดียวกัน ทางอากาศจะเห็นว่า,คุณ จะ มี พี่สาว หรือ พี่สาว คน สาว คน สาว คน สาว คน สาว คน สาว คน สาว คน สาว คน สาว คน สาว คน สาว คน สาว คน สาว คน สาว คน สาว คน สาว คน สาว คน สาว คน สาว คน สาว คน สาว คน สาว คน สาว คน สาว คน สาว คน สาว คน สาว คน สาว คน สาว คน สาว คน สาว คน สาว คน สาว คน สาว คน สาว คน สาว คน สาว คน สาว คน สาว คน สาว คน สาว คน สาว คน สาว คน สาว คน สาว คน สาว คน สาว คน สาว คน สาว คน สาว คน สาว คน สาว คน สาว คน สาว คน สาว คน สาว คน สาว คน สาว คน สาว คน สาว คน สาว คน สาว คน สาว คน สาว คน สาว คน สาว คน สาว คน สาว คน สาว คน สาว คน สา
มันจะไม่ได้สวิงเยอะเหมือนทางเรือ เพราะว่าทางอากาศจะมีปัจจัยอันหนึ่ง ซึ่งมีอยู่ข้างล่างคือว่าเนื่องจาก,อาจจะ ไม่ ได้ สวิง เยอะ เหมือน ทางเรือ เพราะว่า ท้า จ่า น่าจะ มี ปัจจัย อัน ดัง ซึ่ง ระเบียบ มาก คือ ว่า เนื่องจาก
ทางอากาศมันต้องใช้เครื่องบินในการขนส่ง,มัน ต้อง ใช้ เครื่องบิน ใน อัตรา ฝน สูง
ปัจจุบันเนี่ยจํานวนเครื่องบินที่มาบินเนี่ยเทียบกับปีก่อนหน้าที่จะเกิดวิกฤตการโควิดเนี่ยยังไม่กลับมาปกติ ขณะที่สายเรือเนี่ยจํานวนกองเรือของเขาเพิ่มขึ้นเพราะว่าวิกฤตการโควิดเขาไม่จําเป็นต้องมีลดหรือเพิ่มอะไรต่างต่างนะครับ งั้นเนี่ย,ปัจจุบัน เนี่ย จำนวนเครื่องบินที่มาพิมพ์ เนี่ย เทียบกับปีก่อนหน้าที่จะเกิดวิกฤติการโควิด เนี่ย ยังไม่กลับมาปกติ ขณะที่สายเรือ เนี่ย จำนวนกองเหลืองเขาเพิ่มขึ้นเพราะว่าวิกฤติการโควิดเขาไม่จำเป็นต้องมีโรคเหลืองเพิ่มอะไรต่าง ๆ นะครับ งั้น เนี่ย
ในตัวของทางอากาศนะครับ,ใน ตัว ขง ทาง อากาศ นะ ครับ
เราก็เห็นสัญญาณเช่นเดียวกัน ได้เหตุผลเช่นเดียวกันนะครับ เราเห็นว่า,เราก็เห็นสัญญาณเช่นเดียวกันได้เห็นผลเช่นเดียวกันนะครับ เราเห็นว่า
ในตัวของค่าระวางนี้,ในตัวของ ค่าระหว่างเนี่ย
เริ่มจะมีสัญญาณที่จะ,ต้อง จำเห็น งาน ที่ เจ้า
ขยับตัวขึ้นเช่นเดียวกันครับ ก็ในรูทโดยเฉพาะที่เป็น,ก็ จะ มี ความรู้ ที่ มี ความรู้ ที่ มี ความรู้ ที่ มี ความรู้ ที่ มี ความรู้ ที่ มี ความรู้ ที่ มี ความรู้ ที่ มี ความรู้ ที่ มี ความรู้ ที่ มี ความรู้ ที่ มี ความรู้ ที่ มี ความรู้ ที่ มี ความรู้ ที่ มี ความรู้ ที่ มี ความรู้ ที่ มี ความรู้ ที่ มี ความรู้ ที่ มี ความรู้ ที่ มี ความรู้ ที่ มี ความรู้ ที่ มี ความรู้ ที่ มี ความรู้ ที่ มี ความรู้ ที่ มี ความรู้ ที่ มี ความรู้ ที่ มี ความรู้ ที่ มี ความรู้ ที่ มี ความรู้ ที่ มี ความรู้ ที่ มี ความรู้ ที่ มี ความรู้ ที่ มี ความรู้ ที่ มี ความรู้ ที่ มี ความรู้ ที่ มี ความรู้ ที่ มี ความรู้ ที่ มี ความร
ทางไกลคือไปทางอเมริกา,ตั้งใจขึ้นไปหาไม่กะลูก
แล้วก็อย่างที่บอกว่า,แล้วก็อย่างที่บอกว่า
ในไตรมาสปกตินี่คือเรียกว่า,เด็ก ๆ มัก ปกติ เนี่ย คือ เอ่อ เรียกว่า
การส่งออกนําเข้าหรือสัญญาณค่าระวางเนี่ยมันจะเริ่มดีในช่วงที่ว่าพีคซีซั่นตั้งแต่เอ่อคิวไปไตรมาสที่สาม,น้ำ ส้ม โอ น้ำ ข้าว หรือ ผัด ยาน ข้าว ละ หวาน เนี่ย มัน จะ เริ่ม ดี ใน ช่วง เริ่ม พริก ซีส้ม ตั้งแต่ เกิด คิว ไป ไป มา ที่ สาม เด็ก
แต่ปีนี้ยอมรับว่าไตรมาสที่สามยังไม่สัญญาณพีค แต่ว่าตั้งแต่เดือนเก้าเราเริ่มเห็นสัญญาณมันเริ่มปรับขึ้นละ,ปี นี้ อำนาจ ว่า ไตรมาส ที่ สา น ยัง ไม่ สัญญาณ พีท กับ วา ส ตั้ง แต่ เดือน เก้า แล้ว เริ่ม เห็น สัญญาณ ว่า เริ่ม ปรับ ขึ้น ลา เขา แล้ว
ก็ลือว่าการส่งออกช่วงพีคอาจจะขยับตัวไปเป็นประมาณไตรมาสสี่,หรือว่าการ ส่งออก ช่วง นี้ อาจจะ เครียด ตัว ไป เป็น ประมาณ ไตรมาส สี่ เนอะ
งั้นไตรมาสสี่ปีเนี้ยนะครับเราก็คาดว่าทั้งค่าระวาง,ใจมากสิ ปี เนี้ย นะครับ เราคาดว่า ครั้ง ภาว วา
มันน่าจะสัญญาณโตขึ้นทั้งทางเรือและทางอากาศ,น่าจะ สัญญาณ โปรดพิมพ์ทั้งทางเรือทางอากาศ
แต่คงไม่โตขึ้นจากปีก่อนหน้านะครับ แต่เรามองว่าสัญญาณเป็นแนว,คง ไม่ โต ขึ้น แบบ เอ่อ อยาก ปีก่อนหน้า นะ ครับ เดี๋ยว เรามอง ว่า สัญญาณ เป็น แนว
จะเติบโตขึ้นแน่ ๆ แล้วก็โดยเฉพาะทางบริการ,ตัว ขึ้น แน่ ๆ แล้วก็ โดยเฉพาะ ทาง เมือง หลัง จาก
จะสูงขึ้นกว่าเทรดอื่นนะครับ,สูงขึ้นกว่าเทรดอีกนะครับ
แล้วไปดูถัดมานะครับ,ดูถัดมานะครับ
จากที่สัญญาณค่าระวางสูงขึ้นนะครับ ก็ดูในส่วนของตัวเราเอง ถ้าประเทศไทยนี่เราต้องให้บริการก็คือ,ที่ สัญญาณ พระ ลา สุ น ขึ้น นะ ครับ ก็ ดู ใน ส่วน ของ ตัว เรา เอง ถ้า ประเทศ ไทย เนี่ย เรา ต้อง ให้บริการ ก็ คือ
ผู้ส่งออกนําเข้า 100 ตัวเลขของการส่งออก จะเห็นว่าตัวเลขส่งออกของเรานี่,ส่วน ส่วน ส่วน ส่วน ส่วน ส่วน ส่วน ส่วน ส่วน ส่วน ส่วน ส่วน ส่วน ส่วน ส่วน ส่วน ส่วน ส่วน ส่วน ส่วน ส่วน ส่วน ส่วน ส่วน ส่วน ส่วน ส่วน ส่วน ส่วน ส่วน ส่วน ส่วน ส่วน ส่วน ส่วน ส่วน ส่วน ส่วน ส่วน ส่วน ส่วน ส่วน ส่วน ส่วน ส่วน ส่วน ส่วน ส่วน ส่วน ส่วน ส่วน ส่วน ส่วน ส่วน ส่วน ส่วน ส่วน ส่วน ส่วน ส่วน ส่วน ส่วน ส่วน ส่วน ส่วน ส่วน ส่วน ส่วน ส่วน ส่วน ส่วน ส่วน ส่วน ส่วน ส่วน ส่วน ส่วน ส่วน ส่วน ส่วน ส่วน ส่วน ส่วน ส่วน ส่วน ส่วน ส่วน ส่วน ส่วน
ของเราทั้ง 3 ไตรมาส,น้ำสามตัวมาก
ถ้าเทียบกับปีที่แล้ว,ที่ เทียบ ดอก ดีแล้ว แน่ ติด
ติดลบตลอดเลยครับ ไตรมาสหนึ่ง,ลบตลอดด้วยครับไฟม่านหนึ่งแล้วลบ
ลบ4.5% ไตรมาสสอง ลบ 6%,เปอร์เซ็นต์ ใจเม่าสอนลูกผิว เปอร์เซ็นต์
แต่ไตรมาสสาม จะเห็นว่าตัวอัตราลบมันบางมากแล้ว,เศรษฐีการเกษตรกรรมสหประชาชน
พอดูไตรมาส,ตัวอย่างมากสิ
สี่ เราก็ได้ดูไตรมาสสี่ ปีที่แล้ว ไตรมาสสี่,เรา เอ้ย ดู แต่ ม้า สี่ ปี อ่ะ ป้า ม้า สี่ แล้ว
ปีที่แล้วคือช่วงที่,ก็คือ จริง ๆ แล้ว
ค่าระวางตกต่ํา แล้วก็,ก็วางตุกต่อมกระเพาะ
ยอดส่งออกนําเข้าเรา,คุณหมอดมข้อมูล
ลดเป็นประวัติการณ์ต่ํา,เป็น หัว ติด ยาน ต่ำ เจ็ด
7 หมื่นล้านบาท,หมื่น ล้าน บาท
อยู่ที่ 60000,สิบสอง สิบห้า สิบหก สิบหก สิบห้า สิบหก สิบห้า สิบหก สิบห้า สิบหก สิบห้า สิบหก สิบห้า สิบห้า สิบห้า สิบห้า สิบห้า สิบห้า สิบห้า สิบห้า สิบห้า สิบห้า สิบห้า สิบห้า สิบห้า สิบห้า สิบห้า สิบห้า สิบห้า สิบห้า สิบห้า สิบห้า สิบห้า สิบห้า สิบห้า สิบห้า สิบห้า สิบห้า สิบห้า สิบห้า สิบห้า สิบห้า สิบห้า สิบห้า สิบห้า สิบห้า สิบห้า สิบห้า สิบห้า สิบห้า สิบห้า สิบห้า สิบห้า สิบห้า สิบห้า สิบห้า สิบห้า สิบห้า สิบห้า สิบห้า สิบห้า สิบห้า สิบห้า สิบห้า สิบ
65000,หกหมื่น ห้าหมื่น
ล้านเหรียญสหรัฐนะ โทษทีนะ,ล้าง เหรียญสาระ แต่ โทษ ทีม นั้น ไม่ ได้
